closed/Dell/code/llama2-70b-99/mlperf_config_VllmFp8/tuned_fp8_16_20240720.csv
M,N,K,libtype,solidx,soltimems,indtype,outdtype
57344,1952,8192,hipblaslt,77939,1.744382095336914,torch.float8_e4m3fnuz,torch.float16
8192,791,28672,hipblaslt,77419,0.4496740818023682,torch.float8_e4m3fnuz,torch.float16
10240,49358,8192,hipblaslt,77922,7.203606238731971,torch.float8_e4m3fnuz,torch.float16
10240,729,8192,hipblaslt,77593,0.14524115324020387,torch.float8_e4m3fnuz,torch.float16
8192,3290,8192,hipblaslt,77984,0.4156296730041504,torch.float8_e4m3fnuz,torch.float16
8192,2190,28672,hipblaslt,77927,1.0790563583374024,torch.float8_e4m3fnuz,torch.float16
10240,4666,8192,hipblaslt,77924,0.7222579002380372,torch.float8_e4m3fnuz,torch.float16
10240,2387,8192,hipblaslt,77495,0.3788231611251831,torch.float8_e4m3fnuz,torch.float16
8192,64,8192,hipblaslt,77290,0.033798548579216006,torch.float8_e4m3fnuz,torch.float16
10240,2270,8192,hipblaslt,77960,0.37340309619903567,torch.float8_e4m3fnuz,torch.float16
57344,2619,8192,hipblaslt,77948,2.3744714736938475,torch.float8_e4m3fnuz,torch.float16
10240,247,28672,hipblaslt,76898,0.21530694961547853,torch.float8_e4m3fnuz,torch.float16
8192,2537,8192,hipblaslt,77396,0.3325085401535034,torch.float8_e4m3fnuz,torch.float16
8192,1673,8192,hipblaslt,77913,0.2135563611984253,torch.float8_e4m3fnuz,torch.float16
10240,4786,8192,hipblaslt,77924,0.7287455081939698,torch.float8_e4m3fnuz,torch.float16
57344,2051,8192,hipblaslt,77952,1.9224897384643556,torch.float8_e4m3fnuz,torch.float16
57344,3186,8192,hipblaslt,77952,2.901063346862793,torch.float8_e4m3fnuz,torch.float16
8192,982,8192,hipblaslt,77870,0.14661669731140137,torch.float8_e4m3fnuz,torch.float16
57344,4409,8192,hipblaslt,77935,3.8718616485595705,torch.float8_e4m3fnuz,torch.float16
57344,4547,8192,hipblaslt,77719,4.032962417602539,torch.float8_e4m3fnuz,torch.float16
57344,4638,8192,hipblaslt,77925,4.2008308410644535,torch.float8_e4m3fnuz,torch.float16
8192,4306,8192,hipblaslt,77916,0.5437494277954101,torch.float8_e4m3fnuz,torch.float16
10240,2016,8192,hipblaslt,77829,0.3353848457336426,torch.float8_e4m3fnuz,torch.float16
57344,1880,8192,hipblaslt,77952,1.7380525588989257,torch.float8_e4m3fnuz,torch.float16
8192,1968,8192,hipblaslt,77925,0.26010730266571047,torch.float8_e4m3fnuz,torch.float16
10240,6040,8192,hipblaslt,77976,0.9105128288269043,torch.float8_e4m3fnuz,torch.float16
10240,3208,8192,hipblaslt,77921,0.4893669605255127,torch.float8_e4m3fnuz,torch.float16
57344,719,8192,hipblaslt,77913,0.6913641452789306,torch.float8_e4m3fnuz,torch.float16
10240,2328,8192,hipblaslt,77710,0.37840054035186765,torch.float8_e4m3fnuz,torch.float16
57344,823,8192,hipblaslt,77926,0.8046043395996094,torch.float8_e4m3fnuz,torch.float16
8192,4736,8192,hipblaslt,77903,0.601869535446167,torch.float8_e4m3fnuz,torch.float16
10240,1711,8192,hipblaslt,77828,0.29600250720977783,torch.float8_e4m3fnuz,torch.float16
57344,4313,8192,hipblaslt,77935,3.8980762481689455,torch.float8_e4m3fnuz,torch.float16
8192,94,8192,hipblaslt,42495,0.042735299468040465,torch.float8_e4m3fnuz,torch.float16
8192,2642,8192,hipblaslt,77976,0.3540625095367432,torch.float8_e4m3fnuz,torch.float16
57344,5488,8192,hipblaslt,77880,4.897052162571957,torch.float8_e4m3fnuz,torch.float16
57344,1104,8192,hipblaslt,77928,1.0108274459838866,torch.float8_e4m3fnuz,torch.float16
57344,2146,8192,hipblaslt,77950,1.9930084228515625,torch.float8_e4m3fnuz,torch.float16
8192,1952,28672,hipblaslt,77922,0.8905051231384278,torch.float8_e4m3fnuz,torch.float16
57344,5848,8192,hipblaslt,77920,5.256818135579427,torch.float8_e4m3fnuz,torch.float16
8192,4309,8192,hipblaslt,77495,0.5460729122161865,torch.float8_e4m3fnuz,torch.float16
57344,40,8192,hipblaslt,77228,0.15669209957122804,torch.float8_e4m3fnuz,torch.float16
10240,3470,8192,hipblaslt,77886,0.5533957481384277,torch.float8_e4m3fnuz,torch.float16
10240,4578,8192,hipblaslt,77924,0.7141178607940674,torch.float8_e4m3fnuz,torch.float16
57344,619,8192,hipblaslt,77940,0.6289276599884033,torch.float8_e4m3fnuz,torch.float16
8192,6755,8192,hipblaslt,78016,0.8372983932495117,torch.float8_e4m3fnuz,torch.float16
10240,5828,8192,hipblaslt,77495,0.899907112121582,torch.float8_e4m3fnuz,torch.float16
10240,958,8192,hipblaslt,77723,0.17729259729385377,torch.float8_e4m3fnuz,torch.float16
57344,1853,8192,hipblaslt,77952,1.7303312301635743,torch.float8_e4m3fnuz,torch.float16
8192,1418,8192,hipblaslt,77874,0.19125535488128662,torch.float8_e4m3fnuz,torch.float16
8192,3325,8192,hipblaslt,77720,0.41956348419189454,torch.float8_e4m3fnuz,torch.float16
8192,2411,8192,hipblaslt,77957,0.3081404447555542,torch.float8_e4m3fnuz,torch.float16
57344,6829,8192,hipblaslt,77880,6.037120342254639,torch.float8_e4m3fnuz,torch.float16
57344,821,8192,hipblaslt,77961,0.8063905715942383,torch.float8_e4m3fnuz,torch.float16
10240,1244,8192,hipblaslt,78018,0.20907773971557617,torch.float8_e4m3fnuz,torch.float16
8192,3407,28672,hipblaslt,77901,1.5203882217407227,torch.float8_e4m3fnuz,torch.float16
8192,954,8192,hipblaslt,77388,0.1401636481285095,torch.float8_e4m3fnuz,torch.float16
10240,1091,8192,hipblaslt,77941,0.18851925134658815,torch.float8_e4m3fnuz,torch.float16
8192,4438,28672,hipblaslt,77696,1.9875743865966797,torch.float8_e4m3fnuz,torch.float16
10240,1292,8192,hipblaslt,78018,0.20734915733337403,torch.float8_e4m3fnuz,torch.float16
10240,2001,8192,hipblaslt,77829,0.34184439182281495,torch.float8_e4m3fnuz,torch.float16
57344,4987,8192,hipblaslt,78012,4.426879501342773,torch.float8_e4m3fnuz,torch.float16
10240,541,8192,hipblaslt,77406,0.11985105276107788,torch.float8_e4m3fnuz,torch.float16
10240,2429,8192,hipblaslt,77877,0.40407257080078124,torch.float8_e4m3fnuz,torch.float16
57344,5063,8192,hipblaslt,78012,4.461102294921875,torch.float8_e4m3fnuz,torch.float16
10240,3845,8192,hipblaslt,77935,0.6189107894897461,torch.float8_e4m3fnuz,torch.float16
10240,144,8192,hipblaslt,77859,0.05840650200843811,torch.float8_e4m3fnuz,torch.float16
57344,1229,8192,hipblaslt,77939,1.1213290214538574,torch.float8_e4m3fnuz,torch.float16
57344,839,8192,hipblaslt,77926,0.8120509147644043,torch.float8_e4m3fnuz,torch.float16
8192,1794,28672,hipblaslt,77923,0.8394795417785644,torch.float8_e4m3fnuz,torch.float16
57344,1303,8192,hipblaslt,77917,1.200392246246338,torch.float8_e4m3fnuz,torch.float16
8192,774,8192,hipblaslt,77869,0.1303470492362976,torch.float8_e4m3fnuz,torch.float16
10240,3170,8192,hipblaslt,77900,0.48969740867614747,torch.float8_e4m3fnuz,torch.float16
8192,5317,8192,hipblaslt,77496,0.6401001930236816,torch.float8_e4m3fnuz,torch.float16
8192,2164,8192,hipblaslt,77828,0.29946060180664064,torch.float8_e4m3fnuz,torch.float16
8192,65463,28672,hipblaslt,77924,27.786932373046874,torch.float8_e4m3fnuz,torch.float16
57344,1391,8192,hipblaslt,77952,1.30344877243042,torch.float8_e4m3fnuz,torch.float16
8192,465,8192,hipblaslt,76973,0.08348165154457092,torch.float8_e4m3fnuz,torch.float16
57344,224,28672,hipblaslt,77961,0.8458990097045899,torch.float8_e4m3fnuz,torch.float16
57344,432,8192,hipblaslt,77917,0.44110541343688964,torch.float8_e4m3fnuz,torch.float16
8192,3899,8192,hipblaslt,77897,0.4858497142791748,torch.float8_e4m3fnuz,torch.float16
8192,2580,28672,hipblaslt,77937,1.226202392578125,torch.float8_e4m3fnuz,torch.float16
8192,3402,8192,hipblaslt,77984,0.42055301666259765,torch.float8_e4m3fnuz,torch.float16
8192,2975,8192,hipblaslt,77710,0.38058974742889407,torch.float8_e4m3fnuz,torch.float16
57344,2159,8192,hipblaslt,77935,2.0010562896728517,torch.float8_e4m3fnuz,torch.float16
8192,5918,28672,hipblaslt,77971,2.630624771118164,torch.float8_e4m3fnuz,torch.float16
8192,2406,8192,hipblaslt,77957,0.32335500717163085,torch.float8_e4m3fnuz,torch.float16
8192,4766,28672,hipblaslt,77952,2.2252883911132812,torch.float8_e4m3fnuz,torch.float16
57344,301,8192,hipblaslt,77452,0.356377911567688,torch.float8_e4m3fnuz,torch.float16
10240,5821,8192,hipblaslt,77921,0.8927563667297364,torch.float8_e4m3fnuz,torch.float16
8192,1186,28672,hipblaslt,77675,0.6187504768371582,torch.float8_e4m3fnuz,torch.float16
8192,1223,28672,hipblaslt,77675,0.6328134059906005,torch.float8_e4m3fnuz,torch.float16
10240,5337,8192,hipblaslt,77942,0.8293625831604003,torch.float8_e4m3fnuz,torch.float16
57344,2618,8192,hipblaslt,77925,2.3838611602783204,torch.float8_e4m3fnuz,torch.float16
8192,6876,8192,hipblaslt,77901,0.8343859672546386,torch.float8_e4m3fnuz,torch.float16
57344,972,8192,hipblaslt,77950,0.9127280235290527,torch.float8_e4m3fnuz,torch.float16
57344,2194,8192,hipblaslt,77952,2.0141155242919924,torch.float8_e4m3fnuz,torch.float16
8192,4105,8192,hipblaslt,77923,0.49283204078674314,torch.float8_e4m3fnuz,torch.float16
57344,1714,8192,hipblaslt,77925,1.5718263626098632,torch.float8_e4m3fnuz,torch.float16
57344,3752,8192,hipblaslt,77880,3.3476009368896484,torch.float8_e4m3fnuz,torch.float16
57344,2781,8192,hipblaslt,77880,2.573556327819824,torch.float8_e4m3fnuz,torch.float16
8192,3708,28672,hipblaslt,77924,1.7492652893066407,torch.float8_e4m3fnuz,torch.float16
8192,3350,8192,hipblaslt,77496,0.4199861526489258,torch.float8_e4m3fnuz,torch.float16
10240,6712,8192,hipblaslt,77922,0.9783251762390137,torch.float8_e4m3fnuz,torch.float16
57344,415,8192,hipblaslt,77967,0.42625741958618163,torch.float8_e4m3fnuz,torch.float16
10240,4013,8192,hipblaslt,78016,0.6305540561676025,torch.float8_e4m3fnuz,torch.float16
8192,5836,8192,hipblaslt,77897,0.7200826644897461,torch.float8_e4m3fnuz,torch.float16
10240,3118,8192,hipblaslt,77922,0.48564739227294923,torch.float8_e4m3fnuz,torch.float16
8192,3632,28672,hipblaslt,77903,1.5698433876037599,torch.float8_e4m3fnuz,torch.float16
8192,65494,8192,hipblaslt,77924,7.557582561786358,torch.float8_e4m3fnuz,torch.float16
8192,3584,28672,hipblaslt,77903,1.5631476402282716,torch.float8_e4m3fnuz,torch.float16
10240,1925,8192,hipblaslt,77829,0.32781960964202883,torch.float8_e4m3fnuz,torch.float16
10240,479,8192,hipblaslt,77392,0.10414630174636841,torch.float8_e4m3fnuz,torch.float16
10240,6110,8192,hipblaslt,77925,0.9329480171203614,torch.float8_e4m3fnuz,torch.float16
57344,97,8192,hipblaslt,77445,0.18700300455093383,torch.float8_e4m3fnuz,torch.float16
57344,2181,8192,hipblaslt,77950,1.9995460510253906,torch.float8_e4m3fnuz,torch.float16
57344,2553,8192,hipblaslt,77950,2.3040349960327147,torch.float8_e4m3fnuz,torch.float16
8192,6437,8192,hipblaslt,77984,0.805821704864502,torch.float8_e4m3fnuz,torch.float16
10240,1894,8192,hipblaslt,77836,0.3195914030075073,torch.float8_e4m3fnuz,torch.float16
57344,1611,8192,hipblaslt,77952,1.503298854827881,torch.float8_e4m3fnuz,torch.float16
10240,4431,8192,hipblaslt,77981,0.7026147842407227,torch.float8_e4m3fnuz,torch.float16
8192,6103,8192,hipblaslt,77924,0.7363226890563965,torch.float8_e4m3fnuz,torch.float16
57344,6213,8192,hipblaslt,77696,5.592741124770221,torch.float8_e4m3fnuz,torch.float16
10240,5839,8192,hipblaslt,77723,0.9029676437377929,torch.float8_e4m3fnuz,torch.float16
8192,5597,8192,hipblaslt,77925,0.7023984432220459,torch.float8_e4m3fnuz,torch.float16
8192,4031,28672,hipblaslt,77924,1.7813827514648437,torch.float8_e4m3fnuz,torch.float16
8192,2516,8192,hipblaslt,77829,0.3339487075805664,torch.float8_e4m3fnuz,torch.float16
8192,4499,28672,hipblaslt,78013,2.0534618377685545,torch.float8_e4m3fnuz,torch.float16
10240,2094,8192,hipblaslt,77586,0.35876145362854006,torch.float8_e4m3fnuz,torch.float16
57344,1581,8192,hipblaslt,77952,1.516690731048584,torch.float8_e4m3fnuz,torch.float16
8192,2746,8192,hipblaslt,77960,0.3623267412185669,torch.float8_e4m3fnuz,torch.float16
57344,2537,8192,hipblaslt,77950,2.299454116821289,torch.float8_e4m3fnuz,torch.float16
10240,996,8192,hipblaslt,77723,0.18306114673614501,torch.float8_e4m3fnuz,torch.float16
8192,4022,28672,hipblaslt,77924,1.7807979583740234,torch.float8_e4m3fnuz,torch.float16
8192,65296,8192,hipblaslt,77922,7.506232579549153,torch.float8_e4m3fnuz,torch.float16
57344,1926,8192,hipblaslt,77939,1.7786127090454102,torch.float8_e4m3fnuz,torch.float16
10240,2846,8192,hipblaslt,77496,0.43389267921447755,torch.float8_e4m3fnuz,torch.float16
10240,4762,8192,hipblaslt,77922,0.7343698501586914,torch.float8_e4m3fnuz,torch.float16
57344,2859,8192,hipblaslt,77920,2.5986953735351563,torch.float8_e4m3fnuz,torch.float16
10240,164,28672,hipblaslt,76981,0.16073310375213623,torch.float8_e4m3fnuz,torch.float16
8192,1412,8192,hipblaslt,77710,0.188983952999115,torch.float8_e4m3fnuz,torch.float16
57344,4755,8192,hipblaslt,77920,4.302156829833985,torch.float8_e4m3fnuz,torch.float16
8192,549,28672,hipblaslt,76918,0.33124070167541503,torch.float8_e4m3fnuz,torch.float16
57344,2977,8192,hipblaslt,78012,2.6762563705444338,torch.float8_e4m3fnuz,torch.float16
8192,1277,28672,hipblaslt,77917,0.6278395175933837,torch.float8_e4m3fnuz,torch.float16
8192,2438,28672,hipblaslt,77418,1.1920337677001953,torch.float8_e4m3fnuz,torch.float16
8192,1830,28672,hipblaslt,77924,0.8757847785949707,torch.float8_e4m3fnuz,torch.float16
10240,7600,8192,hipblaslt,77921,1.1425184249877929,torch.float8_e4m3fnuz,torch.float16
8192,2938,8192,hipblaslt,77976,0.3767560482025146,torch.float8_e4m3fnuz,torch.float16
10240,2327,8192,hipblaslt,77960,0.3734231472015381,torch.float8_e4m3fnuz,torch.float16
10240,1613,8192,hipblaslt,77423,0.29502503871917723,torch.float8_e4m3fnuz,torch.float16
8192,3402,28672,hipblaslt,77901,1.5211813926696778,torch.float8_e4m3fnuz,torch.float16
8192,2473,8192,hipblaslt,77829,0.33161025047302245,torch.float8_e4m3fnuz,torch.float16
8192,6296,8192,hipblaslt,77888,0.7930087089538574,torch.float8_e4m3fnuz,torch.float16
8192,3582,28672,hipblaslt,77903,1.5644654273986816,torch.float8_e4m3fnuz,torch.float16
8192,1004,28672,hipblaslt,77830,0.5495059967041016,torch.float8_e4m3fnuz,torch.float16
57344,2312,8192,hipblaslt,77920,2.193731689453125,torch.float8_e4m3fnuz,torch.float16
57344,3341,8192,hipblaslt,77880,3.03961067199707,torch.float8_e4m3fnuz,torch.float16
10240,518,8192,hipblaslt,77866,0.12152199745178223,torch.float8_e4m3fnuz,torch.float16
8192,377,28672,hipblaslt,76946,0.22551004886627196,torch.float8_e4m3fnuz,torch.float16
8192,6346,28672,hipblaslt,77935,2.9536392211914064,torch.float8_e4m3fnuz,torch.float16
57344,1764,8192,hipblaslt,77925,1.573957633972168,torch.float8_e4m3fnuz,torch.float16
8192,4769,8192,hipblaslt,78018,0.6004233837127686,torch.float8_e4m3fnuz,torch.float16
8192,5166,8192,hipblaslt,77888,0.6241485595703125,torch.float8_e4m3fnuz,torch.float16
10240,1663,8192,hipblaslt,77593,0.29426589012146,torch.float8_e4m3fnuz,torch.float16
57344,687,8192,hipblaslt,77939,0.668412160873413,torch.float8_e4m3fnuz,torch.float16
10240,2619,8192,hipblaslt,77973,0.416616153717041,torch.float8_e4m3fnuz,torch.float16
8192,1142,8192,hipblaslt,77408,0.1607000470161438,torch.float8_e4m3fnuz,torch.float16
8192,5250,8192,hipblaslt,77496,0.6284248352050781,torch.float8_e4m3fnuz,torch.float16
57344,3400,8192,hipblaslt,77952,3.095309257507324,torch.float8_e4m3fnuz,torch.float16
8192,2959,8192,hipblaslt,77976,0.37687125205993655,torch.float8_e4m3fnuz,torch.float16
8192,1255,28672,hipblaslt,77675,0.625953197479248,torch.float8_e4m3fnuz,torch.float16
8192,2571,8192,hipblaslt,77829,0.3359696388244629,torch.float8_e4m3fnuz,torch.float16
8192,898,28672,hipblaslt,77870,0.49312143325805663,torch.float8_e4m3fnuz,torch.float16
57344,1602,8192,hipblaslt,77950,1.4962264060974122,torch.float8_e4m3fnuz,torch.float16
8192,267,28672,hipblaslt,76808,0.21136510372161865,torch.float8_e4m3fnuz,torch.float16
8192,5811,28672,hipblaslt,77922,2.674409294128418,torch.float8_e4m3fnuz,torch.float16
8192,1591,28672,hipblaslt,77939,0.7338510990142822,torch.float8_e4m3fnuz,torch.float16
8192,2074,8192,hipblaslt,77927,0.2901918411254883,torch.float8_e4m3fnuz,torch.float16
8192,1496,28672,hipblaslt,77895,0.6806121826171875,torch.float8_e4m3fnuz,torch.float16
8192,3284,8192,hipblaslt,77890,0.42134814262390136,torch.float8_e4m3fnuz,torch.float16
8192,164,28672,hipblaslt,76925,0.13045574426651002,torch.float8_e4m3fnuz,torch.float16
10240,155,8192,hipblaslt,77997,0.0591376006603241,torch.float8_e4m3fnuz,torch.float16
8192,755,8192,hipblaslt,77866,0.11764030456542969,torch.float8_e4m3fnuz,torch.float16
8192,878,28672,hipblaslt,77399,0.458722448348999,torch.float8_e4m3fnuz,torch.float16
8192,5170,8192,hipblaslt,77888,0.6237198829650878,torch.float8_e4m3fnuz,torch.float16
57344,2090,8192,hipblaslt,77952,1.9430282592773438,torch.float8_e4m3fnuz,torch.float16
8192,4434,28672,hipblaslt,78013,1.999489974975586,torch.float8_e4m3fnuz,torch.float16
10240,2221,8192,hipblaslt,77916,0.3618520021438599,torch.float8_e4m3fnuz,torch.float16
10240,2257,8192,hipblaslt,77495,0.3710896968841553,torch.float8_e4m3fnuz,torch.float16
57344,6789,8192,hipblaslt,77880,6.022811412811279,torch.float8_e4m3fnuz,torch.float16
8192,777,28672,hipblaslt,77419,0.45406355857849123,torch.float8_e4m3fnuz,torch.float16
8192,5076,8192,hipblaslt,77984,0.6203849792480469,torch.float8_e4m3fnuz,torch.float16
57344,494,8192,hipblaslt,77939,0.48592586517333985,torch.float8_e4m3fnuz,torch.float16
8192,3191,8192,hipblaslt,77720,0.4101736068725586,torch.float8_e4m3fnuz,torch.float16
57344,57,8192,hipblaslt,77989,0.15759844779968263,torch.float8_e4m3fnuz,torch.float16
8192,1775,8192,hipblaslt,78012,0.23471920490264891,torch.float8_e4m3fnuz,torch.float16
8192,1860,8192,hipblaslt,77926,0.24916510581970214,torch.float8_e4m3fnuz,torch.float16
10240,1007,8192,hipblaslt,77495,0.18304915428161622,torch.float8_e4m3fnuz,torch.float16
10240,4649,8192,hipblaslt,77924,0.7244670867919922,torch.float8_e4m3fnuz,torch.float16
57344,699,8192,hipblaslt,78018,0.6860261917114258,torch.float8_e4m3fnuz,torch.float16
10240,65519,8192,hipblaslt,77923,9.585726928710937,torch.float8_e4m3fnuz,torch.float16
8192,1186,8192,hipblaslt,77495,0.17844635248184204,torch.float8_e4m3fnuz,torch.float16
10240,7514,8192,hipblaslt,77925,1.1525532722473144,torch.float8_e4m3fnuz,torch.float16
8192,1144,28672,hipblaslt,77396,0.5612058162689209,torch.float8_e4m3fnuz,torch.float16
8192,140,8192,hipblaslt,77585,0.05372909903526306,torch.float8_e4m3fnuz,torch.float16
8192,7139,8192,hipblaslt,77935,0.8579028129577637,torch.float8_e4m3fnuz,torch.float16
57344,1359,8192,hipblaslt,77935,1.295454978942871,torch.float8_e4m3fnuz,torch.float16
8192,6487,28672,hipblaslt,77935,2.988679122924805,torch.float8_e4m3fnuz,torch.float16
8192,5348,28672,hipblaslt,77719,2.282755470275879,torch.float8_e4m3fnuz,torch.float16
8192,3513,28672,hipblaslt,77942,1.5515624046325684,torch.float8_e4m3fnuz,torch.float16
57344,30,8192,hipblaslt,77996,0.13937995433807374,torch.float8_e4m3fnuz,torch.float16
57344,2700,8192,hipblaslt,77950,2.5199647903442384,torch.float8_e4m3fnuz,torch.float16
8192,268,28672,hipblaslt,76889,0.18861739635467528,torch.float8_e4m3fnuz,torch.float16
8192,2575,28672,hipblaslt,77396,1.2116968154907226,torch.float8_e4m3fnuz,torch.float16
8192,560,28672,hipblaslt,76918,0.3414942979812622,torch.float8_e4m3fnuz,torch.float16
8192,2337,8192,hipblaslt,77957,0.3145479440689087,torch.float8_e4m3fnuz,torch.float16
10240,1581,8192,hipblaslt,77828,0.2898653507232666,torch.float8_e4m3fnuz,torch.float16
10240,4568,8192,hipblaslt,77897,0.7162690162658691,torch.float8_e4m3fnuz,torch.float16
8192,1198,28672,hipblaslt,77675,0.6268565654754639,torch.float8_e4m3fnuz,torch.float16
8192,7624,28672,hipblaslt,77917,3.4527847290039064,torch.float8_e4m3fnuz,torch.float16
10240,3057,8192,hipblaslt,77897,0.48021936416625977,torch.float8_e4m3fnuz,torch.float16
10240,1024,8192,hipblaslt,77413,0.18433109521865845,torch.float8_e4m3fnuz,torch.float16
8192,4952,8192,hipblaslt,77888,0.6175528049468995,torch.float8_e4m3fnuz,torch.float16
57344,5715,8192,hipblaslt,77935,5.127263810899523,torch.float8_e4m3fnuz,torch.float16
10240,1150,8192,hipblaslt,77973,0.20417845249176025,torch.float8_e4m3fnuz,torch.float16
57344,1231,8192,hipblaslt,77939,1.1568415641784668,torch.float8_e4m3fnuz,torch.float16
8192,1147,8192,hipblaslt,77836,0.16216870546340942,torch.float8_e4m3fnuz,torch.float16
57344,4628,8192,hipblaslt,77919,4.2525794982910154,torch.float8_e4m3fnuz,torch.float16
10240,1886,28672,hipblaslt,77994,1.1938815116882324,torch.float8_e4m3fnuz,torch.float16
8192,4316,8192,hipblaslt,77960,0.5367731571197509,torch.float8_e4m3fnuz,torch.float16
57344,1864,8192,hipblaslt,77952,1.7623926162719727,torch.float8_e4m3fnuz,torch.float16
10240,1253,8192,hipblaslt,77942,0.21296346187591553,torch.float8_e4m3fnuz,torch.float16
57344,4438,8192,hipblaslt,78017,3.956632614135742,torch.float8_e4m3fnuz,torch.float16
8192,523,28672,hipblaslt,76918,0.3208853483200073,torch.float8_e4m3fnuz,torch.float16
8192,4045,8192,hipblaslt,77924,0.49460663795471194,torch.float8_e4m3fnuz,torch.float16
57344,1493,8192,hipblaslt,77920,1.330430793762207,torch.float8_e4m3fnuz,torch.float16
57344,2989,8192,hipblaslt,77935,2.685652160644531,torch.float8_e4m3fnuz,torch.float16
10240,5052,8192,hipblaslt,78016,0.8038807868957519,torch.float8_e4m3fnuz,torch.float16
8192,3506,8192,hipblaslt,77903,0.43273100852966306,torch.float8_e4m3fnuz,torch.float16
8192,1441,28672,hipblaslt,77917,0.6707089900970459,torch.float8_e4m3fnuz,torch.float16
8192,5597,28672,hipblaslt,77755,2.5809112548828126,torch.float8_e4m3fnuz,torch.float16
57344,3002,8192,hipblaslt,78012,2.6797313690185547,torch.float8_e4m3fnuz,torch.float16
8192,634,8192,hipblaslt,77392,0.10596494674682617,torch.float8_e4m3fnuz,torch.float16
57344,2272,8192,hipblaslt,77952,2.0412618637084963,torch.float8_e4m3fnuz,torch.float16
8192,2540,28672,hipblaslt,77883,1.2265108108520508,torch.float8_e4m3fnuz,torch.float16
57344,133,28672,hipblaslt,77936,0.6804539203643799,torch.float8_e4m3fnuz,torch.float16
10240,1183,8192,hipblaslt,77942,0.2033156394958496,torch.float8_e4m3fnuz,torch.float16
57344,1500,8192,hipblaslt,77920,1.3523551940917968,torch.float8_e4m3fnuz,torch.float16
8192,984,28672,hipblaslt,77388,0.5100756168365479,torch.float8_e4m3fnuz,torch.float16
8192,65156,8192,hipblaslt,77922,7.530999501546224,torch.float8_e4m3fnuz,torch.float16
8192,4010,28672,hipblaslt,77924,1.7828689575195313,torch.float8_e4m3fnuz,torch.float16
8192,959,28672,hipblaslt,77593,0.5195836544036865,torch.float8_e4m3fnuz,torch.float16
10240,464,8192,hipblaslt,77400,0.11082614660263061,torch.float8_e4m3fnuz,torch.float16
57344,59,8192,hipblaslt,77989,0.15874714851379396,torch.float8_e4m3fnuz,torch.float16
10240,1852,8192,hipblaslt,77882,0.3142735481262207,torch.float8_e4m3fnuz,torch.float16
8192,2617,28672,hipblaslt,77937,1.2517142295837402,torch.float8_e4m3fnuz,torch.float16
8192,3803,28672,hipblaslt,77924,1.7620815277099608,torch.float8_e4m3fnuz,torch.float16
8192,643,28672,hipblaslt,76883,0.40203051567077636,torch.float8_e4m3fnuz,torch.float16
10240,2119,8192,hipblaslt,77723,0.35923008918762206,torch.float8_e4m3fnuz,torch.float16
8192,4671,28672,hipblaslt,77895,2.0985286712646483,torch.float8_e4m3fnuz,torch.float16
10240,1681,8192,hipblaslt,77423,0.29907300472259524,torch.float8_e4m3fnuz,torch.float16
57344,5778,8192,hipblaslt,77880,5.2603636847601996,torch.float8_e4m3fnuz,torch.float16
8192,3598,8192,hipblaslt,77984,0.4360198974609375,torch.float8_e4m3fnuz,torch.float16
10240,7117,8192,hipblaslt,77877,1.0654241561889648,torch.float8_e4m3fnuz,torch.float16
8192,5216,8192,hipblaslt,77942,0.6360321521759034,torch.float8_e4m3fnuz,torch.float16
57344,4215,8192,hipblaslt,77880,3.767312240600586,torch.float8_e4m3fnuz,torch.float16
10240,4387,8192,hipblaslt,77981,0.7094829559326172,torch.float8_e4m3fnuz,torch.float16
57344,605,8192,hipblaslt,77917,0.6248215675354004,torch.float8_e4m3fnuz,torch.float16
8192,1743,28672,hipblaslt,77939,0.7733930587768555,torch.float8_e4m3fnuz,torch.float16
10240,1774,8192,hipblaslt,77828,0.3036257982254028,torch.float8_e4m3fnuz,torch.float16
8192,3485,28672,hipblaslt,78012,1.5362135887145996,torch.float8_e4m3fnuz,torch.float16
10240,8338,8192,hipblaslt,77921,1.2268113136291503,torch.float8_e4m3fnuz,torch.float16
8192,3734,8192,hipblaslt,77922,0.47284841537475586,torch.float8_e4m3fnuz,torch.float16
57344,3953,8192,hipblaslt,78012,3.4538158416748046,torch.float8_e4m3fnuz,torch.float16
8192,316,8192,hipblaslt,77304,0.07496604919433594,torch.float8_e4m3fnuz,torch.float16
8192,3390,8192,hipblaslt,77903,0.420424747467041,torch.float8_e4m3fnuz,torch.float16
8192,1040,28672,hipblaslt,77396,0.5666914463043213,torch.float8_e4m3fnuz,torch.float16
10240,463,8192,hipblaslt,77400,0.10978615283966064,torch.float8_e4m3fnuz,torch.float16
8192,50116,28672,hipblaslt,77924,21.465084838867188,torch.float8_e4m3fnuz,torch.float16
10240,5676,8192,hipblaslt,78016,0.855801773071289,torch.float8_e4m3fnuz,torch.float16
8192,1773,28672,hipblaslt,77939,0.7749038696289062,torch.float8_e4m3fnuz,torch.float16
57344,2606,8192,hipblaslt,77952,2.404013252258301,torch.float8_e4m3fnuz,torch.float16
57344,4520,8192,hipblaslt,78017,4.000876235961914,torch.float8_e4m3fnuz,torch.float16
8192,4461,28672,hipblaslt,77696,1.9872777938842774,torch.float8_e4m3fnuz,torch.float16
57344,182,8192,hipblaslt,77695,0.23161110877990723,torch.float8_e4m3fnuz,torch.float16
10240,777,8192,hipblaslt,77605,0.15298864841461182,torch.float8_e4m3fnuz,torch.float16
10240,4987,8192,hipblaslt,77984,0.7958629131317139,torch.float8_e4m3fnuz,torch.float16
8192,65287,28672,hipblaslt,77924,27.709268188476564,torch.float8_e4m3fnuz,torch.float16
8192,600,8192,hipblaslt,78003,0.1094120979309082,torch.float8_e4m3fnuz,torch.float16
8192,1121,28672,hipblaslt,77396,0.5660183906555176,torch.float8_e4m3fnuz,torch.float16
57344,133,8192,hipblaslt,77927,0.196407949924469,torch.float8_e4m3fnuz,torch.float16
8192,5742,8192,hipblaslt,77981,0.7086236953735352,torch.float8_e4m3fnuz,torch.float16
8192,65322,28672,hipblaslt,77924,27.690048217773438,torch.float8_e4m3fnuz,torch.float16
10240,4057,8192,hipblaslt,77890,0.6432407855987549,torch.float8_e4m3fnuz,torch.float16
8192,2939,28672,hipblaslt,77895,1.355612087249756,torch.float8_e4m3fnuz,torch.float16
10240,3043,8192,hipblaslt,77924,0.48404297828674314,torch.float8_e4m3fnuz,torch.float16
8192,1878,28672,hipblaslt,77921,0.879550838470459,torch.float8_e4m3fnuz,torch.float16
10240,3903,8192,hipblaslt,77888,0.6194976329803467,torch.float8_e4m3fnuz,torch.float16
8192,1377,8192,hipblaslt,77505,0.19575799703598024,torch.float8_e4m3fnuz,torch.float16
8192,5430,28672,hipblaslt,77396,2.597848129272461,torch.float8_e4m3fnuz,torch.float16
8192,6489,8192,hipblaslt,77888,0.7995203495025635,torch.float8_e4m3fnuz,torch.float16
8192,2402,28672,hipblaslt,77883,1.2173873901367187,torch.float8_e4m3fnuz,torch.float16
8192,4829,28672,hipblaslt,78018,2.237814712524414,torch.float8_e4m3fnuz,torch.float16
57344,3509,8192,hipblaslt,77925,3.1580480575561523,torch.float8_e4m3fnuz,torch.float16
8192,1274,8192,hipblaslt,77424,0.18475970029830932,torch.float8_e4m3fnuz,torch.float16
57344,1237,8192,hipblaslt,77939,1.1411724090576172,torch.float8_e4m3fnuz,torch.float16
8192,2039,28672,hipblaslt,77815,0.9443267822265625,torch.float8_e4m3fnuz,torch.float16
10240,1823,8192,hipblaslt,77722,0.31377880573272704,torch.float8_e4m3fnuz,torch.float16
10240,5755,8192,hipblaslt,77888,0.8547781944274903,torch.float8_e4m3fnuz,torch.float16
57344,1364,8192,hipblaslt,77950,1.2968891143798829,torch.float8_e4m3fnuz,torch.float16
57344,3206,8192,hipblaslt,77935,2.922515106201172,torch.float8_e4m3fnuz,torch.float16
8192,1107,28672,hipblaslt,77936,0.5400760173797607,torch.float8_e4m3fnuz,torch.float16
57344,5313,8192,hipblaslt,77719,4.724100112915039,torch.float8_e4m3fnuz,torch.float16
10240,2820,8192,hipblaslt,77720,0.4321341037750244,torch.float8_e4m3fnuz,torch.float16
10240,5251,8192,hipblaslt,78016,0.8111255645751954,torch.float8_e4m3fnuz,torch.float16
8192,3732,8192,hipblaslt,77924,0.4669677734375,torch.float8_e4m3fnuz,torch.float16
57344,2304,8192,hipblaslt,77952,2.0542829513549803,torch.float8_e4m3fnuz,torch.float16
8192,544,28672,hipblaslt,76918,0.3498757600784302,torch.float8_e4m3fnuz,torch.float16
10240,2081,8192,hipblaslt,42447,0.35165140628814695,torch.float8_e4m3fnuz,torch.float16
8192,5019,8192,hipblaslt,77942,0.61769700050354,torch.float8_e4m3fnuz,torch.float16
57344,1265,8192,hipblaslt,77939,1.1563408851623536,torch.float8_e4m3fnuz,torch.float16
10240,4310,8192,hipblaslt,77924,0.7028006076812744,torch.float8_e4m3fnuz,torch.float16
57344,2352,8192,hipblaslt,77920,2.2029191970825197,torch.float8_e4m3fnuz,torch.float16
8192,4594,28672,hipblaslt,78013,2.065363311767578,torch.float8_e4m3fnuz,torch.float16
10240,7017,8192,hipblaslt,77973,1.054826545715332,torch.float8_e4m3fnuz,torch.float16
57344,5947,8192,hipblaslt,78012,5.1854125128851996,torch.float8_e4m3fnuz,torch.float16
8192,504,8192,hipblaslt,76973,0.08723974823951722,torch.float8_e4m3fnuz,torch.float16
8192,7565,8192,hipblaslt,77924,0.9127320289611817,torch.float8_e4m3fnuz,torch.float16
57344,6783,8192,hipblaslt,77880,6.002777099609375,torch.float8_e4m3fnuz,torch.float16
8192,609,28672,hipblaslt,76890,0.365632152557373,torch.float8_e4m3fnuz,torch.float16
8192,4760,28672,hipblaslt,77888,2.2168397903442383,torch.float8_e4m3fnuz,torch.float16
57344,4173,8192,hipblaslt,77880,3.734145736694336,torch.float8_e4m3fnuz,torch.float16
8192,2648,28672,hipblaslt,77937,1.2409702301025392,torch.float8_e4m3fnuz,torch.float16
8192,5647,8192,hipblaslt,77925,0.7043353080749511,torch.float8_e4m3fnuz,torch.float16
8192,2193,28672,hipblaslt,77818,1.0979463577270507,torch.float8_e4m3fnuz,torch.float16
8192,3733,8192,hipblaslt,77924,0.4655295848846436,torch.float8_e4m3fnuz,torch.float16
8192,180,28672,hipblaslt,76925,0.13128149509429932,torch.float8_e4m3fnuz,torch.float16
8192,1666,8192,hipblaslt,77913,0.214621901512146,torch.float8_e4m3fnuz,torch.float16
57344,573,8192,hipblaslt,77408,0.574513053894043,torch.float8_e4m3fnuz,torch.float16
10240,5163,8192,hipblaslt,77496,0.8014892578125,torch.float8_e4m3fnuz,torch.float16
8192,3861,8192,hipblaslt,77921,0.4805819034576416,torch.float8_e4m3fnuz,torch.float16
8192,8338,8192,hipblaslt,77922,0.9690834999084472,torch.float8_e4m3fnuz,torch.float16
8192,493,8192,hipblaslt,77592,0.08656625151634216,torch.float8_e4m3fnuz,torch.float16
10240,1766,8192,hipblaslt,77828,0.2937411069869995,torch.float8_e4m3fnuz,torch.float16
57344,2266,8192,hipblaslt,77952,2.014377975463867,torch.float8_e4m3fnuz,torch.float16
10240,222,8192,hipblaslt,42415,0.0761848509311676,torch.float8_e4m3fnuz,torch.float16
57344,7038,8192,hipblaslt,77913,6.345508829752604,torch.float8_e4m3fnuz,torch.float16
10240,4301,8192,hipblaslt,77396,0.6831459045410156,torch.float8_e4m3fnuz,torch.float16
10240,801,8192,hipblaslt,77408,0.15445879697799683,torch.float8_e4m3fnuz,torch.float16
8192,2898,28672,hipblaslt,77895,1.3272199630737305,torch.float8_e4m3fnuz,torch.float16
10240,1220,8192,hipblaslt,77942,0.20837669372558593,torch.float8_e4m3fnuz,torch.float16
8192,3497,8192,hipblaslt,77720,0.43808493614196775,torch.float8_e4m3fnuz,torch.float16
10240,1265,8192,hipblaslt,77913,0.20972464084625245,torch.float8_e4m3fnuz,torch.float16
8192,820,28672,hipblaslt,76783,0.46733822822570803,torch.float8_e4m3fnuz,torch.float16
10240,2195,8192,hipblaslt,77960,0.36096270084381105,torch.float8_e4m3fnuz,torch.float16
8192,1942,8192,hipblaslt,77948,0.25449495315551757,torch.float8_e4m3fnuz,torch.float16
8192,3782,28672,hipblaslt,77924,1.7639789581298828,torch.float8_e4m3fnuz,torch.float16
10240,2191,8192,hipblaslt,77916,0.360772442817688,torch.float8_e4m3fnuz,torch.float16
10240,2487,8192,hipblaslt,77984,0.4008478164672852,torch.float8_e4m3fnuz,torch.float16
8192,1660,28672,hipblaslt,77950,0.7359581470489502,torch.float8_e4m3fnuz,torch.float16
10240,400,8192,hipblaslt,77392,0.11054174900054932,torch.float8_e4m3fnuz,torch.float16
57344,397,8192,hipblaslt,77917,0.43674545288085936,torch.float8_e4m3fnuz,torch.float16
8192,2995,28672,hipblaslt,77895,1.3865118026733398,torch.float8_e4m3fnuz,torch.float16
8192,1962,8192,hipblaslt,77926,0.2520573616027832,torch.float8_e4m3fnuz,torch.float16
57344,2260,8192,hipblaslt,77935,2.0306219100952148,torch.float8_e4m3fnuz,torch.float16
57344,2309,8192,hipblaslt,77935,2.1645444869995116,torch.float8_e4m3fnuz,torch.float16
57344,2174,8192,hipblaslt,77952,2.031050682067871,torch.float8_e4m3fnuz,torch.float16
57344,7613,8192,hipblaslt,77719,6.782369886125837,torch.float8_e4m3fnuz,torch.float16
57344,477,8192,hipblaslt,77939,0.49300031661987304,torch.float8_e4m3fnuz,torch.float16
10240,3402,8192,hipblaslt,77916,0.539921760559082,torch.float8_e4m3fnuz,torch.float16
8192,65082,28672,hipblaslt,77924,27.91753234863281,torch.float8_e4m3fnuz,torch.float16
10240,2421,8192,hipblaslt,77984,0.3992544412612915,torch.float8_e4m3fnuz,torch.float16
10240,897,8192,hipblaslt,77941,0.17310240268707275,torch.float8_e4m3fnuz,torch.float16
8192,5340,28672,hipblaslt,77719,2.3017995834350584,torch.float8_e4m3fnuz,torch.float16
57344,3410,8192,hipblaslt,77952,3.1055116653442383,torch.float8_e4m3fnuz,torch.float16
10240,4767,8192,hipblaslt,77924,0.73345046043396,torch.float8_e4m3fnuz,torch.float16
8192,2087,8192,hipblaslt,77593,0.297694993019104,torch.float8_e4m3fnuz,torch.float16
8192,1915,8192,hipblaslt,77925,0.2512276411056519,torch.float8_e4m3fnuz,torch.float16
8192,5140,28672,hipblaslt,77903,2.2707996368408203,torch.float8_e4m3fnuz,torch.float16
8192,3339,28672,hipblaslt,77935,1.5131454467773438,torch.float8_e4m3fnuz,torch.float16
8192,710,28672,hipblaslt,77866,0.42972254753112793,torch.float8_e4m3fnuz,torch.float16
8192,875,8192,hipblaslt,77870,0.14243899583816527,torch.float8_e4m3fnuz,torch.float16
8192,6368,28672,hipblaslt,77942,2.9749908447265625,torch.float8_e4m3fnuz,torch.float16
10240,3403,8192,hipblaslt,77723,0.5404025077819824,torch.float8_e4m3fnuz,torch.float16
8192,698,8192,hipblaslt,77867,0.11781455278396606,torch.float8_e4m3fnuz,torch.float16
57344,1646,8192,hipblaslt,77939,1.5279813766479493,torch.float8_e4m3fnuz,torch.float16
8192,592,8192,hipblaslt,77400,0.10660589933395385,torch.float8_e4m3fnuz,torch.float16
8192,6971,8192,hipblaslt,77903,0.8483145713806153,torch.float8_e4m3fnuz,torch.float16
8192,2889,28672,hipblaslt,77928,1.3304127693176269,torch.float8_e4m3fnuz,torch.float16
8192,2,8192,hipblaslt,76460,0.027058100700378417,torch.float8_e4m3fnuz,torch.float16
8192,2880,28672,hipblaslt,77895,1.3359007835388184,torch.float8_e4m3fnuz,torch.float16
57344,4607,8192,hipblaslt,78017,4.107460403442383,torch.float8_e4m3fnuz,torch.float16
8192,2024,28672,hipblaslt,77881,0.9248479843139649,torch.float8_e4m3fnuz,torch.float16
57344,108,28672,hipblaslt,77458,0.6181206226348877,torch.float8_e4m3fnuz,torch.float16
8192,3035,28672,hipblaslt,77895,1.3723708152770997,torch.float8_e4m3fnuz,torch.float16
8192,330,8192,hipblaslt,77123,0.07505519986152649,torch.float8_e4m3fnuz,torch.float16
8192,2721,28672,hipblaslt,77895,1.2983152389526367,torch.float8_e4m3fnuz,torch.float16
57344,4127,8192,hipblaslt,77880,3.704787826538086,torch.float8_e4m3fnuz,torch.float16
10240,4025,8192,hipblaslt,78018,0.6294183731079102,torch.float8_e4m3fnuz,torch.float16
8192,3549,28672,hipblaslt,77901,1.5633398056030274,torch.float8_e4m3fnuz,torch.float16
8192,7722,8192,hipblaslt,77924,0.9293927192687989,torch.float8_e4m3fnuz,torch.float16
10240,1249,8192,hipblaslt,77945,0.20680835247039794,torch.float8_e4m3fnuz,torch.float16
57344,1053,8192,hipblaslt,77917,1.0054874420166016,torch.float8_e4m3fnuz,torch.float16
57344,4953,8192,hipblaslt,77920,4.518150711059571,torch.float8_e4m3fnuz,torch.float16
57344,1381,8192,hipblaslt,77935,1.3063932418823243,torch.float8_e4m3fnuz,torch.float16
57344,6074,8192,hipblaslt,78012,5.243166755227482,torch.float8_e4m3fnuz,torch.float16
57344,4625,8192,hipblaslt,77925,4.204497909545898,torch.float8_e4m3fnuz,torch.float16
8192,2450,28672,hipblaslt,42464,1.2026655197143554,torch.float8_e4m3fnuz,torch.float16
8192,1890,28672,hipblaslt,77921,0.8750056266784668,torch.float8_e4m3fnuz,torch.float16
8192,1585,28672,hipblaslt,77888,0.7327353477478027,torch.float8_e4m3fnuz,torch.float16
10240,1020,8192,hipblaslt,77723,0.18550479412078857,torch.float8_e4m3fnuz,torch.float16
8192,4877,28672,hipblaslt,78012,2.2192893981933595,torch.float8_e4m3fnuz,torch.float16
8192,763,8192,hipblaslt,77866,0.12123359441757202,torch.float8_e4m3fnuz,torch.float16
8192,2526,28672,hipblaslt,77829,1.2248443603515624,torch.float8_e4m3fnuz,torch.float16
8192,4377,8192,hipblaslt,77916,0.5518855094909668,torch.float8_e4m3fnuz,torch.float16
8192,1000,28672,hipblaslt,77830,0.5110865592956543,torch.float8_e4m3fnuz,torch.float16
8192,1169,8192,hipblaslt,77720,0.18649824857711791,torch.float8_e4m3fnuz,torch.float16
10240,2878,8192,hipblaslt,77720,0.4338706970214844,torch.float8_e4m3fnuz,torch.float16
57344,26,8192,hipblaslt,77507,0.14953149557113649,torch.float8_e4m3fnuz,torch.float16
10240,2539,8192,hipblaslt,77984,0.4095947265625,torch.float8_e4m3fnuz,torch.float16
8192,1575,28672,hipblaslt,77942,0.7413401126861572,torch.float8_e4m3fnuz,torch.float16
10240,3631,8192,hipblaslt,77973,0.587548303604126,torch.float8_e4m3fnuz,torch.float16
57344,6599,8192,hipblaslt,77880,5.868606090545654,torch.float8_e4m3fnuz,torch.float16
10240,1176,8192,hipblaslt,77945,0.20799810886383058,torch.float8_e4m3fnuz,torch.float16
8192,21013,8192,hipblaslt,77921,2.44085750579834,torch.float8_e4m3fnuz,torch.float16
10240,4091,8192,hipblaslt,77984,0.6468441486358643,torch.float8_e4m3fnuz,torch.float16
8192,3787,8192,hipblaslt,77923,0.48132100105285647,torch.float8_e4m3fnuz,torch.float16
8192,15,8192,hipblaslt,76460,0.027191248536109925,torch.float8_e4m3fnuz,torch.float16
10240,1120,8192,hipblaslt,77976,0.1893404483795166,torch.float8_e4m3fnuz,torch.float16
57344,1943,8192,hipblaslt,77950,1.7715681076049805,torch.float8_e4m3fnuz,torch.float16
10240,8711,8192,hipblaslt,77921,1.3436504364013673,torch.float8_e4m3fnuz,torch.float16
10240,3398,8192,hipblaslt,77886,0.5472907066345215,torch.float8_e4m3fnuz,torch.float16
8192,3903,8192,hipblaslt,77922,0.48270502090454104,torch.float8_e4m3fnuz,torch.float16
10240,4328,8192,hipblaslt,77924,0.6792622089385987,torch.float8_e4m3fnuz,torch.float16
8192,2601,28672,hipblaslt,77688,1.249300479888916,torch.float8_e4m3fnuz,torch.float16
10240,1283,8192,hipblaslt,78018,0.21162943840026854,torch.float8_e4m3fnuz,torch.float16
57344,2400,8192,hipblaslt,77952,2.2020097732543946,torch.float8_e4m3fnuz,torch.float16
8192,6561,28672,hipblaslt,77935,2.9990703582763674,torch.float8_e4m3fnuz,torch.float16
8192,202,8192,hipblaslt,76783,0.06317754983901977,torch.float8_e4m3fnuz,torch.float16
8192,4362,8192,hipblaslt,77916,0.5456782817840576,torch.float8_e4m3fnuz,torch.float16
8192,392,8192,hipblaslt,77592,0.0808817982673645,torch.float8_e4m3fnuz,torch.float16
8192,3988,28672,hipblaslt,77924,1.7801128387451173,torch.float8_e4m3fnuz,torch.float16
8192,627,28672,hipblaslt,77865,0.3894949436187744,torch.float8_e4m3fnuz,torch.float16
10240,648,8192,hipblaslt,77869,0.13264050483703613,torch.float8_e4m3fnuz,torch.float16
57344,5855,8192,hipblaslt,77920,5.294640858968099,torch.float8_e4m3fnuz,torch.float16
10240,2969,8192,hipblaslt,77981,0.4777977466583252,torch.float8_e4m3fnuz,torch.float16
8192,4473,28672,hipblaslt,77696,1.9929100036621095,torch.float8_e4m3fnuz,torch.float16
10240,5838,8192,hipblaslt,77960,0.8906593322753906,torch.float8_e4m3fnuz,torch.float16
57344,2458,8192,hipblaslt,77952,2.2463796615600584,torch.float8_e4m3fnuz,torch.float16
8192,3516,28672,hipblaslt,78012,1.5540740013122558,torch.float8_e4m3fnuz,torch.float16
8192,6230,8192,hipblaslt,77924,0.746583890914917,torch.float8_e4m3fnuz,torch.float16
57344,2585,8192,hipblaslt,77925,2.385165214538574,torch.float8_e4m3fnuz,torch.float16
10240,1656,8192,hipblaslt,77605,0.30132033824920657,torch.float8_e4m3fnuz,torch.float16
8192,453,8192,hipblaslt,76973,0.08878505229949951,torch.float8_e4m3fnuz,torch.float16
57344,5364,8192,hipblaslt,77719,4.72790756225586,torch.float8_e4m3fnuz,torch.float16
10240,1675,8192,hipblaslt,77593,0.29604649543762207,torch.float8_e4m3fnuz,torch.float16
8192,1601,8192,hipblaslt,78018,0.2119920015335083,torch.float8_e4m3fnuz,torch.float16
10240,5379,8192,hipblaslt,78016,0.8315096855163574,torch.float8_e4m3fnuz,torch.float16
10240,2301,8192,hipblaslt,77960,0.3729545116424561,torch.float8_e4m3fnuz,torch.float16
8192,1663,28672,hipblaslt,77950,0.7555451393127441,torch.float8_e4m3fnuz,torch.float16
8192,6564,28672,hipblaslt,77984,3.0039798736572267,torch.float8_e4m3fnuz,torch.float16
8192,2690,28672,hipblaslt,77928,1.2824696540832519,torch.float8_e4m3fnuz,torch.float16
57344,5835,8192,hipblaslt,77948,5.259130265977648,torch.float8_e4m3fnuz,torch.float16
10240,4265,8192,hipblaslt,77916,0.696657943725586,torch.float8_e4m3fnuz,torch.float16
8192,3285,28672,hipblaslt,77888,1.5171474456787108,torch.float8_e4m3fnuz,torch.float16
57344,3745,8192,hipblaslt,77880,3.417948532104492,torch.float8_e4m3fnuz,torch.float16
10240,5077,8192,hipblaslt,78016,0.8096834182739258,torch.float8_e4m3fnuz,torch.float16
8192,3337,28672,hipblaslt,77942,1.514058780670166,torch.float8_e4m3fnuz,torch.float16
8192,3153,8192,hipblaslt,77720,0.41074237823486326,torch.float8_e4m3fnuz,torch.float16
8192,879,28672,hipblaslt,77399,0.47289342880249025,torch.float8_e4m3fnuz,torch.float16
10240,2567,8192,hipblaslt,78016,0.4093323707580566,torch.float8_e4m3fnuz,torch.float16
8192,6774,8192,hipblaslt,77984,0.818911075592041,torch.float8_e4m3fnuz,torch.float16
10240,1532,8192,hipblaslt,77925,0.2560683012008667,torch.float8_e4m3fnuz,torch.float16
8192,1928,28672,hipblaslt,77923,0.8800915718078614,torch.float8_e4m3fnuz,torch.float16
8192,2032,8192,hipblaslt,77768,0.27772738933563235,torch.float8_e4m3fnuz,torch.float16
8192,4277,28672,hipblaslt,77696,1.9515708923339843,torch.float8_e4m3fnuz,torch.float16
10240,1219,8192,hipblaslt,77942,0.2060612440109253,torch.float8_e4m3fnuz,torch.float16
57344,1877,8192,hipblaslt,77952,1.7303531646728516,torch.float8_e4m3fnuz,torch.float16
8192,185,28672,hipblaslt,76925,0.13366600275039672,torch.float8_e4m3fnuz,torch.float16
10240,5787,8192,hipblaslt,77885,0.8914344787597657,torch.float8_e4m3fnuz,torch.float16
8192,1031,8192,hipblaslt,77870,0.14765870571136475,torch.float8_e4m3fnuz,torch.float16
8192,1292,8192,hipblaslt,77917,0.17977030277252198,torch.float8_e4m3fnuz,torch.float16
10240,6018,8192,hipblaslt,77924,0.9191736221313477,torch.float8_e4m3fnuz,torch.float16
8192,3609,28672,hipblaslt,77901,1.5604093551635743,torch.float8_e4m3fnuz,torch.float16
8192,4517,8192,hipblaslt,77928,0.5749516487121582,torch.float8_e4m3fnuz,torch.float16
10240,2440,8192,hipblaslt,77399,0.40276660919189455,torch.float8_e4m3fnuz,torch.float16
8192,65452,8192,hipblaslt,77922,7.568972269694011,torch.float8_e4m3fnuz,torch.float16
10240,2943,8192,hipblaslt,77905,0.48368349075317385,torch.float8_e4m3fnuz,torch.float16
10240,5494,8192,hipblaslt,77890,0.8429786682128906,torch.float8_e4m3fnuz,torch.float16
8192,1339,8192,hipblaslt,77942,0.19544154405593872,torch.float8_e4m3fnuz,torch.float16
10240,5198,8192,hipblaslt,77942,0.8214247703552247,torch.float8_e4m3fnuz,torch.float16
57344,1671,8192,hipblaslt,77939,1.5339402198791503,torch.float8_e4m3fnuz,torch.float16
10240,440,8192,hipblaslt,77392,0.10762139558792114,torch.float8_e4m3fnuz,torch.float16
8192,6931,8192,hipblaslt,77903,0.8460131645202636,torch.float8_e4m3fnuz,torch.float16
8192,65519,28672,hipblaslt,77924,27.776898193359376,torch.float8_e4m3fnuz,torch.float16
8192,5838,28672,hipblaslt,77924,2.6232578277587892,torch.float8_e4m3fnuz,torch.float16
10240,740,8192,hipblaslt,77388,0.1437348961830139,torch.float8_e4m3fnuz,torch.float16
57344,2370,8192,hipblaslt,77952,2.1905107498168945,torch.float8_e4m3fnuz,torch.float16
10240,2821,8192,hipblaslt,77468,0.43471193313598633,torch.float8_e4m3fnuz,torch.float16
10240,4443,8192,hipblaslt,77981,0.6999127388000488,torch.float8_e4m3fnuz,torch.float16
8192,943,8192,hipblaslt,77870,0.14454610347747804,torch.float8_e4m3fnuz,torch.float16
10240,781,8192,hipblaslt,77870,0.14618755578994752,torch.float8_e4m3fnuz,torch.float16
57344,1293,8192,hipblaslt,77895,1.2019886016845702,torch.float8_e4m3fnuz,torch.float16
10240,5391,8192,hipblaslt,77496,0.8324211120605469,torch.float8_e4m3fnuz,torch.float16
8192,689,8192,hipblaslt,77866,0.11542099714279175,torch.float8_e4m3fnuz,torch.float16
8192,1917,28672,hipblaslt,77921,0.8831241607666016,torch.float8_e4m3fnuz,torch.float16
57344,5219,8192,hipblaslt,77719,4.711162948608399,torch.float8_e4m3fnuz,torch.float16
8192,6426,28672,hipblaslt,77984,2.9807634353637695,torch.float8_e4m3fnuz,torch.float16
8192,7147,28672,hipblaslt,77903,3.1489044189453126,torch.float8_e4m3fnuz,torch.float16
57344,2054,8192,hipblaslt,77952,1.8997882843017577,torch.float8_e4m3fnuz,torch.float16
8192,3258,28672,hipblaslt,77950,1.4775286674499513,torch.float8_e4m3fnuz,torch.float16
10240,2332,8192,hipblaslt,77723,0.37838449478149416,torch.float8_e4m3fnuz,torch.float16
8192,4481,28672,hipblaslt,78013,2.054034614562988,torch.float8_e4m3fnuz,torch.float16
57344,633,8192,hipblaslt,77967,0.6263057708740234,torch.float8_e4m3fnuz,torch.float16
8192,5149,8192,hipblaslt,77935,0.6243653297424316,torch.float8_e4m3fnuz,torch.float16
10240,4716,8192,hipblaslt,77922,0.7346562385559082,torch.float8_e4m3fnuz,torch.float16
8192,4569,28672,hipblaslt,78013,2.068448066711426,torch.float8_e4m3fnuz,torch.float16
10240,2357,8192,hipblaslt,77710,0.3880067586898804,torch.float8_e4m3fnuz,torch.float16
57344,4985,8192,hipblaslt,78012,4.44598388671875,torch.float8_e4m3fnuz,torch.float16
8192,804,8192,hipblaslt,77399,0.1345192551612854,torch.float8_e4m3fnuz,torch.float16
10240,1651,8192,hipblaslt,77927,0.29522535800933836,torch.float8_e4m3fnuz,torch.float16
10240,2162,8192,hipblaslt,77916,0.3574675559997559,torch.float8_e4m3fnuz,torch.float16
8192,2977,8192,hipblaslt,77929,0.378450608253479,torch.float8_e4m3fnuz,torch.float16
57344,196,8192,hipblaslt,77917,0.23271019458770753,torch.float8_e4m3fnuz,torch.float16
8192,3102,8192,hipblaslt,78018,0.41139540672302244,torch.float8_e4m3fnuz,torch.float16
8192,406,28672,hipblaslt,77107,0.27918899059295654,torch.float8_e4m3fnuz,torch.float16
8192,1665,8192,hipblaslt,77945,0.21147730350494384,torch.float8_e4m3fnuz,torch.float16
10240,2559,8192,hipblaslt,77984,0.4117879390716553,torch.float8_e4m3fnuz,torch.float16
8192,4640,28672,hipblaslt,77895,2.0895931243896486,torch.float8_e4m3fnuz,torch.float16
8192,1405,8192,hipblaslt,77710,0.18927035331726075,torch.float8_e4m3fnuz,torch.float16
8192,5141,28672,hipblaslt,77901,2.281752014160156,torch.float8_e4m3fnuz,torch.float16
8192,65463,8192,hipblaslt,77924,7.532707850138347,torch.float8_e4m3fnuz,torch.float16
8192,2360,8192,hipblaslt,77722,0.31978371143341067,torch.float8_e4m3fnuz,torch.float16
8192,2348,28672,hipblaslt,77937,1.181582260131836,torch.float8_e4m3fnuz,torch.float16
10240,3809,8192,hipblaslt,77935,0.6103921413421631,torch.float8_e4m3fnuz,torch.float16
57344,3239,8192,hipblaslt,77913,2.983407211303711,torch.float8_e4m3fnuz,torch.float16
8192,2169,28672,hipblaslt,77927,1.0648273468017577,torch.float8_e4m3fnuz,torch.float16
10240,60101,8192,hipblaslt,77923,8.800946322354404,torch.float8_e4m3fnuz,torch.float16
8192,5374,8192,hipblaslt,77901,0.6467020034790039,torch.float8_e4m3fnuz,torch.float16
10240,49990,8192,hipblaslt,77921,7.378169133112981,torch.float8_e4m3fnuz,torch.float16
57344,2313,8192,hipblaslt,77935,2.1734855651855467,torch.float8_e4m3fnuz,torch.float16
8192,2421,8192,hipblaslt,77882,0.32173659801483157,torch.float8_e4m3fnuz,torch.float16
8192,2102,28672,hipblaslt,77614,1.0531861305236816,torch.float8_e4m3fnuz,torch.float16
57344,238,8192,hipblaslt,77534,0.2937330961227417,torch.float8_e4m3fnuz,torch.float16
57344,5769,8192,hipblaslt,77925,5.25197516547309,torch.float8_e4m3fnuz,torch.float16
8192,3503,28672,hipblaslt,77901,1.5602452278137207,torch.float8_e4m3fnuz,torch.float16
8192,966,28672,hipblaslt,42477,0.5040606021881103,torch.float8_e4m3fnuz,torch.float16
8192,786,8192,hipblaslt,77869,0.1342969536781311,torch.float8_e4m3fnuz,torch.float16
57344,2068,8192,hipblaslt,77952,1.9398313522338868,torch.float8_e4m3fnuz,torch.float16
8192,3356,28672,hipblaslt,78018,1.5134417533874511,torch.float8_e4m3fnuz,torch.float16
8192,2008,8192,hipblaslt,77926,0.2569746494293213,torch.float8_e4m3fnuz,torch.float16
8192,3326,28672,hipblaslt,77901,1.5103672981262206,torch.float8_e4m3fnuz,torch.float16
57344,722,8192,hipblaslt,77942,0.6899360179901123,torch.float8_e4m3fnuz,torch.float16
8192,4602,8192,hipblaslt,77888,0.5894932270050048,torch.float8_e4m3fnuz,torch.float16
57344,1278,8192,hipblaslt,77939,1.1208904266357422,torch.float8_e4m3fnuz,torch.float16
10240,3726,8192,hipblaslt,77890,0.6038764953613281,torch.float8_e4m3fnuz,torch.float16
8192,371,8192,hipblaslt,76783,0.07210484743118287,torch.float8_e4m3fnuz,torch.float16
57344,4679,8192,hipblaslt,77925,4.196614456176758,torch.float8_e4m3fnuz,torch.float16
57344,2035,8192,hipblaslt,77939,1.8410932540893554,torch.float8_e4m3fnuz,torch.float16
10240,1357,8192,hipblaslt,77926,0.24044814109802246,torch.float8_e4m3fnuz,torch.float16
8192,3158,28672,hipblaslt,77950,1.461987590789795,torch.float8_e4m3fnuz,torch.float16
8192,4199,28672,hipblaslt,77923,1.8026643753051759,torch.float8_e4m3fnuz,torch.float16
8192,4132,8192,hipblaslt,77924,0.4994037628173828,torch.float8_e4m3fnuz,torch.float16
57344,4631,8192,hipblaslt,77925,4.197459411621094,torch.float8_e4m3fnuz,torch.float16
57344,387,8192,hipblaslt,77961,0.4260430812835693,torch.float8_e4m3fnuz,torch.float16
8192,4491,8192,hipblaslt,77895,0.5764298915863038,torch.float8_e4m3fnuz,torch.float16
57344,1653,8192,hipblaslt,77952,1.5247225761413574,torch.float8_e4m3fnuz,torch.float16
10240,65269,8192,hipblaslt,77926,9.58060073852539,torch.float8_e4m3fnuz,torch.float16
10240,1531,8192,hipblaslt,77926,0.2590076446533203,torch.float8_e4m3fnuz,torch.float16
8192,4084,8192,hipblaslt,77924,0.48943099975585935,torch.float8_e4m3fnuz,torch.float16
8192,748,8192,hipblaslt,77867,0.11661674976348876,torch.float8_e4m3fnuz,torch.float16
8192,6503,28672,hipblaslt,77935,2.9860971450805662,torch.float8_e4m3fnuz,torch.float16
10240,412,8192,hipblaslt,77400,0.10326695442199707,torch.float8_e4m3fnuz,torch.float16
10240,2591,8192,hipblaslt,77826,0.4131840705871582,torch.float8_e4m3fnuz,torch.float16
8192,3853,8192,hipblaslt,77924,0.48049774169921877,torch.float8_e4m3fnuz,torch.float16
10240,118,28672,hipblaslt,76877,0.130827796459198,torch.float8_e4m3fnuz,torch.float16
57344,4098,8192,hipblaslt,77880,3.660696792602539,torch.float8_e4m3fnuz,torch.float16
8192,821,8192,hipblaslt,77869,0.12791149616241454,torch.float8_e4m3fnuz,torch.float16
8192,49990,8192,hipblaslt,77922,5.8202714920043945,torch.float8_e4m3fnuz,torch.float16
57344,174,8192,hipblaslt,77457,0.22787554264068605,torch.float8_e4m3fnuz,torch.float16
8192,416,28672,hipblaslt,76973,0.28404076099395753,torch.float8_e4m3fnuz,torch.float16
8192,3786,28672,hipblaslt,77755,1.764267349243164,torch.float8_e4m3fnuz,torch.float16
10240,2134,8192,hipblaslt,77916,0.36005334854125975,torch.float8_e4m3fnuz,torch.float16
8192,2073,28672,hipblaslt,77927,1.0322635650634766,torch.float8_e4m3fnuz,torch.float16
10240,1619,8192,hipblaslt,77882,0.2924952507019043,torch.float8_e4m3fnuz,torch.float16
8192,4080,8192,hipblaslt,77926,0.49706029891967773,torch.float8_e4m3fnuz,torch.float16
57344,755,8192,hipblaslt,77950,0.7046638488769531,torch.float8_e4m3fnuz,torch.float16
8192,2924,8192,hipblaslt,77960,0.369148850440979,torch.float8_e4m3fnuz,torch.float16
8192,5715,28672,hipblaslt,77925,2.64959716796875,torch.float8_e4m3fnuz,torch.float16
57344,1628,8192,hipblaslt,77952,1.5321339607238769,torch.float8_e4m3fnuz,torch.float16
10240,2084,8192,hipblaslt,42447,0.3626411914825439,torch.float8_e4m3fnuz,torch.float16
8192,4281,28672,hipblaslt,77696,1.9575155258178711,torch.float8_e4m3fnuz,torch.float16
8192,1157,28672,hipblaslt,77961,0.6261975765228271,torch.float8_e4m3fnuz,torch.float16
8192,4677,8192,hipblaslt,77917,0.5921751976013183,torch.float8_e4m3fnuz,torch.float16
8192,2282,28672,hipblaslt,77388,1.1021626472473145,torch.float8_e4m3fnuz,torch.float16
8192,5440,8192,hipblaslt,77829,0.6797088623046875,torch.float8_e4m3fnuz,torch.float16
8192,4431,8192,hipblaslt,77916,0.5651552200317382,torch.float8_e4m3fnuz,torch.float16
57344,5120,8192,hipblaslt,78012,4.481514358520508,torch.float8_e4m3fnuz,torch.float16
10240,3808,8192,hipblaslt,77942,0.6116580486297607,torch.float8_e4m3fnuz,torch.float16
57344,5320,8192,hipblaslt,77696,4.741575622558594,torch.float8_e4m3fnuz,torch.float16
10240,1761,8192,hipblaslt,77828,0.29991223812103274,torch.float8_e4m3fnuz,torch.float16
8192,755,28672,hipblaslt,77866,0.41596064567565916,torch.float8_e4m3fnuz,torch.float16
10240,1360,8192,hipblaslt,77948,0.2501545429229736,torch.float8_e4m3fnuz,torch.float16
10240,22390,8192,hipblaslt,77922,3.296581268310547,torch.float8_e4m3fnuz,torch.float16
10240,4360,8192,hipblaslt,77924,0.6962793827056885,torch.float8_e4m3fnuz,torch.float16
8192,690,8192,hipblaslt,77406,0.11786860227584839,torch.float8_e4m3fnuz,torch.float16
57344,578,8192,hipblaslt,77967,0.6139514446258545,torch.float8_e4m3fnuz,torch.float16
8192,2174,8192,hipblaslt,77828,0.29759080410003663,torch.float8_e4m3fnuz,torch.float16
10240,1538,8192,hipblaslt,77924,0.2586071014404297,torch.float8_e4m3fnuz,torch.float16
57344,4929,8192,hipblaslt,78012,4.4475761413574215,torch.float8_e4m3fnuz,torch.float16
10240,2352,8192,hipblaslt,77710,0.3752258539199829,torch.float8_e4m3fnuz,torch.float16
57344,570,8192,hipblaslt,77408,0.5768525123596191,torch.float8_e4m3fnuz,torch.float16
57344,2993,8192,hipblaslt,77935,2.6914987564086914,torch.float8_e4m3fnuz,torch.float16
57344,4512,8192,hipblaslt,78017,3.994174575805664,torch.float8_e4m3fnuz,torch.float16
57344,1033,8192,hipblaslt,77961,1.0134112358093261,torch.float8_e4m3fnuz,torch.float16
57344,253,8192,hipblaslt,77764,0.29225289821624756,torch.float8_e4m3fnuz,torch.float16
8192,2872,28672,hipblaslt,77895,1.3244598388671875,torch.float8_e4m3fnuz,torch.float16
57344,5576,8192,hipblaslt,77880,4.928361189992804,torch.float8_e4m3fnuz,torch.float16
8192,1987,28672,hipblaslt,77966,0.9003816604614258,torch.float8_e4m3fnuz,torch.float16
8192,7308,28672,hipblaslt,77918,3.370616912841797,torch.float8_e4m3fnuz,torch.float16
8192,2154,28672,hipblaslt,77818,1.0797273635864257,torch.float8_e4m3fnuz,torch.float16
10240,3803,8192,hipblaslt,77877,0.6038545131683349,torch.float8_e4m3fnuz,torch.float16
8192,1243,8192,hipblaslt,77723,0.18172719478607177,torch.float8_e4m3fnuz,torch.float16
8192,269,8192,hipblaslt,76808,0.06427720189094543,torch.float8_e4m3fnuz,torch.float16
57344,946,8192,hipblaslt,77952,0.8921795845031738,torch.float8_e4m3fnuz,torch.float16
10240,167,8192,hipblaslt,76782,0.057845699787139895,torch.float8_e4m3fnuz,torch.float16
57344,25,8192,hipblaslt,77996,0.13805395364761353,torch.float8_e4m3fnuz,torch.float16
57344,196,28672,hipblaslt,77441,0.8296890258789062,torch.float8_e4m3fnuz,torch.float16
8192,24338,8192,hipblaslt,77924,2.847686195373535,torch.float8_e4m3fnuz,torch.float16
8192,1472,28672,hipblaslt,77895,0.6751380443572998,torch.float8_e4m3fnuz,torch.float16
8192,511,8192,hipblaslt,42415,0.08934029936790466,torch.float8_e4m3fnuz,torch.float16
10240,2778,8192,hipblaslt,78016,0.43083820343017576,torch.float8_e4m3fnuz,torch.float16
8192,1302,8192,hipblaslt,77695,0.1924239993095398,torch.float8_e4m3fnuz,torch.float16
8192,3055,8192,hipblaslt,77942,0.4022218227386475,torch.float8_e4m3fnuz,torch.float16
10240,1721,8192,hipblaslt,77423,0.30496973991394044,torch.float8_e4m3fnuz,torch.float16
10240,31,8192,hipblaslt,42489,0.03432885110378266,torch.float8_e4m3fnuz,torch.float16
10240,5725,8192,hipblaslt,77877,0.8530316352844238,torch.float8_e4m3fnuz,torch.float16
8192,971,8192,hipblaslt,77403,0.1448475480079651,torch.float8_e4m3fnuz,torch.float16
57344,5884,8192,hipblaslt,77942,5.3177774217393665,torch.float8_e4m3fnuz,torch.float16
10240,3320,8192,hipblaslt,77922,0.4998744487762451,torch.float8_e4m3fnuz,torch.float16
8192,5077,28672,hipblaslt,78012,2.2203208923339846,torch.float8_e4m3fnuz,torch.float16
8192,2144,8192,hipblaslt,77993,0.3063177585601807,torch.float8_e4m3fnuz,torch.float16
8192,2338,8192,hipblaslt,77912,0.32027440071105956,torch.float8_e4m3fnuz,torch.float16
57344,2219,8192,hipblaslt,77950,2.0221574783325194,torch.float8_e4m3fnuz,torch.float16
57344,1208,8192,hipblaslt,77950,1.1494545936584473,torch.float8_e4m3fnuz,torch.float16
8192,833,8192,hipblaslt,77869,0.1364801526069641,torch.float8_e4m3fnuz,torch.float16
10240,632,8192,hipblaslt,77869,0.1346614956855774,torch.float8_e4m3fnuz,torch.float16
8192,6065,28672,hipblaslt,77924,2.6617727279663086,torch.float8_e4m3fnuz,torch.float16
57344,3756,8192,hipblaslt,77880,3.380585479736328,torch.float8_e4m3fnuz,torch.float16
8192,6139,8192,hipblaslt,77924,0.7387743473052979,torch.float8_e4m3fnuz,torch.float16
8192,5249,8192,hipblaslt,77942,0.6385358333587646,torch.float8_e4m3fnuz,torch.float16
10240,2052,8192,hipblaslt,77937,0.35242204666137694,torch.float8_e4m3fnuz,torch.float16
10240,5348,8192,hipblaslt,77973,0.8221638679504395,torch.float8_e4m3fnuz,torch.float16
8192,2632,8192,hipblaslt,77937,0.35442500114440917,torch.float8_e4m3fnuz,torch.float16
10240,2628,8192,hipblaslt,77973,0.41731414794921873,torch.float8_e4m3fnuz,torch.float16
8192,1179,28672,hipblaslt,77675,0.6281604766845703,torch.float8_e4m3fnuz,torch.float16
8192,1886,8192,hipblaslt,77924,0.2547173023223877,torch.float8_e4m3fnuz,torch.float16
57344,806,8192,hipblaslt,77926,0.8087199211120606,torch.float8_e4m3fnuz,torch.float16
10240,153,8192,hipblaslt,76808,0.059516149759292605,torch.float8_e4m3fnuz,torch.float16
8192,3478,8192,hipblaslt,77903,0.4304055690765381,torch.float8_e4m3fnuz,torch.float16
57344,1827,8192,hipblaslt,77952,1.7234088897705078,torch.float8_e4m3fnuz,torch.float16
8192,474,28672,hipblaslt,76863,0.3005511999130249,torch.float8_e4m3fnuz,torch.float16
8192,3614,8192,hipblaslt,78018,0.4361000061035156,torch.float8_e4m3fnuz,torch.float16
57344,121,8192,hipblaslt,77445,0.18785879611968995,torch.float8_e4m3fnuz,torch.float16
10240,1839,8192,hipblaslt,77605,0.31217644214630125,torch.float8_e4m3fnuz,torch.float16
8192,1712,28672,hipblaslt,77877,0.7678494453430176,torch.float8_e4m3fnuz,torch.float16
8192,2527,8192,hipblaslt,77829,0.3325065612792969,torch.float8_e4m3fnuz,torch.float16
57344,4735,8192,hipblaslt,77880,4.308714294433594,torch.float8_e4m3fnuz,torch.float16
8192,2005,8192,hipblaslt,77897,0.2585770606994629,torch.float8_e4m3fnuz,torch.float16
57344,1384,8192,hipblaslt,77939,1.3061126708984374,torch.float8_e4m3fnuz,torch.float16
57344,355,8192,hipblaslt,77937,0.3963351011276245,torch.float8_e4m3fnuz,torch.float16
8192,4477,8192,hipblaslt,77916,0.55032320022583,torch.float8_e4m3fnuz,torch.float16
8192,910,8192,hipblaslt,77388,0.13995330333709716,torch.float8_e4m3fnuz,torch.float16
10240,4640,8192,hipblaslt,77885,0.7288957118988038,torch.float8_e4m3fnuz,torch.float16
10240,2275,8192,hipblaslt,77960,0.37117979526519773,torch.float8_e4m3fnuz,torch.float16
8192,4391,28672,hipblaslt,77696,1.9645620346069337,torch.float8_e4m3fnuz,torch.float16
8192,2801,28672,hipblaslt,77928,1.3227534294128418,torch.float8_e4m3fnuz,torch.float16
10240,2476,8192,hipblaslt,77973,0.40378413200378416,torch.float8_e4m3fnuz,torch.float16
57344,46,8192,hipblaslt,77989,0.14965314865112306,torch.float8_e4m3fnuz,torch.float16
8192,5180,8192,hipblaslt,77888,0.6224120140075684,torch.float8_e4m3fnuz,torch.float16
57344,3984,8192,hipblaslt,78012,3.467333984375,torch.float8_e4m3fnuz,torch.float16
57344,481,8192,hipblaslt,77939,0.5132051467895508,torch.float8_e4m3fnuz,torch.float16
10240,525,8192,hipblaslt,77867,0.1172797441482544,torch.float8_e4m3fnuz,torch.float16
57344,878,8192,hipblaslt,77926,0.8164093971252442,torch.float8_e4m3fnuz,torch.float16
10240,3186,8192,hipblaslt,77922,0.4876884460449219,torch.float8_e4m3fnuz,torch.float16
10240,5158,8192,hipblaslt,77973,0.8066349029541016,torch.float8_e4m3fnuz,torch.float16
8192,6066,28672,hipblaslt,77924,2.6669443130493162,torch.float8_e4m3fnuz,torch.float16
8192,1888,8192,hipblaslt,77897,0.2554663896560669,torch.float8_e4m3fnuz,torch.float16
10240,235,28672,hipblaslt,77178,0.2063356399536133,torch.float8_e4m3fnuz,torch.float16
10240,62286,8192,hipblaslt,77923,9.095372772216797,torch.float8_e4m3fnuz,torch.float16
10240,3329,8192,hipblaslt,77966,0.5010322093963623,torch.float8_e4m3fnuz,torch.float16
8192,1897,8192,hipblaslt,77923,0.2561654567718506,torch.float8_e4m3fnuz,torch.float16
8192,361,8192,hipblaslt,77376,0.07423195242881775,torch.float8_e4m3fnuz,torch.float16
57344,4594,8192,hipblaslt,77719,4.036477279663086,torch.float8_e4m3fnuz,torch.float16
10240,19,8192,hipblaslt,76556,0.033489099144935607,torch.float8_e4m3fnuz,torch.float16
57344,5415,8192,hipblaslt,77880,4.841086538214433,torch.float8_e4m3fnuz,torch.float16
8192,1590,8192,hipblaslt,78018,0.2127070426940918,torch.float8_e4m3fnuz,torch.float16
8192,6932,28672,hipblaslt,77984,3.077853202819824,torch.float8_e4m3fnuz,torch.float16
10240,727,8192,hipblaslt,77870,0.14438785314559938,torch.float8_e4m3fnuz,torch.float16
10240,3795,8192,hipblaslt,77496,0.6163129329681396,torch.float8_e4m3fnuz,torch.float16
8192,104,8192,hipblaslt,77307,0.04516690075397491,torch.float8_e4m3fnuz,torch.float16
10240,2784,8192,hipblaslt,77720,0.43132495880126953,torch.float8_e4m3fnuz,torch.float16
57344,1297,8192,hipblaslt,77938,1.2074846267700194,torch.float8_e4m3fnuz,torch.float16
8192,1737,8192,hipblaslt,77880,0.24321229457855226,torch.float8_e4m3fnuz,torch.float16
57344,4763,8192,hipblaslt,77880,4.338909149169922,torch.float8_e4m3fnuz,torch.float16
57344,1523,8192,hipblaslt,77939,1.3585763931274415,torch.float8_e4m3fnuz,torch.float16
10240,3953,8192,hipblaslt,77984,0.6154176235198975,torch.float8_e4m3fnuz,torch.float16
8192,3629,8192,hipblaslt,77903,0.44139585494995115,torch.float8_e4m3fnuz,torch.float16
8192,1227,28672,hipblaslt,77917,0.6200058937072754,torch.float8_e4m3fnuz,torch.float16
57344,1218,8192,hipblaslt,77939,1.1174331665039063,torch.float8_e4m3fnuz,torch.float16
57344,4730,8192,hipblaslt,77880,4.289321517944336,torch.float8_e4m3fnuz,torch.float16
8192,1498,8192,hipblaslt,77945,0.20106985569000244,torch.float8_e4m3fnuz,torch.float16
10240,49628,8192,hipblaslt,77921,7.294198843149038,torch.float8_e4m3fnuz,torch.float16
8192,65323,8192,hipblaslt,77924,7.53903071085612,torch.float8_e4m3fnuz,torch.float16
57344,5691,8192,hipblaslt,77920,5.167410198010896,torch.float8_e4m3fnuz,torch.float16
8192,122,8192,hipblaslt,77857,0.04741869866847992,torch.float8_e4m3fnuz,torch.float16
10240,568,8192,hipblaslt,77399,0.12289204597473144,torch.float8_e4m3fnuz,torch.float16
8192,5468,28672,hipblaslt,77829,2.5381757736206056,torch.float8_e4m3fnuz,torch.float16
8192,559,28672,hipblaslt,76918,0.3386341094970703,torch.float8_e4m3fnuz,torch.float16
8192,4086,8192,hipblaslt,77921,0.4976010799407959,torch.float8_e4m3fnuz,torch.float16
8192,1553,8192,hipblaslt,77973,0.2126009464263916,torch.float8_e4m3fnuz,torch.float16
10240,2700,8192,hipblaslt,77496,0.4250376224517822,torch.float8_e4m3fnuz,torch.float16
8192,5211,8192,hipblaslt,77720,0.6400580883026123,torch.float8_e4m3fnuz,torch.float16
10240,946,8192,hipblaslt,77873,0.18001265525817872,torch.float8_e4m3fnuz,torch.float16
8192,1941,28672,hipblaslt,77921,0.8901564598083496,torch.float8_e4m3fnuz,torch.float16
8192,3715,8192,hipblaslt,77922,0.4693051815032959,torch.float8_e4m3fnuz,torch.float16
10240,4071,8192,hipblaslt,77720,0.6393590927124023,torch.float8_e4m3fnuz,torch.float16
10240,5589,8192,hipblaslt,77890,0.8440724372863769,torch.float8_e4m3fnuz,torch.float16
10240,493,8192,hipblaslt,42417,0.11608995199203491,torch.float8_e4m3fnuz,torch.float16
8192,5523,28672,hipblaslt,77755,2.528199005126953,torch.float8_e4m3fnuz,torch.float16
8192,684,28672,hipblaslt,77866,0.4072432518005371,torch.float8_e4m3fnuz,torch.float16
8192,417,8192,hipblaslt,77592,0.08804290294647217,torch.float8_e4m3fnuz,torch.float16
57344,1377,8192,hipblaslt,77950,1.2971815109252929,torch.float8_e4m3fnuz,torch.float16
57344,2426,8192,hipblaslt,77935,2.2039085388183595,torch.float8_e4m3fnuz,torch.float16
57344,5644,8192,hipblaslt,77935,5.117849985758464,torch.float8_e4m3fnuz,torch.float16
10240,5491,8192,hipblaslt,77973,0.8291902542114258,torch.float8_e4m3fnuz,torch.float16
8192,884,8192,hipblaslt,77869,0.13297300338745116,torch.float8_e4m3fnuz,torch.float16
10240,5007,8192,hipblaslt,77973,0.8023885726928711,torch.float8_e4m3fnuz,torch.float16
57344,5626,8192,hipblaslt,77880,5.1356454146535775,torch.float8_e4m3fnuz,torch.float16
57344,4590,8192,hipblaslt,77719,4.05072021484375,torch.float8_e4m3fnuz,torch.float16
10240,6564,8192,hipblaslt,77921,0.965456199645996,torch.float8_e4m3fnuz,torch.float16
10240,1371,8192,hipblaslt,77966,0.24860625267028807,torch.float8_e4m3fnuz,torch.float16
10240,2459,8192,hipblaslt,77938,0.40341958999633787,torch.float8_e4m3fnuz,torch.float16
8192,2515,8192,hipblaslt,77829,0.33703725337982177,torch.float8_e4m3fnuz,torch.float16
8192,3654,8192,hipblaslt,77922,0.46551761627197263,torch.float8_e4m3fnuz,torch.float16
10240,3598,8192,hipblaslt,78016,0.5969262599945069,torch.float8_e4m3fnuz,torch.float16
8192,4202,28672,hipblaslt,77921,1.7977249145507812,torch.float8_e4m3fnuz,torch.float16
8192,5833,8192,hipblaslt,77924,0.7229488849639892,torch.float8_e4m3fnuz,torch.float16
10240,6267,8192,hipblaslt,77900,0.9400283813476562,torch.float8_e4m3fnuz,torch.float16
57344,6989,8192,hipblaslt,77903,6.368561808268229,torch.float8_e4m3fnuz,torch.float16
57344,1330,8192,hipblaslt,77895,1.2078891754150392,torch.float8_e4m3fnuz,torch.float16
10240,1645,8192,hipblaslt,77836,0.2983659505844116,torch.float8_e4m3fnuz,torch.float16
8192,1293,8192,hipblaslt,77723,0.1874035954475403,torch.float8_e4m3fnuz,torch.float16
10240,227,28672,hipblaslt,77126,0.20978875160217286,torch.float8_e4m3fnuz,torch.float16
8192,2980,28672,hipblaslt,77895,1.3629169464111328,torch.float8_e4m3fnuz,torch.float16
8192,3435,28672,hipblaslt,77903,1.5235108375549316,torch.float8_e4m3fnuz,torch.float16
8192,2487,28672,hipblaslt,77937,1.1977261543273925,torch.float8_e4m3fnuz,torch.float16
8192,13,8192,hipblaslt,76469,0.027957400679588316,torch.float8_e4m3fnuz,torch.float16
10240,2092,8192,hipblaslt,77723,0.3685960054397583,torch.float8_e4m3fnuz,torch.float16
8192,2346,28672,hipblaslt,77418,1.1797094345092773,torch.float8_e4m3fnuz,torch.float16
57344,4439,8192,hipblaslt,77925,3.9874946594238283,torch.float8_e4m3fnuz,torch.float16
8192,1656,8192,hipblaslt,77913,0.21841554641723632,torch.float8_e4m3fnuz,torch.float16
10240,8437,8192,hipblaslt,77921,1.241116428375244,torch.float8_e4m3fnuz,torch.float16
8192,1125,8192,hipblaslt,77872,0.16121079921722412,torch.float8_e4m3fnuz,torch.float16
8192,528,8192,hipblaslt,77400,0.10439465045928956,torch.float8_e4m3fnuz,torch.float16
8192,2272,28672,hipblaslt,77593,1.109545612335205,torch.float8_e4m3fnuz,torch.float16
8192,2740,28672,hipblaslt,77424,1.3105572700500487,torch.float8_e4m3fnuz,torch.float16
57344,2050,8192,hipblaslt,77913,1.9588655471801757,torch.float8_e4m3fnuz,torch.float16
8192,3594,28672,hipblaslt,77903,1.5708269119262694,torch.float8_e4m3fnuz,torch.float16
8192,702,28672,hipblaslt,77586,0.4137488842010498,torch.float8_e4m3fnuz,torch.float16
8192,1714,28672,hipblaslt,77877,0.7584895610809326,torch.float8_e4m3fnuz,torch.float16
8192,63675,8192,hipblaslt,77922,7.379244877741887,torch.float8_e4m3fnuz,torch.float16
8192,3570,8192,hipblaslt,77903,0.43259878158569337,torch.float8_e4m3fnuz,torch.float16
10240,1733,8192,hipblaslt,77993,0.3176935911178589,torch.float8_e4m3fnuz,torch.float16
57344,49957,8192,hipblaslt,77880,43.3833740234375,torch.float8_e4m3fnuz,torch.float16
8192,5325,8192,hipblaslt,77496,0.6381232261657714,torch.float8_e4m3fnuz,torch.float16
8192,830,8192,hipblaslt,77871,0.14470034837722778,torch.float8_e4m3fnuz,torch.float16
8192,7253,8192,hipblaslt,77942,0.8632827758789062,torch.float8_e4m3fnuz,torch.float16
10240,1547,8192,hipblaslt,77904,0.25731515884399414,torch.float8_e4m3fnuz,torch.float16
10240,4505,8192,hipblaslt,77965,0.7181037425994873,torch.float8_e4m3fnuz,torch.float16
10240,6,8192,hipblaslt,77271,0.03164285123348236,torch.float8_e4m3fnuz,torch.float16
8192,2563,8192,hipblaslt,77829,0.33257265090942384,torch.float8_e4m3fnuz,torch.float16
10240,825,8192,hipblaslt,77872,0.15817179679870605,torch.float8_e4m3fnuz,torch.float16
8192,6195,8192,hipblaslt,77924,0.7398438930511475,torch.float8_e4m3fnuz,torch.float16
8192,2411,28672,hipblaslt,42464,1.1836753845214845,torch.float8_e4m3fnuz,torch.float16
10240,1697,8192,hipblaslt,77614,0.30250205993652346,torch.float8_e4m3fnuz,torch.float16
8192,1891,28672,hipblaslt,77921,0.8858572006225586,torch.float8_e4m3fnuz,torch.float16
57344,2373,8192,hipblaslt,77920,2.230906677246094,torch.float8_e4m3fnuz,torch.float16
8192,5003,28672,hipblaslt,77942,2.252800941467285,torch.float8_e4m3fnuz,torch.float16
8192,1025,28672,hipblaslt,77936,0.5328173160552978,torch.float8_e4m3fnuz,torch.float16
57344,1636,8192,hipblaslt,77950,1.5469815254211425,torch.float8_e4m3fnuz,torch.float16
8192,38,8192,hipblaslt,77289,0.032645851373672485,torch.float8_e4m3fnuz,torch.float16
57344,6481,8192,hipblaslt,77926,5.880090236663818,torch.float8_e4m3fnuz,torch.float16
10240,4998,8192,hipblaslt,77888,0.8010986328125,torch.float8_e4m3fnuz,torch.float16
10240,953,8192,hipblaslt,77723,0.18248430490493775,torch.float8_e4m3fnuz,torch.float16
8192,306,28672,hipblaslt,76889,0.20134425163269043,torch.float8_e4m3fnuz,torch.float16
8192,4934,8192,hipblaslt,77984,0.6115118503570557,torch.float8_e4m3fnuz,torch.float16
57344,5404,8192,hipblaslt,77880,4.82310646458676,torch.float8_e4m3fnuz,torch.float16
10240,4848,8192,hipblaslt,77924,0.7385079383850097,torch.float8_e4m3fnuz,torch.float16
8192,4095,28672,hipblaslt,77924,1.787922477722168,torch.float8_e4m3fnuz,torch.float16
8192,638,8192,hipblaslt,77392,0.10637960433959961,torch.float8_e4m3fnuz,torch.float16
10240,962,8192,hipblaslt,77743,0.18156495094299316,torch.float8_e4m3fnuz,torch.float16
8192,4042,8192,hipblaslt,77924,0.4988429546356201,torch.float8_e4m3fnuz,torch.float16
57344,2978,8192,hipblaslt,77935,2.6923200607299806,torch.float8_e4m3fnuz,torch.float16
8192,3084,8192,hipblaslt,77928,0.39398560523986814,torch.float8_e4m3fnuz,torch.float16
57344,1855,8192,hipblaslt,77952,1.744117546081543,torch.float8_e4m3fnuz,torch.float16
10240,3926,8192,hipblaslt,77984,0.6239021778106689,torch.float8_e4m3fnuz,torch.float16
8192,932,8192,hipblaslt,77593,0.14222270250320435,torch.float8_e4m3fnuz,torch.float16
57344,1275,8192,hipblaslt,77939,1.1304003715515136,torch.float8_e4m3fnuz,torch.float16
10240,1332,8192,hipblaslt,77952,0.21463994979858397,torch.float8_e4m3fnuz,torch.float16
10240,5923,8192,hipblaslt,77921,0.9046820640563965,torch.float8_e4m3fnuz,torch.float16
8192,4648,28672,hipblaslt,77895,2.0761674880981444,torch.float8_e4m3fnuz,torch.float16
8192,3053,28672,hipblaslt,77967,1.3668466567993165,torch.float8_e4m3fnuz,torch.float16
57344,483,8192,hipblaslt,77950,0.49012203216552735,torch.float8_e4m3fnuz,torch.float16
10240,2427,8192,hipblaslt,77967,0.3969119548797607,torch.float8_e4m3fnuz,torch.float16
8192,4987,8192,hipblaslt,77903,0.6203569412231446,torch.float8_e4m3fnuz,torch.float16
8192,10,28672,hipblaslt,76530,0.07592244744300843,torch.float8_e4m3fnuz,torch.float16
10240,49957,8192,hipblaslt,77922,7.336874741774339,torch.float8_e4m3fnuz,torch.float16
8192,460,8192,hipblaslt,42415,0.0838682472705841,torch.float8_e4m3fnuz,torch.float16
8192,1729,8192,hipblaslt,77923,0.2380366563796997,torch.float8_e4m3fnuz,torch.float16
10240,2210,8192,hipblaslt,77723,0.35849499702453613,torch.float8_e4m3fnuz,torch.float16
8192,1347,28672,hipblaslt,77961,0.6556252002716064,torch.float8_e4m3fnuz,torch.float16
10240,5792,8192,hipblaslt,77921,0.8924094200134277,torch.float8_e4m3fnuz,torch.float16
8192,2743,28672,hipblaslt,77424,1.3068938255310059,torch.float8_e4m3fnuz,torch.float16
57344,2443,8192,hipblaslt,77920,2.2466299057006838,torch.float8_e4m3fnuz,torch.float16
10240,2949,8192,hipblaslt,77924,0.47813825607299804,torch.float8_e4m3fnuz,torch.float16
57344,1034,8192,hipblaslt,77938,0.9982386589050293,torch.float8_e4m3fnuz,torch.float16
10240,1781,8192,hipblaslt,77828,0.30037095546722414,torch.float8_e4m3fnuz,torch.float16
8192,1778,8192,hipblaslt,77691,0.2501184940338135,torch.float8_e4m3fnuz,torch.float16
10240,365,8192,hipblaslt,77391,0.09039790034294129,torch.float8_e4m3fnuz,torch.float16
8192,2583,28672,hipblaslt,77829,1.2265108108520508,torch.float8_e4m3fnuz,torch.float16
57344,508,8192,hipblaslt,77871,0.5212922096252441,torch.float8_e4m3fnuz,torch.float16
8192,3829,8192,hipblaslt,77924,0.47911767959594725,torch.float8_e4m3fnuz,torch.float16
8192,1627,8192,hipblaslt,77913,0.21696939468383789,torch.float8_e4m3fnuz,torch.float16
8192,1541,28672,hipblaslt,77895,0.7063463211059571,torch.float8_e4m3fnuz,torch.float16
8192,5506,8192,hipblaslt,77925,0.6850226879119873,torch.float8_e4m3fnuz,torch.float16
57344,1385,8192,hipblaslt,77939,1.307152271270752,torch.float8_e4m3fnuz,torch.float16
8192,4449,8192,hipblaslt,77929,0.5542089462280273,torch.float8_e4m3fnuz,torch.float16
8192,6531,28672,hipblaslt,77945,2.9769176483154296,torch.float8_e4m3fnuz,torch.float16
8192,7565,28672,hipblaslt,77895,3.4525222778320312,torch.float8_e4m3fnuz,torch.float16
57344,662,8192,hipblaslt,77917,0.6254364490509033,torch.float8_e4m3fnuz,torch.float16
57344,2598,8192,hipblaslt,77925,2.3816158294677736,torch.float8_e4m3fnuz,torch.float16
10240,7435,8192,hipblaslt,77924,1.1364874839782715,torch.float8_e4m3fnuz,torch.float16
8192,4354,8192,hipblaslt,77976,0.5521979331970215,torch.float8_e4m3fnuz,torch.float16
8192,1697,8192,hipblaslt,77952,0.21457984447479247,torch.float8_e4m3fnuz,torch.float16
8192,3763,8192,hipblaslt,77923,0.4676968574523926,torch.float8_e4m3fnuz,torch.float16
8192,2299,28672,hipblaslt,77830,1.1060564041137695,torch.float8_e4m3fnuz,torch.float16
8192,1184,8192,hipblaslt,77723,0.17921750545501708,torch.float8_e4m3fnuz,torch.float16
10240,630,8192,hipblaslt,77869,0.1328487992286682,torch.float8_e4m3fnuz,torch.float16
8192,4093,8192,hipblaslt,77981,0.49734067916870117,torch.float8_e4m3fnuz,torch.float16
57344,7106,8192,hipblaslt,77925,6.403387451171875,torch.float8_e4m3fnuz,torch.float16
8192,4042,28672,hipblaslt,77924,1.7824283599853517,torch.float8_e4m3fnuz,torch.float16
57344,1806,8192,hipblaslt,77952,1.710385513305664,torch.float8_e4m3fnuz,torch.float16
10240,1565,8192,hipblaslt,77924,0.25366175174713135,torch.float8_e4m3fnuz,torch.float16
57344,2497,8192,hipblaslt,77950,2.3023664474487306,torch.float8_e4m3fnuz,torch.float16
10240,2062,8192,hipblaslt,77960,0.34868249893188474,torch.float8_e4m3fnuz,torch.float16
57344,618,8192,hipblaslt,77928,0.6186503887176513,torch.float8_e4m3fnuz,torch.float16
8192,1634,8192,hipblaslt,78016,0.21299755573272705,torch.float8_e4m3fnuz,torch.float16
8192,2270,8192,hipblaslt,77828,0.30098984241485593,torch.float8_e4m3fnuz,torch.float16
10240,64973,8192,hipblaslt,77922,9.554399871826172,torch.float8_e4m3fnuz,torch.float16
57344,3702,8192,hipblaslt,77880,3.361583709716797,torch.float8_e4m3fnuz,torch.float16
10240,4664,8192,hipblaslt,77897,0.7260314464569092,torch.float8_e4m3fnuz,torch.float16
8192,2700,8192,hipblaslt,77960,0.35619463920593264,torch.float8_e4m3fnuz,torch.float16
8192,3182,28672,hipblaslt,77950,1.477903175354004,torch.float8_e4m3fnuz,torch.float16
10240,2687,8192,hipblaslt,77496,0.42003622055053713,torch.float8_e4m3fnuz,torch.float16
8192,4732,8192,hipblaslt,77903,0.6001990795135498,torch.float8_e4m3fnuz,torch.float16
8192,3783,8192,hipblaslt,77924,0.46613850593566897,torch.float8_e4m3fnuz,torch.float16
8192,2211,8192,hipblaslt,77593,0.2965472459793091,torch.float8_e4m3fnuz,torch.float16
8192,249,28672,hipblaslt,76879,0.17686699628829955,torch.float8_e4m3fnuz,torch.float16
8192,3067,8192,hipblaslt,77938,0.4014866828918457,torch.float8_e4m3fnuz,torch.float16
57344,8474,8192,hipblaslt,77880,7.323512737567608,torch.float8_e4m3fnuz,torch.float16
57344,4981,8192,hipblaslt,78012,4.396843338012696,torch.float8_e4m3fnuz,torch.float16
8192,928,28672,hipblaslt,42477,0.520326805114746,torch.float8_e4m3fnuz,torch.float16
8192,2722,8192,hipblaslt,77916,0.35911595821380615,torch.float8_e4m3fnuz,torch.float16
8192,36,28672,hipblaslt,76834,0.07834805250167846,torch.float8_e4m3fnuz,torch.float16
8192,5135,28672,hipblaslt,77888,2.276205825805664,torch.float8_e4m3fnuz,torch.float16
8192,2354,8192,hipblaslt,77722,0.31842570304870604,torch.float8_e4m3fnuz,torch.float16
57344,664,8192,hipblaslt,77961,0.6300032138824463,torch.float8_e4m3fnuz,torch.float16
57344,971,8192,hipblaslt,77939,0.907680606842041,torch.float8_e4m3fnuz,torch.float16
57344,2641,8192,hipblaslt,77925,2.39254207611084,torch.float8_e4m3fnuz,torch.float16
10240,1904,8192,hipblaslt,77722,0.3218407392501831,torch.float8_e4m3fnuz,torch.float16
8192,739,28672,hipblaslt,77866,0.4159912109375,torch.float8_e4m3fnuz,torch.float16
10240,288,8192,hipblaslt,76783,0.07249590158462524,torch.float8_e4m3fnuz,torch.float16
8192,2631,28672,hipblaslt,77937,1.250460433959961,torch.float8_e4m3fnuz,torch.float16
10240,4344,8192,hipblaslt,77981,0.6958447933197022,torch.float8_e4m3fnuz,torch.float16
10240,2058,8192,hipblaslt,77723,0.3533674478530884,torch.float8_e4m3fnuz,torch.float16
8192,118,28672,hipblaslt,77048,0.10936499834060669,torch.float8_e4m3fnuz,torch.float16
8192,1783,28672,hipblaslt,77950,0.7735719203948974,torch.float8_e4m3fnuz,torch.float16
57344,4632,8192,hipblaslt,77925,4.195420837402343,torch.float8_e4m3fnuz,torch.float16
8192,2707,8192,hipblaslt,77916,0.3599852561950684,torch.float8_e4m3fnuz,torch.float16
8192,1302,28672,hipblaslt,77917,0.6259130954742431,torch.float8_e4m3fnuz,torch.float16
57344,630,8192,hipblaslt,77938,0.6285810947418213,torch.float8_e4m3fnuz,torch.float16
10240,2914,8192,hipblaslt,77921,0.4726841926574707,torch.float8_e4m3fnuz,torch.float16
8192,2081,28672,hipblaslt,77936,1.0525090217590332,torch.float8_e4m3fnuz,torch.float16
10240,2127,8192,hipblaslt,77885,0.35765230655670166,torch.float8_e4m3fnuz,torch.float16
8192,4444,8192,hipblaslt,77929,0.549906587600708,torch.float8_e4m3fnuz,torch.float16
8192,3261,8192,hipblaslt,77942,0.4098230838775635,torch.float8_e4m3fnuz,torch.float16
8192,7010,8192,hipblaslt,77973,0.8456286430358887,torch.float8_e4m3fnuz,torch.float16
10240,2886,8192,hipblaslt,77924,0.45796642303466795,torch.float8_e4m3fnuz,torch.float16
10240,484,8192,hipblaslt,42417,0.1114891529083252,torch.float8_e4m3fnuz,torch.float16
8192,6481,28672,hipblaslt,77984,2.9632673263549805,torch.float8_e4m3fnuz,torch.float16
10240,2734,8192,hipblaslt,77973,0.4302934169769287,torch.float8_e4m3fnuz,torch.float16
57344,6878,8192,hipblaslt,77880,6.016299724578857,torch.float8_e4m3fnuz,torch.float16
57344,2599,8192,hipblaslt,77925,2.375316619873047,torch.float8_e4m3fnuz,torch.float16
8192,3343,28672,hipblaslt,77942,1.5144614219665526,torch.float8_e4m3fnuz,torch.float16
8192,1934,28672,hipblaslt,77921,0.8855216979980469,torch.float8_e4m3fnuz,torch.float16
57344,412,8192,hipblaslt,77917,0.43935279846191405,torch.float8_e4m3fnuz,torch.float16
10240,1033,8192,hipblaslt,77941,0.18525240421295167,torch.float8_e4m3fnuz,torch.float16
57344,1165,8192,hipblaslt,77939,1.0904773712158202,torch.float8_e4m3fnuz,torch.float16
8192,7435,28672,hipblaslt,77916,3.4621124267578125,torch.float8_e4m3fnuz,torch.float16
10240,1837,8192,hipblaslt,77722,0.32037055492401123,torch.float8_e4m3fnuz,torch.float16
57344,6176,8192,hipblaslt,77880,5.570456560920267,torch.float8_e4m3fnuz,torch.float16
8192,3749,8192,hipblaslt,77981,0.4746370792388916,torch.float8_e4m3fnuz,torch.float16
57344,2796,8192,hipblaslt,77950,2.5475536346435548,torch.float8_e4m3fnuz,torch.float16
57344,2166,8192,hipblaslt,77950,1.990216064453125,torch.float8_e4m3fnuz,torch.float16
57344,2104,8192,hipblaslt,77952,1.9764837265014648,torch.float8_e4m3fnuz,torch.float16
57344,394,8192,hipblaslt,77967,0.4331515789031982,torch.float8_e4m3fnuz,torch.float16
57344,1395,8192,hipblaslt,77952,1.3039536476135254,torch.float8_e4m3fnuz,torch.float16
8192,2188,8192,hipblaslt,77722,0.3117337942123413,torch.float8_e4m3fnuz,torch.float16
8192,327,8192,hipblaslt,76783,0.06957705020904541,torch.float8_e4m3fnuz,torch.float16
8192,218,8192,hipblaslt,77174,0.06265934705734252,torch.float8_e4m3fnuz,torch.float16
10240,6783,8192,hipblaslt,78016,1.0305645942687989,torch.float8_e4m3fnuz,torch.float16
8192,503,28672,hipblaslt,77188,0.2964345932006836,torch.float8_e4m3fnuz,torch.float16
57344,3800,8192,hipblaslt,77880,3.359708786010742,torch.float8_e4m3fnuz,torch.float16
8192,1368,8192,hipblaslt,77723,0.19633084535598755,torch.float8_e4m3fnuz,torch.float16
10240,5313,8192,hipblaslt,77935,0.8240426063537598,torch.float8_e4m3fnuz,torch.float16
8192,1128,8192,hipblaslt,42423,0.16528279781341554,torch.float8_e4m3fnuz,torch.float16
8192,7377,8192,hipblaslt,77981,0.9075814247131347,torch.float8_e4m3fnuz,torch.float16
8192,5709,28672,hipblaslt,77924,2.6335369110107423,torch.float8_e4m3fnuz,torch.float16
8192,4372,28672,hipblaslt,77696,1.9683095932006835,torch.float8_e4m3fnuz,torch.float16
57344,1865,8192,hipblaslt,77952,1.725468063354492,torch.float8_e4m3fnuz,torch.float16
10240,1452,8192,hipblaslt,77923,0.2506873607635498,torch.float8_e4m3fnuz,torch.float16
57344,3164,8192,hipblaslt,77952,2.8895803451538087,torch.float8_e4m3fnuz,torch.float16
10240,3992,8192,hipblaslt,77984,0.6207935810089111,torch.float8_e4m3fnuz,torch.float16
57344,600,8192,hipblaslt,77929,0.6188986778259278,torch.float8_e4m3fnuz,torch.float16
8192,1064,8192,hipblaslt,77722,0.1594001054763794,torch.float8_e4m3fnuz,torch.float16
10240,1915,8192,hipblaslt,77605,0.3191728115081787,torch.float8_e4m3fnuz,torch.float16
8192,2013,8192,hipblaslt,77922,0.2607903003692627,torch.float8_e4m3fnuz,torch.float16
8192,1341,8192,hipblaslt,77917,0.1852123498916626,torch.float8_e4m3fnuz,torch.float16
8192,2572,8192,hipblaslt,77829,0.3505232572555542,torch.float8_e4m3fnuz,torch.float16
8192,957,28672,hipblaslt,77870,0.5032118797302246,torch.float8_e4m3fnuz,torch.float16
57344,4218,8192,hipblaslt,77880,3.7392513275146486,torch.float8_e4m3fnuz,torch.float16
57344,2767,8192,hipblaslt,77950,2.5534963607788086,torch.float8_e4m3fnuz,torch.float16
8192,3763,28672,hipblaslt,77925,1.770101547241211,torch.float8_e4m3fnuz,torch.float16
10240,1864,8192,hipblaslt,77722,0.31726396083831787,torch.float8_e4m3fnuz,torch.float16
8192,2053,28672,hipblaslt,77956,1.0274293899536133,torch.float8_e4m3fnuz,torch.float16
8192,3438,8192,hipblaslt,77901,0.4199565887451172,torch.float8_e4m3fnuz,torch.float16
10240,1661,8192,hipblaslt,77828,0.2922869443893433,torch.float8_e4m3fnuz,torch.float16
8192,3327,8192,hipblaslt,77890,0.420274543762207,torch.float8_e4m3fnuz,torch.float16
10240,2244,8192,hipblaslt,77960,0.3670276403427124,torch.float8_e4m3fnuz,torch.float16
8192,2628,8192,hipblaslt,77886,0.3548275947570801,torch.float8_e4m3fnuz,torch.float16
57344,2041,8192,hipblaslt,77950,1.8467256546020507,torch.float8_e4m3fnuz,torch.float16
8192,1471,8192,hipblaslt,77967,0.2014523983001709,torch.float8_e4m3fnuz,torch.float16
8192,2042,8192,hipblaslt,77768,0.2792456388473511,torch.float8_e4m3fnuz,torch.float16
8192,2391,8192,hipblaslt,77722,0.31551740169525144,torch.float8_e4m3fnuz,torch.float16
57344,771,8192,hipblaslt,77940,0.7911900043487549,torch.float8_e4m3fnuz,torch.float16
8192,3000,28672,hipblaslt,77917,1.3697851181030274,torch.float8_e4m3fnuz,torch.float16
8192,411,8192,hipblaslt,42415,0.08036504983901978,torch.float8_e4m3fnuz,torch.float16
57344,2480,8192,hipblaslt,77935,2.224006462097168,torch.float8_e4m3fnuz,torch.float16
57344,528,8192,hipblaslt,77778,0.5540486812591553,torch.float8_e4m3fnuz,torch.float16
8192,1308,28672,hipblaslt,77961,0.6262621402740478,torch.float8_e4m3fnuz,torch.float16
8192,683,28672,hipblaslt,77867,0.4194313049316406,torch.float8_e4m3fnuz,torch.float16
57344,6791,8192,hipblaslt,77880,6.004749774932861,torch.float8_e4m3fnuz,torch.float16
57344,3798,8192,hipblaslt,77880,3.389510726928711,torch.float8_e4m3fnuz,torch.float16
10240,4966,8192,hipblaslt,77973,0.7904689311981201,torch.float8_e4m3fnuz,torch.float16
10240,124,28672,hipblaslt,76926,0.13683420419692993,torch.float8_e4m3fnuz,torch.float16
10240,1951,8192,hipblaslt,77829,0.3265321969985962,torch.float8_e4m3fnuz,torch.float16
8192,8153,8192,hipblaslt,77922,0.9706658363342285,torch.float8_e4m3fnuz,torch.float16
57344,4209,8192,hipblaslt,77880,3.6911174774169924,torch.float8_e4m3fnuz,torch.float16
8192,1878,8192,hipblaslt,77977,0.26066815853118896,torch.float8_e4m3fnuz,torch.float16
57344,1920,8192,hipblaslt,77952,1.7582704544067382,torch.float8_e4m3fnuz,torch.float16
10240,2137,8192,hipblaslt,77916,0.3580077886581421,torch.float8_e4m3fnuz,torch.float16
10240,80,8192,hipblaslt,77612,0.04407680034637451,torch.float8_e4m3fnuz,torch.float16
8192,3194,28672,hipblaslt,77950,1.4712493896484375,torch.float8_e4m3fnuz,torch.float16
10240,8306,8192,hipblaslt,77922,1.217084789276123,torch.float8_e4m3fnuz,torch.float16
57344,2868,8192,hipblaslt,77920,2.599953269958496,torch.float8_e4m3fnuz,torch.float16
10240,4614,8192,hipblaslt,77885,0.7261616706848144,torch.float8_e4m3fnuz,torch.float16
8192,3258,8192,hipblaslt,77877,0.41474037170410155,torch.float8_e4m3fnuz,torch.float16
8192,4636,28672,hipblaslt,77895,2.090927314758301,torch.float8_e4m3fnuz,torch.float16
8192,1066,28672,hipblaslt,77396,0.5652193069458008,torch.float8_e4m3fnuz,torch.float16
8192,3795,8192,hipblaslt,77924,0.4676567554473877,torch.float8_e4m3fnuz,torch.float16
8192,5601,8192,hipblaslt,77925,0.6914362430572509,torch.float8_e4m3fnuz,torch.float16
10240,5660,8192,hipblaslt,77901,0.848600959777832,torch.float8_e4m3fnuz,torch.float16
8192,1632,8192,hipblaslt,77952,0.2153029441833496,torch.float8_e4m3fnuz,torch.float16
8192,2806,8192,hipblaslt,77960,0.3662680387496948,torch.float8_e4m3fnuz,torch.float16
8192,2904,28672,hipblaslt,77895,1.3289606094360351,torch.float8_e4m3fnuz,torch.float16
57344,433,8192,hipblaslt,77967,0.4400798797607422,torch.float8_e4m3fnuz,torch.float16
8192,2519,8192,hipblaslt,77829,0.3343813419342041,torch.float8_e4m3fnuz,torch.float16
10240,65280,8192,hipblaslt,77926,9.556256866455078,torch.float8_e4m3fnuz,torch.float16
57344,2578,8192,hipblaslt,77925,2.3853254318237305,torch.float8_e4m3fnuz,torch.float16
57344,4535,8192,hipblaslt,77727,4.108978652954102,torch.float8_e4m3fnuz,torch.float16
8192,731,28672,hipblaslt,77586,0.41727509498596194,torch.float8_e4m3fnuz,torch.float16
8192,7377,28672,hipblaslt,77918,3.3887939453125,torch.float8_e4m3fnuz,torch.float16
10240,8131,8192,hipblaslt,77924,1.213687801361084,torch.float8_e4m3fnuz,torch.float16
10240,845,8192,hipblaslt,77722,0.1606719970703125,torch.float8_e4m3fnuz,torch.float16
8192,1457,8192,hipblaslt,77890,0.2035475492477417,torch.float8_e4m3fnuz,torch.float16
57344,3944,8192,hipblaslt,78012,3.43560905456543,torch.float8_e4m3fnuz,torch.float16
8192,4614,8192,hipblaslt,77917,0.5930985450744629,torch.float8_e4m3fnuz,torch.float16
8192,499,28672,hipblaslt,76973,0.3115695476531982,torch.float8_e4m3fnuz,torch.float16
8192,1129,8192,hipblaslt,77836,0.16089434623718263,torch.float8_e4m3fnuz,torch.float16
8192,589,8192,hipblaslt,77864,0.10456290245056152,torch.float8_e4m3fnuz,torch.float16
57344,1496,8192,hipblaslt,77950,1.320277786254883,torch.float8_e4m3fnuz,torch.float16
10240,1492,8192,hipblaslt,77943,0.26025755405426027,torch.float8_e4m3fnuz,torch.float16
8192,2916,28672,hipblaslt,78013,1.3704861640930175,torch.float8_e4m3fnuz,torch.float16
8192,2380,28672,hipblaslt,77418,1.1823393821716308,torch.float8_e4m3fnuz,torch.float16
8192,2732,8192,hipblaslt,77960,0.3600613594055176,torch.float8_e4m3fnuz,torch.float16
57344,8193,8192,hipblaslt,77880,7.24830334003155,torch.float8_e4m3fnuz,torch.float16
8192,3401,28672,hipblaslt,77901,1.5224251747131348,torch.float8_e4m3fnuz,torch.float16
8192,2139,8192,hipblaslt,77388,0.301424503326416,torch.float8_e4m3fnuz,torch.float16
8192,5882,8192,hipblaslt,77981,0.7224582195281982,torch.float8_e4m3fnuz,torch.float16
8192,1309,28672,hipblaslt,77938,0.6422112464904786,torch.float8_e4m3fnuz,torch.float16
8192,3441,8192,hipblaslt,77901,0.42260398864746096,torch.float8_e4m3fnuz,torch.float16
10240,1395,8192,hipblaslt,77839,0.2533552885055542,torch.float8_e4m3fnuz,torch.float16
8192,5415,28672,hipblaslt,77829,2.5278263092041016,torch.float8_e4m3fnuz,torch.float16
10240,1679,8192,hipblaslt,77957,0.3011921405792236,torch.float8_e4m3fnuz,torch.float16
10240,5591,8192,hipblaslt,77496,0.8473451614379883,torch.float8_e4m3fnuz,torch.float16
8192,1354,28672,hipblaslt,77961,0.6574323177337646,torch.float8_e4m3fnuz,torch.float16
10240,3301,8192,hipblaslt,77921,0.4988429069519043,torch.float8_e4m3fnuz,torch.float16
8192,5049,8192,hipblaslt,78016,0.6252922534942627,torch.float8_e4m3fnuz,torch.float16
8192,1295,28672,hipblaslt,77961,0.631400728225708,torch.float8_e4m3fnuz,torch.float16
8192,653,28672,hipblaslt,76807,0.4004396915435791,torch.float8_e4m3fnuz,torch.float16
10240,1807,8192,hipblaslt,77722,0.3247631072998047,torch.float8_e4m3fnuz,torch.float16
8192,2634,28672,hipblaslt,77937,1.234743022918701,torch.float8_e4m3fnuz,torch.float16
57344,5655,8192,hipblaslt,77880,5.141607987253289,torch.float8_e4m3fnuz,torch.float16
10240,5769,8192,hipblaslt,77960,0.8997608184814453,torch.float8_e4m3fnuz,torch.float16
57344,5968,8192,hipblaslt,78012,5.18058098687066,torch.float8_e4m3fnuz,torch.float16
57344,2258,8192,hipblaslt,77952,2.06652717590332,torch.float8_e4m3fnuz,torch.float16
57344,894,8192,hipblaslt,77926,0.8223642349243164,torch.float8_e4m3fnuz,torch.float16
10240,1524,8192,hipblaslt,77926,0.25711889266967775,torch.float8_e4m3fnuz,torch.float16
10240,953,28672,hipblaslt,77413,0.6206874370574951,torch.float8_e4m3fnuz,torch.float16
8192,31,28672,hipblaslt,77184,0.07666105031967163,torch.float8_e4m3fnuz,torch.float16
8192,4267,8192,hipblaslt,77976,0.5520893096923828,torch.float8_e4m3fnuz,torch.float16
57344,2285,8192,hipblaslt,77950,2.0654216766357423,torch.float8_e4m3fnuz,torch.float16
10240,2093,8192,hipblaslt,77960,0.35927619934082033,torch.float8_e4m3fnuz,torch.float16
57344,2543,8192,hipblaslt,77950,2.3542232513427734,torch.float8_e4m3fnuz,torch.float16
10240,4770,8192,hipblaslt,77924,0.7324570178985595,torch.float8_e4m3fnuz,torch.float16
10240,651,8192,hipblaslt,77869,0.13156239986419677,torch.float8_e4m3fnuz,torch.float16
57344,4587,8192,hipblaslt,78017,4.024517440795899,torch.float8_e4m3fnuz,torch.float16
8192,2085,8192,hipblaslt,77828,0.2930701494216919,torch.float8_e4m3fnuz,torch.float16
57344,1541,8192,hipblaslt,77938,1.3971296310424806,torch.float8_e4m3fnuz,torch.float16
10240,64946,8192,hipblaslt,77926,9.52695083618164,torch.float8_e4m3fnuz,torch.float16
8192,1461,28672,hipblaslt,77961,0.6709359169006348,torch.float8_e4m3fnuz,torch.float16
57344,777,8192,hipblaslt,77956,0.7942905902862549,torch.float8_e4m3fnuz,torch.float16
8192,1170,8192,hipblaslt,77873,0.17820794582366944,torch.float8_e4m3fnuz,torch.float16
57344,2186,8192,hipblaslt,77952,1.9933467864990235,torch.float8_e4m3fnuz,torch.float16
10240,4707,8192,hipblaslt,77966,0.7422174453735352,torch.float8_e4m3fnuz,torch.float16
8192,5858,8192,hipblaslt,77924,0.7216370105743408,torch.float8_e4m3fnuz,torch.float16
57344,2215,8192,hipblaslt,77950,2.0177228927612303,torch.float8_e4m3fnuz,torch.float16
57344,5813,8192,hipblaslt,77942,5.276037851969401,torch.float8_e4m3fnuz,torch.float16
10240,4273,8192,hipblaslt,77829,0.6820182800292969,torch.float8_e4m3fnuz,torch.float16
57344,4245,8192,hipblaslt,77925,3.7886962890625,torch.float8_e4m3fnuz,torch.float16
8192,5638,8192,hipblaslt,77925,0.7034299850463868,torch.float8_e4m3fnuz,torch.float16
57344,2062,8192,hipblaslt,77952,1.903790283203125,torch.float8_e4m3fnuz,torch.float16
8192,1869,28672,hipblaslt,77921,0.8732555389404297,torch.float8_e4m3fnuz,torch.float16
8192,3959,28672,hipblaslt,77925,1.7794300079345704,torch.float8_e4m3fnuz,torch.float16
8192,1912,28672,hipblaslt,77921,0.8810831069946289,torch.float8_e4m3fnuz,torch.float16
8192,3640,28672,hipblaslt,77942,1.5632076263427734,torch.float8_e4m3fnuz,torch.float16
8192,1981,8192,hipblaslt,77897,0.256920599937439,torch.float8_e4m3fnuz,torch.float16
8192,2657,28672,hipblaslt,77937,1.2527957916259767,torch.float8_e4m3fnuz,torch.float16
10240,128,8192,hipblaslt,77301,0.049447250366210935,torch.float8_e4m3fnuz,torch.float16
57344,6278,8192,hipblaslt,77945,5.6702746223000915,torch.float8_e4m3fnuz,torch.float16
8192,1885,28672,hipblaslt,77926,0.8896258354187012,torch.float8_e4m3fnuz,torch.float16
8192,2927,8192,hipblaslt,77941,0.38026330471038816,torch.float8_e4m3fnuz,torch.float16
8192,5034,8192,hipblaslt,77888,0.6230048656463623,torch.float8_e4m3fnuz,torch.float16
8192,4945,8192,hipblaslt,77942,0.6101057529449463,torch.float8_e4m3fnuz,torch.float16
8192,6550,28672,hipblaslt,77888,2.9957355499267577,torch.float8_e4m3fnuz,torch.float16
8192,65190,28672,hipblaslt,77924,27.7289794921875,torch.float8_e4m3fnuz,torch.float16
10240,921,8192,hipblaslt,77495,0.17280999422073365,torch.float8_e4m3fnuz,torch.float16
8192,65157,28672,hipblaslt,77924,27.777737426757813,torch.float8_e4m3fnuz,torch.float16
10240,5339,8192,hipblaslt,78016,0.8222800254821777,torch.float8_e4m3fnuz,torch.float16
8192,1344,8192,hipblaslt,77720,0.19825370311737062,torch.float8_e4m3fnuz,torch.float16
10240,98,8192,hipblaslt,76782,0.05157340168952942,torch.float8_e4m3fnuz,torch.float16
8192,4213,8192,hipblaslt,77924,0.5001869201660156,torch.float8_e4m3fnuz,torch.float16
8192,2495,28672,hipblaslt,77829,1.1993446350097656,torch.float8_e4m3fnuz,torch.float16
8192,2811,28672,hipblaslt,77918,1.304676628112793,torch.float8_e4m3fnuz,torch.float16
57344,6022,8192,hipblaslt,78012,5.160159640842014,torch.float8_e4m3fnuz,torch.float16
8192,150,28672,hipblaslt,76888,0.12355550527572631,torch.float8_e4m3fnuz,torch.float16
10240,904,8192,hipblaslt,77723,0.17611290216445924,torch.float8_e4m3fnuz,torch.float16
8192,3597,8192,hipblaslt,77973,0.43607397079467775,torch.float8_e4m3fnuz,torch.float16
8192,5321,8192,hipblaslt,77984,0.6409655094146729,torch.float8_e4m3fnuz,torch.float16
8192,6459,8192,hipblaslt,77935,0.8025909423828125,torch.float8_e4m3fnuz,torch.float16
8192,3793,8192,hipblaslt,77981,0.4726100444793701,torch.float8_e4m3fnuz,torch.float16
8192,2705,8192,hipblaslt,77960,0.35149269104003905,torch.float8_e4m3fnuz,torch.float16
57344,5408,8192,hipblaslt,77880,4.832461306923314,torch.float8_e4m3fnuz,torch.float16
57344,891,8192,hipblaslt,77923,0.8162912368774414,torch.float8_e4m3fnuz,torch.float16
8192,2925,8192,hipblaslt,77916,0.3762132883071899,torch.float8_e4m3fnuz,torch.float16
57344,3228,8192,hipblaslt,77935,2.9637542724609376,torch.float8_e4m3fnuz,torch.float16
10240,869,8192,hipblaslt,77494,0.16424930095672607,torch.float8_e4m3fnuz,torch.float16
8192,494,8192,hipblaslt,77592,0.08899980187416076,torch.float8_e4m3fnuz,torch.float16
8192,2318,8192,hipblaslt,77957,0.3172760009765625,torch.float8_e4m3fnuz,torch.float16
8192,619,28672,hipblaslt,77865,0.36835365295410155,torch.float8_e4m3fnuz,torch.float16
10240,7399,8192,hipblaslt,77924,1.129667377471924,torch.float8_e4m3fnuz,torch.float16
10240,2737,8192,hipblaslt,77720,0.4252338886260986,torch.float8_e4m3fnuz,torch.float16
57344,5150,8192,hipblaslt,77925,4.512343978881836,torch.float8_e4m3fnuz,torch.float16
57344,4945,8192,hipblaslt,78012,4.447908782958985,torch.float8_e4m3fnuz,torch.float16
57344,2277,8192,hipblaslt,77950,2.043458938598633,torch.float8_e4m3fnuz,torch.float16
10240,5037,8192,hipblaslt,77973,0.8050044059753418,torch.float8_e4m3fnuz,torch.float16
10240,1615,8192,hipblaslt,77593,0.2938032388687134,torch.float8_e4m3fnuz,torch.float16
8192,1515,8192,hipblaslt,78018,0.20520200729370117,torch.float8_e4m3fnuz,torch.float16
10240,1582,8192,hipblaslt,77423,0.2943840503692627,torch.float8_e4m3fnuz,torch.float16
8192,521,28672,hipblaslt,76918,0.34268460273742674,torch.float8_e4m3fnuz,torch.float16
8192,902,28672,hipblaslt,77871,0.4992154598236084,torch.float8_e4m3fnuz,torch.float16
57344,383,8192,hipblaslt,77689,0.4113412857055664,torch.float8_e4m3fnuz,torch.float16
8192,1104,28672,hipblaslt,77956,0.5443037986755371,torch.float8_e4m3fnuz,torch.float16
8192,6425,8192,hipblaslt,77888,0.8051446914672852,torch.float8_e4m3fnuz,torch.float16
10240,578,8192,hipblaslt,77869,0.13011225461959838,torch.float8_e4m3fnuz,torch.float16
10240,240,8192,hipblaslt,77376,0.07457950115203857,torch.float8_e4m3fnuz,torch.float16
57344,4792,8192,hipblaslt,77913,4.351435852050781,torch.float8_e4m3fnuz,torch.float16
10240,2815,8192,hipblaslt,77496,0.4323705196380615,torch.float8_e4m3fnuz,torch.float16
10240,3542,8192,hipblaslt,77928,0.5756487369537353,torch.float8_e4m3fnuz,torch.float16
8192,1852,8192,hipblaslt,77926,0.2518090486526489,torch.float8_e4m3fnuz,torch.float16
8192,1245,8192,hipblaslt,77873,0.17842830419540406,torch.float8_e4m3fnuz,torch.float16
8192,1838,8192,hipblaslt,77926,0.24119324684143068,torch.float8_e4m3fnuz,torch.float16
8192,583,28672,hipblaslt,77864,0.3717686891555786,torch.float8_e4m3fnuz,torch.float16
8192,5504,8192,hipblaslt,77925,0.6869415283203125,torch.float8_e4m3fnuz,torch.float16
10240,2843,8192,hipblaslt,77720,0.4317636013031006,torch.float8_e4m3fnuz,torch.float16
8192,1539,28672,hipblaslt,77895,0.6923295974731445,torch.float8_e4m3fnuz,torch.float16
8192,5467,8192,hipblaslt,77924,0.673624849319458,torch.float8_e4m3fnuz,torch.float16
10240,5653,8192,hipblaslt,77877,0.8487492561340332,torch.float8_e4m3fnuz,torch.float16
10240,809,8192,hipblaslt,77408,0.15630755424499512,torch.float8_e4m3fnuz,torch.float16
8192,6402,8192,hipblaslt,77984,0.8019659042358398,torch.float8_e4m3fnuz,torch.float16
10240,149,8192,hipblaslt,77306,0.06044600009918213,torch.float8_e4m3fnuz,torch.float16
8192,2206,8192,hipblaslt,77828,0.30258419513702395,torch.float8_e4m3fnuz,torch.float16
57344,5158,8192,hipblaslt,77942,4.627653121948242,torch.float8_e4m3fnuz,torch.float16
10240,945,8192,hipblaslt,77689,0.1799651026725769,torch.float8_e4m3fnuz,torch.float16
10240,2636,8192,hipblaslt,78016,0.41507883071899415,torch.float8_e4m3fnuz,torch.float16
10240,3180,8192,hipblaslt,77922,0.4943202495574951,torch.float8_e4m3fnuz,torch.float16
57344,3051,8192,hipblaslt,78012,2.7228271484375,torch.float8_e4m3fnuz,torch.float16
57344,754,8192,hipblaslt,77920,0.7027530193328857,torch.float8_e4m3fnuz,torch.float16
10240,2431,8192,hipblaslt,77928,0.3920788049697876,torch.float8_e4m3fnuz,torch.float16
8192,3001,28672,hipblaslt,77928,1.3619693756103515,torch.float8_e4m3fnuz,torch.float16
10240,1426,8192,hipblaslt,77926,0.24340455532073973,torch.float8_e4m3fnuz,torch.float16
8192,146,8192,hipblaslt,77300,0.052263402938842775,torch.float8_e4m3fnuz,torch.float16
57344,2691,8192,hipblaslt,77950,2.498432731628418,torch.float8_e4m3fnuz,torch.float16
57344,1862,8192,hipblaslt,77952,1.7339324951171875,torch.float8_e4m3fnuz,torch.float16
57344,2529,8192,hipblaslt,77950,2.2819162368774415,torch.float8_e4m3fnuz,torch.float16
10240,1727,8192,hipblaslt,77677,0.2977850914001465,torch.float8_e4m3fnuz,torch.float16
8192,1959,8192,hipblaslt,77926,0.2558490037918091,torch.float8_e4m3fnuz,torch.float16
8192,19,8192,hipblaslt,77272,0.029225298762321474,torch.float8_e4m3fnuz,torch.float16
8192,1755,8192,hipblaslt,77926,0.2490248441696167,torch.float8_e4m3fnuz,torch.float16
10240,1930,8192,hipblaslt,77829,0.33128674030303956,torch.float8_e4m3fnuz,torch.float16
57344,1608,8192,hipblaslt,77950,1.5204522132873535,torch.float8_e4m3fnuz,torch.float16
8192,890,28672,hipblaslt,77399,0.48070554733276366,torch.float8_e4m3fnuz,torch.float16
8192,4577,28672,hipblaslt,78013,2.0510602951049806,torch.float8_e4m3fnuz,torch.float16
8192,1146,28672,hipblaslt,77396,0.5703608989715576,torch.float8_e4m3fnuz,torch.float16
57344,129,8192,hipblaslt,77870,0.20166125297546386,torch.float8_e4m3fnuz,torch.float16
10240,5715,8192,hipblaslt,77496,0.855715560913086,torch.float8_e4m3fnuz,torch.float16
8192,8437,8192,hipblaslt,77926,0.9794789314270019,torch.float8_e4m3fnuz,torch.float16
8192,2314,28672,hipblaslt,77937,1.1656746864318848,torch.float8_e4m3fnuz,torch.float16
57344,3840,8192,hipblaslt,77935,3.4266021728515623,torch.float8_e4m3fnuz,torch.float16
10240,359,8192,hipblaslt,42415,0.08442109823226929,torch.float8_e4m3fnuz,torch.float16
8192,6789,8192,hipblaslt,77720,0.8374805450439453,torch.float8_e4m3fnuz,torch.float16
10240,7616,8192,hipblaslt,77923,1.149666976928711,torch.float8_e4m3fnuz,torch.float16
8192,5858,28672,hipblaslt,77924,2.639776420593262,torch.float8_e4m3fnuz,torch.float16
57344,2992,8192,hipblaslt,78017,2.676422691345215,torch.float8_e4m3fnuz,torch.float16
10240,2208,8192,hipblaslt,77916,0.3631278991699219,torch.float8_e4m3fnuz,torch.float16
8192,1134,8192,hipblaslt,77836,0.16316169500350952,torch.float8_e4m3fnuz,torch.float16
57344,3128,8192,hipblaslt,77928,2.856220817565918,torch.float8_e4m3fnuz,torch.float16
10240,3309,8192,hipblaslt,77922,0.4996181011199951,torch.float8_e4m3fnuz,torch.float16
10240,3214,8192,hipblaslt,77921,0.4917003631591797,torch.float8_e4m3fnuz,torch.float16
10240,2383,8192,hipblaslt,77976,0.3779197931289673,torch.float8_e4m3fnuz,torch.float16
57344,4426,8192,hipblaslt,78017,3.949614715576172,torch.float8_e4m3fnuz,torch.float16
57344,113,8192,hipblaslt,77805,0.18789479732513428,torch.float8_e4m3fnuz,torch.float16
57344,2526,8192,hipblaslt,77950,2.2958587646484374,torch.float8_e4m3fnuz,torch.float16
10240,3005,8192,hipblaslt,77921,0.4763296127319336,torch.float8_e4m3fnuz,torch.float16
8192,2088,28672,hipblaslt,77936,1.0746979713439941,torch.float8_e4m3fnuz,torch.float16
8192,2122,28672,hipblaslt,77927,1.0647952079772949,torch.float8_e4m3fnuz,torch.float16
10240,4459,8192,hipblaslt,77924,0.6961061477661132,torch.float8_e4m3fnuz,torch.float16
8192,703,8192,hipblaslt,77866,0.1183163046836853,torch.float8_e4m3fnuz,torch.float16
8192,2187,28672,hipblaslt,77927,1.0886125564575195,torch.float8_e4m3fnuz,torch.float16
57344,5304,8192,hipblaslt,77719,4.736820983886719,torch.float8_e4m3fnuz,torch.float16
10240,3963,8192,hipblaslt,78016,0.6277499198913574,torch.float8_e4m3fnuz,torch.float16
10240,5498,8192,hipblaslt,78016,0.8328397750854493,torch.float8_e4m3fnuz,torch.float16
8192,1305,8192,hipblaslt,77723,0.1848338007926941,torch.float8_e4m3fnuz,torch.float16
57344,5671,8192,hipblaslt,77935,5.145856355365954,torch.float8_e4m3fnuz,torch.float16
8192,293,8192,hipblaslt,77374,0.07108479738235474,torch.float8_e4m3fnuz,torch.float16
8192,902,8192,hipblaslt,77388,0.1479191541671753,torch.float8_e4m3fnuz,torch.float16
8192,4667,8192,hipblaslt,42477,0.595185661315918,torch.float8_e4m3fnuz,torch.float16
10240,1037,8192,hipblaslt,77941,0.18761194944381715,torch.float8_e4m3fnuz,torch.float16
8192,3721,28672,hipblaslt,77924,1.7573272705078125,torch.float8_e4m3fnuz,torch.float16
8192,4411,28672,hipblaslt,77696,1.9769203186035156,torch.float8_e4m3fnuz,torch.float16
8192,2222,8192,hipblaslt,77593,0.3041145086288452,torch.float8_e4m3fnuz,torch.float16
8192,1005,8192,hipblaslt,77871,0.14674390554428102,torch.float8_e4m3fnuz,torch.float16
10240,3561,8192,hipblaslt,77928,0.5747113704681397,torch.float8_e4m3fnuz,torch.float16
8192,5634,8192,hipblaslt,77897,0.7058014869689941,torch.float8_e4m3fnuz,torch.float16
8192,566,28672,hipblaslt,76918,0.3514720916748047,torch.float8_e4m3fnuz,torch.float16
10240,1115,8192,hipblaslt,77917,0.19225480556488037,torch.float8_e4m3fnuz,torch.float16
10240,4676,8192,hipblaslt,77924,0.7145424365997315,torch.float8_e4m3fnuz,torch.float16
8192,277,28672,hipblaslt,77197,0.19314409494400026,torch.float8_e4m3fnuz,torch.float16
8192,33,28672,hipblaslt,76834,0.07728999853134155,torch.float8_e4m3fnuz,torch.float16
57344,957,8192,hipblaslt,78018,0.8938681602478027,torch.float8_e4m3fnuz,torch.float16
10240,2621,8192,hipblaslt,77496,0.4155295372009277,torch.float8_e4m3fnuz,torch.float16
57344,1253,8192,hipblaslt,77939,1.1288441658020019,torch.float8_e4m3fnuz,torch.float16
10240,4134,8192,hipblaslt,77984,0.6293002128601074,torch.float8_e4m3fnuz,torch.float16
57344,1031,8192,hipblaslt,77938,0.9929529190063476,torch.float8_e4m3fnuz,torch.float16
8192,1470,8192,hipblaslt,78018,0.20294458866119386,torch.float8_e4m3fnuz,torch.float16
57344,1702,8192,hipblaslt,77939,1.5402396202087403,torch.float8_e4m3fnuz,torch.float16
10240,3204,8192,hipblaslt,77966,0.495768404006958,torch.float8_e4m3fnuz,torch.float16
10240,1692,8192,hipblaslt,77722,0.29990224838256835,torch.float8_e4m3fnuz,torch.float16
10240,4631,8192,hipblaslt,77924,0.7231873035430908,torch.float8_e4m3fnuz,torch.float16
8192,2795,8192,hipblaslt,77929,0.36819939613342284,torch.float8_e4m3fnuz,torch.float16
8192,1541,8192,hipblaslt,77967,0.20154855251312256,torch.float8_e4m3fnuz,torch.float16
8192,3604,8192,hipblaslt,77888,0.43891215324401855,torch.float8_e4m3fnuz,torch.float16
8192,1289,28672,hipblaslt,77917,0.6388743400573731,torch.float8_e4m3fnuz,torch.float16
8192,61756,8192,hipblaslt,77922,7.1852276141826925,torch.float8_e4m3fnuz,torch.float16
10240,4052,8192,hipblaslt,77984,0.6384577274322509,torch.float8_e4m3fnuz,torch.float16
8192,4639,28672,hipblaslt,77895,2.089136505126953,torch.float8_e4m3fnuz,torch.float16
8192,2639,28672,hipblaslt,77937,1.2567957878112792,torch.float8_e4m3fnuz,torch.float16
8192,4272,8192,hipblaslt,77916,0.5398837089538574,torch.float8_e4m3fnuz,torch.float16
8192,1568,28672,hipblaslt,77961,0.6900181293487548,torch.float8_e4m3fnuz,torch.float16
10240,8737,8192,hipblaslt,77925,1.350712776184082,torch.float8_e4m3fnuz,torch.float16
57344,1168,8192,hipblaslt,77950,1.0989479064941405,torch.float8_e4m3fnuz,torch.float16
8192,3009,8192,hipblaslt,77495,0.37627990245819093,torch.float8_e4m3fnuz,torch.float16
8192,504,28672,hipblaslt,77188,0.3111568450927734,torch.float8_e4m3fnuz,torch.float16
57344,1261,8192,hipblaslt,77939,1.1316843986511231,torch.float8_e4m3fnuz,torch.float16
10240,59014,8192,hipblaslt,77923,8.606887817382812,torch.float8_e4m3fnuz,torch.float16
8192,2386,8192,hipblaslt,77722,0.3230365037918091,torch.float8_e4m3fnuz,torch.float16
8192,1194,8192,hipblaslt,77723,0.18376020193099976,torch.float8_e4m3fnuz,torch.float16
8192,2925,28672,hipblaslt,77895,1.344876194000244,torch.float8_e4m3fnuz,torch.float16
10240,1290,8192,hipblaslt,77952,0.21255085468292237,torch.float8_e4m3fnuz,torch.float16
10240,6426,8192,hipblaslt,77921,0.9497427940368652,torch.float8_e4m3fnuz,torch.float16
10240,282,8192,hipblaslt,76783,0.0717372477054596,torch.float8_e4m3fnuz,torch.float16
10240,5738,8192,hipblaslt,77903,0.8535984039306641,torch.float8_e4m3fnuz,torch.float16
57344,3370,8192,hipblaslt,77952,3.0808435440063477,torch.float8_e4m3fnuz,torch.float16
8192,2436,8192,hipblaslt,77851,0.333383846282959,torch.float8_e4m3fnuz,torch.float16
8192,1241,28672,hipblaslt,77895,0.6455782890319824,torch.float8_e4m3fnuz,torch.float16
8192,233,28672,hipblaslt,76879,0.17003984451293946,torch.float8_e4m3fnuz,torch.float16
8192,1947,28672,hipblaslt,77966,0.8880934715270996,torch.float8_e4m3fnuz,torch.float16
57344,2249,8192,hipblaslt,77952,2.028763198852539,torch.float8_e4m3fnuz,torch.float16
8192,1363,28672,hipblaslt,77961,0.6694196701049805,torch.float8_e4m3fnuz,torch.float16
8192,5120,8192,hipblaslt,77973,0.6255826950073242,torch.float8_e4m3fnuz,torch.float16
8192,4215,28672,hipblaslt,77922,1.7945001602172852,torch.float8_e4m3fnuz,torch.float16
8192,1848,8192,hipblaslt,77925,0.25559659004211427,torch.float8_e4m3fnuz,torch.float16
57344,6032,8192,hipblaslt,78012,5.185716965619256,torch.float8_e4m3fnuz,torch.float16
8192,854,28672,hipblaslt,77399,0.462966251373291,torch.float8_e4m3fnuz,torch.float16
10240,1757,8192,hipblaslt,77828,0.30305495262146,torch.float8_e4m3fnuz,torch.float16
8192,5217,28672,hipblaslt,77719,2.277229118347168,torch.float8_e4m3fnuz,torch.float16
57344,5513,8192,hipblaslt,77880,4.885148299367804,torch.float8_e4m3fnuz,torch.float16
10240,5058,8192,hipblaslt,77984,0.8035042762756348,torch.float8_e4m3fnuz,torch.float16
57344,123,8192,hipblaslt,77445,0.18757984638214112,torch.float8_e4m3fnuz,torch.float16
10240,2211,8192,hipblaslt,77885,0.3607063055038452,torch.float8_e4m3fnuz,torch.float16
8192,4872,8192,hipblaslt,77984,0.61122145652771,torch.float8_e4m3fnuz,torch.float16
10240,229,8192,hipblaslt,77391,0.07828999757766723,torch.float8_e4m3fnuz,torch.float16
10240,5388,8192,hipblaslt,77890,0.8316498756408691,torch.float8_e4m3fnuz,torch.float16
57344,270,8192,hipblaslt,77755,0.320400595664978,torch.float8_e4m3fnuz,torch.float16
8192,2333,8192,hipblaslt,77882,0.3167232036590576,torch.float8_e4m3fnuz,torch.float16
8192,4251,28672,hipblaslt,77921,1.801871109008789,torch.float8_e4m3fnuz,torch.float16
8192,5350,28672,hipblaslt,77719,2.3023164749145506,torch.float8_e4m3fnuz,torch.float16
57344,966,8192,hipblaslt,77939,0.9305164337158203,torch.float8_e4m3fnuz,torch.float16
10240,4146,8192,hipblaslt,77877,0.6435973644256592,torch.float8_e4m3fnuz,torch.float16
57344,498,8192,hipblaslt,77939,0.48815507888793946,torch.float8_e4m3fnuz,torch.float16
57344,2293,8192,hipblaslt,77950,2.0408771514892576,torch.float8_e4m3fnuz,torch.float16
8192,5506,28672,hipblaslt,77755,2.5274097442626955,torch.float8_e4m3fnuz,torch.float16
57344,6804,8192,hipblaslt,77880,6.011948108673096,torch.float8_e4m3fnuz,torch.float16
8192,240,28672,hipblaslt,77198,0.1702922463417053,torch.float8_e4m3fnuz,torch.float16
8192,2912,28672,hipblaslt,77917,1.3413849830627442,torch.float8_e4m3fnuz,torch.float16
10240,1246,8192,hipblaslt,77942,0.20875320434570313,torch.float8_e4m3fnuz,torch.float16
10240,5324,8192,hipblaslt,77720,0.8233536720275879,torch.float8_e4m3fnuz,torch.float16
10240,1125,8192,hipblaslt,77890,0.19859615564346314,torch.float8_e4m3fnuz,torch.float16
10240,5675,8192,hipblaslt,77973,0.8504137992858887,torch.float8_e4m3fnuz,torch.float16
10240,4646,8192,hipblaslt,77924,0.7196680545806885,torch.float8_e4m3fnuz,torch.float16
10240,477,8192,hipblaslt,77392,0.1093500018119812,torch.float8_e4m3fnuz,torch.float16
8192,4750,28672,hipblaslt,77984,2.2189729690551756,torch.float8_e4m3fnuz,torch.float16
8192,595,28672,hipblaslt,77864,0.3650627613067627,torch.float8_e4m3fnuz,torch.float16
10240,6384,8192,hipblaslt,77922,0.9530858039855957,torch.float8_e4m3fnuz,torch.float16
8192,7006,8192,hipblaslt,77888,0.8630104064941406,torch.float8_e4m3fnuz,torch.float16
8192,2254,28672,hipblaslt,77830,1.1013834953308106,torch.float8_e4m3fnuz,torch.float16
57344,4499,8192,hipblaslt,78017,3.9600521087646485,torch.float8_e4m3fnuz,torch.float16
57344,851,8192,hipblaslt,77925,0.8112401962280273,torch.float8_e4m3fnuz,torch.float16
57344,5841,8192,hipblaslt,77935,5.212724049886067,torch.float8_e4m3fnuz,torch.float16
8192,1986,28672,hipblaslt,77921,0.8878332138061523,torch.float8_e4m3fnuz,torch.float16
8192,2456,28672,hipblaslt,77418,1.1960738182067872,torch.float8_e4m3fnuz,torch.float16
8192,3722,8192,hipblaslt,77921,0.4712800979614258,torch.float8_e4m3fnuz,torch.float16
8192,7271,28672,hipblaslt,77901,3.123048210144043,torch.float8_e4m3fnuz,torch.float16
8192,1456,8192,hipblaslt,78018,0.19862020015716553,torch.float8_e4m3fnuz,torch.float16
10240,6666,8192,hipblaslt,77922,0.9752986907958985,torch.float8_e4m3fnuz,torch.float16
8192,4652,28672,hipblaslt,77928,2.088087272644043,torch.float8_e4m3fnuz,torch.float16
57344,6550,8192,hipblaslt,77880,5.825787544250488,torch.float8_e4m3fnuz,torch.float16
57344,1519,8192,hipblaslt,77935,1.3445696830749512,torch.float8_e4m3fnuz,torch.float16
8192,255,8192,hipblaslt,42504,0.05660784840583801,torch.float8_e4m3fnuz,torch.float16
8192,401,28672,hipblaslt,76973,0.27561030387878416,torch.float8_e4m3fnuz,torch.float16
8192,2242,8192,hipblaslt,77828,0.3002847909927368,torch.float8_e4m3fnuz,torch.float16
8192,5046,28672,hipblaslt,78018,2.26772518157959,torch.float8_e4m3fnuz,torch.float16
10240,6388,8192,hipblaslt,77922,0.9520281791687012,torch.float8_e4m3fnuz,torch.float16
8192,568,8192,hipblaslt,77400,0.10976610183715821,torch.float8_e4m3fnuz,torch.float16
10240,2911,8192,hipblaslt,77981,0.4663087368011475,torch.float8_e4m3fnuz,torch.float16
57344,1893,8192,hipblaslt,77952,1.7301107406616212,torch.float8_e4m3fnuz,torch.float16
57344,3755,8192,hipblaslt,77880,3.3395809173583983,torch.float8_e4m3fnuz,torch.float16
10240,6717,8192,hipblaslt,77922,0.9792725563049316,torch.float8_e4m3fnuz,torch.float16
57344,4900,8192,hipblaslt,77880,4.362626266479492,torch.float8_e4m3fnuz,torch.float16
57344,3134,8192,hipblaslt,77880,2.8153444290161134,torch.float8_e4m3fnuz,torch.float16
8192,2771,8192,hipblaslt,77960,0.3621945381164551,torch.float8_e4m3fnuz,torch.float16
8192,2685,28672,hipblaslt,77688,1.2890454292297364,torch.float8_e4m3fnuz,torch.float16
10240,3945,8192,hipblaslt,77496,0.6249817848205567,torch.float8_e4m3fnuz,torch.float16
8192,5325,28672,hipblaslt,77719,2.29589900970459,torch.float8_e4m3fnuz,torch.float16
8192,944,28672,hipblaslt,77871,0.5080269813537598,torch.float8_e4m3fnuz,torch.float16
8192,933,28672,hipblaslt,77871,0.5047215938568115,torch.float8_e4m3fnuz,torch.float16
10240,4849,8192,hipblaslt,77921,0.7323508262634277,torch.float8_e4m3fnuz,torch.float16
8192,820,8192,hipblaslt,77404,0.1357806444168091,torch.float8_e4m3fnuz,torch.float16
57344,1187,8192,hipblaslt,77939,1.1146991729736329,torch.float8_e4m3fnuz,torch.float16
8192,3901,8192,hipblaslt,77925,0.48435149192810056,torch.float8_e4m3fnuz,torch.float16
8192,1995,8192,hipblaslt,77926,0.25760560035705565,torch.float8_e4m3fnuz,torch.float16
8192,4011,28672,hipblaslt,77924,1.7805316925048829,torch.float8_e4m3fnuz,torch.float16
8192,2655,8192,hipblaslt,77941,0.356644344329834,torch.float8_e4m3fnuz,torch.float16
8192,1667,8192,hipblaslt,77913,0.2158437490463257,torch.float8_e4m3fnuz,torch.float16
10240,956,8192,hipblaslt,77929,0.17864664793014526,torch.float8_e4m3fnuz,torch.float16
57344,685,8192,hipblaslt,77939,0.6761796474456787,torch.float8_e4m3fnuz,torch.float16
57344,1122,8192,hipblaslt,77952,1.0714370727539062,torch.float8_e4m3fnuz,torch.float16
57344,2602,8192,hipblaslt,77925,2.381423568725586,torch.float8_e4m3fnuz,torch.float16
57344,6946,8192,hipblaslt,77721,6.2197184562683105,torch.float8_e4m3fnuz,torch.float16
8192,3164,8192,hipblaslt,78016,0.4112191677093506,torch.float8_e4m3fnuz,torch.float16
8192,6594,8192,hipblaslt,77888,0.8180157661437988,torch.float8_e4m3fnuz,torch.float16
57344,5882,8192,hipblaslt,77942,5.289719899495442,torch.float8_e4m3fnuz,torch.float16
8192,2822,8192,hipblaslt,77960,0.36591405868530275,torch.float8_e4m3fnuz,torch.float16
10240,2174,8192,hipblaslt,77960,0.3592061042785645,torch.float8_e4m3fnuz,torch.float16
10240,1593,8192,hipblaslt,77423,0.29689180850982666,torch.float8_e4m3fnuz,torch.float16
10240,1976,8192,hipblaslt,77829,0.32891523838043213,torch.float8_e4m3fnuz,torch.float16
10240,161,8192,hipblaslt,76782,0.05531190037727356,torch.float8_e4m3fnuz,torch.float16
10240,2207,8192,hipblaslt,77960,0.35688459873199463,torch.float8_e4m3fnuz,torch.float16
8192,2321,8192,hipblaslt,77957,0.320206356048584,torch.float8_e4m3fnuz,torch.float16
10240,1788,8192,hipblaslt,77828,0.298616361618042,torch.float8_e4m3fnuz,torch.float16
10240,813,8192,hipblaslt,42423,0.158805251121521,torch.float8_e4m3fnuz,torch.float16
8192,2707,28672,hipblaslt,77928,1.3068879127502442,torch.float8_e4m3fnuz,torch.float16
57344,2358,8192,hipblaslt,77952,2.2034580230712892,torch.float8_e4m3fnuz,torch.float16
10240,5488,8192,hipblaslt,77496,0.8357780456542969,torch.float8_e4m3fnuz,torch.float16
8192,37,28672,hipblaslt,77168,0.0796184480190277,torch.float8_e4m3fnuz,torch.float16
8192,2294,8192,hipblaslt,77828,0.30374195575714114,torch.float8_e4m3fnuz,torch.float16
8192,1291,8192,hipblaslt,77723,0.18083585500717164,torch.float8_e4m3fnuz,torch.float16
8192,4808,28672,hipblaslt,77952,2.221099281311035,torch.float8_e4m3fnuz,torch.float16
10240,126,8192,hipblaslt,77307,0.055272847414016724,torch.float8_e4m3fnuz,torch.float16
8192,230,8192,hipblaslt,76626,0.061671847105026247,torch.float8_e4m3fnuz,torch.float16
8192,606,8192,hipblaslt,77049,0.10889530181884766,torch.float8_e4m3fnuz,torch.float16
57344,1915,8192,hipblaslt,77952,1.7444700241088866,torch.float8_e4m3fnuz,torch.float16
8192,6268,8192,hipblaslt,77925,0.7477076053619385,torch.float8_e4m3fnuz,torch.float16
8192,6681,8192,hipblaslt,77973,0.8359062194824218,torch.float8_e4m3fnuz,torch.float16
10240,291,28672,hipblaslt,77073,0.24570794105529786,torch.float8_e4m3fnuz,torch.float16
8192,3238,8192,hipblaslt,77973,0.4066032886505127,torch.float8_e4m3fnuz,torch.float16
57344,3092,8192,hipblaslt,77880,2.8250288009643554,torch.float8_e4m3fnuz,torch.float16
57344,1311,8192,hipblaslt,77928,1.2096458435058595,torch.float8_e4m3fnuz,torch.float16
8192,3084,28672,hipblaslt,77895,1.3787262916564942,torch.float8_e4m3fnuz,torch.float16
8192,5992,28672,hipblaslt,77924,2.654836654663086,torch.float8_e4m3fnuz,torch.float16
8192,4901,28672,hipblaslt,77952,2.2468122482299804,torch.float8_e4m3fnuz,torch.float16
10240,2089,8192,hipblaslt,77937,0.36322650909423826,torch.float8_e4m3fnuz,torch.float16
8192,1276,28672,hipblaslt,77917,0.6403885841369629,torch.float8_e4m3fnuz,torch.float16
8192,4089,8192,hipblaslt,77922,0.49233531951904297,torch.float8_e4m3fnuz,torch.float16
8192,1201,8192,hipblaslt,77873,0.1770777940750122,torch.float8_e4m3fnuz,torch.float16
8192,585,28672,hipblaslt,76890,0.3731226921081543,torch.float8_e4m3fnuz,torch.float16
8192,65269,28672,hipblaslt,77924,27.672808837890624,torch.float8_e4m3fnuz,torch.float16
57344,866,8192,hipblaslt,77926,0.8151915550231934,torch.float8_e4m3fnuz,torch.float16
8192,1263,28672,hipblaslt,77917,0.6240212917327881,torch.float8_e4m3fnuz,torch.float16
10240,5214,8192,hipblaslt,77890,0.8177833557128906,torch.float8_e4m3fnuz,torch.float16
57344,2393,8192,hipblaslt,77952,2.18275146484375,torch.float8_e4m3fnuz,torch.float16
8192,6023,28672,hipblaslt,77924,2.6544370651245117,torch.float8_e4m3fnuz,torch.float16
8192,5000,8192,hipblaslt,78016,0.6199102401733398,torch.float8_e4m3fnuz,torch.float16
10240,1616,8192,hipblaslt,77614,0.2948748111724854,torch.float8_e4m3fnuz,torch.float16
57344,444,8192,hipblaslt,77917,0.44530563354492186,torch.float8_e4m3fnuz,torch.float16
8192,1301,8192,hipblaslt,77916,0.1892082452774048,torch.float8_e4m3fnuz,torch.float16
8192,2957,8192,hipblaslt,77723,0.37827234268188475,torch.float8_e4m3fnuz,torch.float16
8192,3992,8192,hipblaslt,77924,0.4795323371887207,torch.float8_e4m3fnuz,torch.float16
8192,2458,28672,hipblaslt,77937,1.1916933059692383,torch.float8_e4m3fnuz,torch.float16
57344,4616,8192,hipblaslt,77880,4.168659210205078,torch.float8_e4m3fnuz,torch.float16
10240,883,8192,hipblaslt,77494,0.15783779621124266,torch.float8_e4m3fnuz,torch.float16
10240,2830,8192,hipblaslt,77496,0.42943410873413085,torch.float8_e4m3fnuz,torch.float16
57344,2776,8192,hipblaslt,77935,2.5665359497070312,torch.float8_e4m3fnuz,torch.float16
8192,207,8192,hipblaslt,76626,0.05687574744224548,torch.float8_e4m3fnuz,torch.float16
57344,2554,8192,hipblaslt,77950,2.309711456298828,torch.float8_e4m3fnuz,torch.float16
8192,3578,8192,hipblaslt,77984,0.4335162162780762,torch.float8_e4m3fnuz,torch.float16
8192,2983,28672,hipblaslt,77917,1.3755315780639648,torch.float8_e4m3fnuz,torch.float16
8192,357,8192,hipblaslt,76783,0.07312384843826295,torch.float8_e4m3fnuz,torch.float16
8192,5683,8192,hipblaslt,77924,0.7121729373931884,torch.float8_e4m3fnuz,torch.float16
57344,2237,8192,hipblaslt,77952,2.0084352493286133,torch.float8_e4m3fnuz,torch.float16
57344,1804,8192,hipblaslt,77952,1.6958099365234376,torch.float8_e4m3fnuz,torch.float16
8192,114,8192,hipblaslt,76782,0.043690750002861024,torch.float8_e4m3fnuz,torch.float16
8192,8770,28672,hipblaslt,77984,3.851401138305664,torch.float8_e4m3fnuz,torch.float16
57344,2893,8192,hipblaslt,77919,2.639579963684082,torch.float8_e4m3fnuz,torch.float16
10240,3500,8192,hipblaslt,77916,0.5591923713684082,torch.float8_e4m3fnuz,torch.float16
57344,2376,8192,hipblaslt,77952,2.209985542297363,torch.float8_e4m3fnuz,torch.float16
8192,1730,28672,hipblaslt,77939,0.7557074069976807,torch.float8_e4m3fnuz,torch.float16
57344,510,8192,hipblaslt,77950,0.4936732292175293,torch.float8_e4m3fnuz,torch.float16
8192,1561,8192,hipblaslt,77973,0.21206414699554443,torch.float8_e4m3fnuz,torch.float16
10240,2773,8192,hipblaslt,77720,0.42980070114135743,torch.float8_e4m3fnuz,torch.float16
8192,3858,28672,hipblaslt,77676,1.7502265930175782,torch.float8_e4m3fnuz,torch.float16
8192,2736,28672,hipblaslt,77895,1.308656597137451,torch.float8_e4m3fnuz,torch.float16
8192,4389,8192,hipblaslt,77916,0.555222463607788,torch.float8_e4m3fnuz,torch.float16
8192,823,28672,hipblaslt,77399,0.4600234508514404,torch.float8_e4m3fnuz,torch.float16
8192,1373,8192,hipblaslt,77917,0.19303795099258422,torch.float8_e4m3fnuz,torch.float16
8192,5360,28672,hipblaslt,77719,2.3031877517700194,torch.float8_e4m3fnuz,torch.float16
57344,933,8192,hipblaslt,77935,0.8809028625488281,torch.float8_e4m3fnuz,torch.float16
8192,108,8192,hipblaslt,77305,0.04424149990081787,torch.float8_e4m3fnuz,torch.float16
10240,693,8192,hipblaslt,77871,0.14344650506973267,torch.float8_e4m3fnuz,torch.float16
57344,395,8192,hipblaslt,77917,0.42643370628356936,torch.float8_e4m3fnuz,torch.float16
57344,3530,8192,hipblaslt,77696,3.1808298110961912,torch.float8_e4m3fnuz,torch.float16
57344,406,8192,hipblaslt,77967,0.4283565044403076,torch.float8_e4m3fnuz,torch.float16
8192,662,28672,hipblaslt,77867,0.41642231941223146,torch.float8_e4m3fnuz,torch.float16
8192,5534,8192,hipblaslt,77923,0.6759994029998779,torch.float8_e4m3fnuz,torch.float16
57344,3938,8192,hipblaslt,78012,3.4418624877929687,torch.float8_e4m3fnuz,torch.float16
57344,2197,8192,hipblaslt,77952,1.9930864334106446,torch.float8_e4m3fnuz,torch.float16
10240,1832,8192,hipblaslt,77957,0.3160727024078369,torch.float8_e4m3fnuz,torch.float16
57344,4237,8192,hipblaslt,77880,3.7350109100341795,torch.float8_e4m3fnuz,torch.float16
8192,6755,28672,hipblaslt,77719,2.9982433319091797,torch.float8_e4m3fnuz,torch.float16
8192,4792,28672,hipblaslt,77984,2.2203529357910154,torch.float8_e4m3fnuz,torch.float16
8192,461,8192,hipblaslt,42415,0.08717914819717407,torch.float8_e4m3fnuz,torch.float16
57344,2239,8192,hipblaslt,77950,2.0447669982910157,torch.float8_e4m3fnuz,torch.float16
8192,709,8192,hipblaslt,77867,0.11846745014190674,torch.float8_e4m3fnuz,torch.float16
8192,3039,28672,hipblaslt,77895,1.383286952972412,torch.float8_e4m3fnuz,torch.float16
10240,1358,8192,hipblaslt,77925,0.2393285036087036,torch.float8_e4m3fnuz,torch.float16
8192,4970,8192,hipblaslt,77901,0.6116280078887939,torch.float8_e4m3fnuz,torch.float16
8192,5040,8192,hipblaslt,77942,0.6215988159179687,torch.float8_e4m3fnuz,torch.float16
10240,13,8192,hipblaslt,77249,0.03227179944515228,torch.float8_e4m3fnuz,torch.float16
8192,1599,28672,hipblaslt,77950,0.741238021850586,torch.float8_e4m3fnuz,torch.float16
8192,6660,8192,hipblaslt,77888,0.8145285606384277,torch.float8_e4m3fnuz,torch.float16
8192,525,28672,hipblaslt,76918,0.3306572914123535,torch.float8_e4m3fnuz,torch.float16
10240,6932,8192,hipblaslt,77890,1.0430972099304199,torch.float8_e4m3fnuz,torch.float16
10240,1391,8192,hipblaslt,77981,0.249092960357666,torch.float8_e4m3fnuz,torch.float16
57344,1645,8192,hipblaslt,77950,1.5182109832763673,torch.float8_e4m3fnuz,torch.float16
8192,1896,8192,hipblaslt,77897,0.25903968811035155,torch.float8_e4m3fnuz,torch.float16
8192,3150,8192,hipblaslt,77496,0.4070729732513428,torch.float8_e4m3fnuz,torch.float16
8192,65240,8192,hipblaslt,77924,7.518317540486653,torch.float8_e4m3fnuz,torch.float16
10240,6284,8192,hipblaslt,77924,0.9544637680053711,torch.float8_e4m3fnuz,torch.float16
57344,2509,8192,hipblaslt,77950,2.288011169433594,torch.float8_e4m3fnuz,torch.float16
8192,542,8192,hipblaslt,77867,0.11045960187911988,torch.float8_e4m3fnuz,torch.float16
8192,2989,28672,hipblaslt,77929,1.3793031692504882,torch.float8_e4m3fnuz,torch.float16
8192,2422,8192,hipblaslt,77722,0.31922690868377684,torch.float8_e4m3fnuz,torch.float16
10240,534,8192,hipblaslt,77867,0.11848150491714478,torch.float8_e4m3fnuz,torch.float16
57344,2687,8192,hipblaslt,77925,2.386759567260742,torch.float8_e4m3fnuz,torch.float16
10240,3790,8192,hipblaslt,77935,0.6072134971618652,torch.float8_e4m3fnuz,torch.float16
8192,3381,8192,hipblaslt,77720,0.4231207847595215,torch.float8_e4m3fnuz,torch.float16
57344,5366,8192,hipblaslt,77719,4.712242507934571,torch.float8_e4m3fnuz,torch.float16
8192,7708,28672,hipblaslt,77917,3.475239944458008,torch.float8_e4m3fnuz,torch.float16
10240,455,8192,hipblaslt,77400,0.10278425216674805,torch.float8_e4m3fnuz,torch.float16
57344,7788,8192,hipblaslt,77925,7.006336212158203,torch.float8_e4m3fnuz,torch.float16
57344,2114,8192,hipblaslt,77952,1.9911556243896484,torch.float8_e4m3fnuz,torch.float16
57344,3441,8192,hipblaslt,77935,3.145717811584473,torch.float8_e4m3fnuz,torch.float16
57344,2286,8192,hipblaslt,77952,2.0613073348999023,torch.float8_e4m3fnuz,torch.float16
8192,128,8192,hipblaslt,42518,0.044852450489997864,torch.float8_e4m3fnuz,torch.float16
10240,654,8192,hipblaslt,77869,0.13612165451049804,torch.float8_e4m3fnuz,torch.float16
57344,2001,8192,hipblaslt,77950,1.8122806549072266,torch.float8_e4m3fnuz,torch.float16
57344,641,8192,hipblaslt,77938,0.6291980266571044,torch.float8_e4m3fnuz,torch.float16
8192,4407,28672,hipblaslt,77696,1.9713581085205079,torch.float8_e4m3fnuz,torch.float16
8192,1990,8192,hipblaslt,77948,0.26083035469055177,torch.float8_e4m3fnuz,torch.float16
8192,167,28672,hipblaslt,76848,0.13287285566329957,torch.float8_e4m3fnuz,torch.float16
8192,1975,28672,hipblaslt,77921,0.884335994720459,torch.float8_e4m3fnuz,torch.float16
57344,5137,8192,hipblaslt,77925,4.508867263793945,torch.float8_e4m3fnuz,torch.float16
8192,3607,28672,hipblaslt,77935,1.5667888641357421,torch.float8_e4m3fnuz,torch.float16
10240,7,8192,hipblaslt,77249,0.03072254955768585,torch.float8_e4m3fnuz,torch.float16
10240,1344,8192,hipblaslt,77942,0.20892345905303955,torch.float8_e4m3fnuz,torch.float16
57344,5339,8192,hipblaslt,77719,4.728458404541016,torch.float8_e4m3fnuz,torch.float16
8192,4091,28672,hipblaslt,77924,1.7911012649536133,torch.float8_e4m3fnuz,torch.float16
57344,278,8192,hipblaslt,77839,0.32971038818359377,torch.float8_e4m3fnuz,torch.float16
8192,1309,8192,hipblaslt,77917,0.1862599015235901,torch.float8_e4m3fnuz,torch.float16
8192,3354,28672,hipblaslt,78018,1.5161358833312988,torch.float8_e4m3fnuz,torch.float16
8192,487,8192,hipblaslt,77862,0.09285554885864258,torch.float8_e4m3fnuz,torch.float16
8192,3129,8192,hipblaslt,77984,0.40774998664855955,torch.float8_e4m3fnuz,torch.float16
8192,1939,8192,hipblaslt,77926,0.25338335037231446,torch.float8_e4m3fnuz,torch.float16
8192,860,28672,hipblaslt,77399,0.45662641525268555,torch.float8_e4m3fnuz,torch.float16
8192,4141,8192,hipblaslt,77923,0.49572029113769533,torch.float8_e4m3fnuz,torch.float16
57344,2699,8192,hipblaslt,77950,2.506334686279297,torch.float8_e4m3fnuz,torch.float16
57344,7104,8192,hipblaslt,77925,6.379198710123698,torch.float8_e4m3fnuz,torch.float16
10240,3907,8192,hipblaslt,77935,0.6216268062591552,torch.float8_e4m3fnuz,torch.float16
8192,2138,8192,hipblaslt,77388,0.2940876007080078,torch.float8_e4m3fnuz,torch.float16
10240,5907,8192,hipblaslt,77976,0.899995231628418,torch.float8_e4m3fnuz,torch.float16
10240,6804,8192,hipblaslt,77877,1.0348910331726073,torch.float8_e4m3fnuz,torch.float16
8192,315,28672,hipblaslt,76644,0.22233934402465821,torch.float8_e4m3fnuz,torch.float16
57344,812,8192,hipblaslt,77917,0.8052488327026367,torch.float8_e4m3fnuz,torch.float16
10240,2375,8192,hipblaslt,77723,0.37245569229125974,torch.float8_e4m3fnuz,torch.float16
57344,6473,8192,hipblaslt,77880,5.788265901453355,torch.float8_e4m3fnuz,torch.float16
10240,1287,8192,hipblaslt,78018,0.2106220006942749,torch.float8_e4m3fnuz,torch.float16
8192,2019,8192,hipblaslt,77771,0.28104228973388673,torch.float8_e4m3fnuz,torch.float16
10240,5244,8192,hipblaslt,77890,0.8152876853942871,torch.float8_e4m3fnuz,torch.float16
8192,880,8192,hipblaslt,77399,0.13650219440460204,torch.float8_e4m3fnuz,torch.float16
8192,35,8192,hipblaslt,77370,0.03152070045471191,torch.float8_e4m3fnuz,torch.float16
8192,4026,28672,hipblaslt,77924,1.7831514358520508,torch.float8_e4m3fnuz,torch.float16
8192,3044,28672,hipblaslt,77917,1.3778690338134765,torch.float8_e4m3fnuz,torch.float16
8192,592,28672,hipblaslt,77864,0.3688023567199707,torch.float8_e4m3fnuz,torch.float16
8192,4576,8192,hipblaslt,77957,0.6029131412506104,torch.float8_e4m3fnuz,torch.float16
8192,1980,28672,hipblaslt,77922,0.8813309669494629,torch.float8_e4m3fnuz,torch.float16
10240,1838,8192,hipblaslt,77836,0.3168052911758423,torch.float8_e4m3fnuz,torch.float16
8192,3167,28672,hipblaslt,77950,1.4724851608276368,torch.float8_e4m3fnuz,torch.float16
8192,1426,8192,hipblaslt,77873,0.19148164987564087,torch.float8_e4m3fnuz,torch.float16
57344,305,8192,hipblaslt,77927,0.349223256111145,torch.float8_e4m3fnuz,torch.float16
8192,2556,28672,hipblaslt,77937,1.2150918960571289,torch.float8_e4m3fnuz,torch.float16
8192,2164,28672,hipblaslt,77956,1.0752167701721191,torch.float8_e4m3fnuz,torch.float16
57344,4556,8192,hipblaslt,78017,4.0452125549316404,torch.float8_e4m3fnuz,torch.float16
57344,2548,8192,hipblaslt,77939,2.3300216674804686,torch.float8_e4m3fnuz,torch.float16
10240,3700,8192,hipblaslt,77935,0.5994679927825928,torch.float8_e4m3fnuz,torch.float16
8192,3797,28672,hipblaslt,77924,1.762949562072754,torch.float8_e4m3fnuz,torch.float16
57344,2045,8192,hipblaslt,77950,1.8276012420654297,torch.float8_e4m3fnuz,torch.float16
10240,4795,8192,hipblaslt,77921,0.7339952945709228,torch.float8_e4m3fnuz,torch.float16
8192,1904,28672,hipblaslt,77921,0.8734107971191406,torch.float8_e4m3fnuz,torch.float16
57344,4716,8192,hipblaslt,77945,4.333000564575196,torch.float8_e4m3fnuz,torch.float16
57344,356,8192,hipblaslt,77937,0.4105401515960693,torch.float8_e4m3fnuz,torch.float16
10240,4101,8192,hipblaslt,77942,0.6405087947845459,torch.float8_e4m3fnuz,torch.float16
57344,2375,8192,hipblaslt,77952,2.206905174255371,torch.float8_e4m3fnuz,torch.float16
8192,156,28672,hipblaslt,76913,0.12318249940872192,torch.float8_e4m3fnuz,torch.float16
8192,728,8192,hipblaslt,77867,0.12212090492248535,torch.float8_e4m3fnuz,torch.float16
8192,1048,28672,hipblaslt,77956,0.5377981185913085,torch.float8_e4m3fnuz,torch.float16
8192,18368,8192,hipblaslt,77924,2.1419729232788085,torch.float8_e4m3fnuz,torch.float16
8192,5355,8192,hipblaslt,77984,0.6392309188842773,torch.float8_e4m3fnuz,torch.float16
10240,705,8192,hipblaslt,77491,0.14720405340194703,torch.float8_e4m3fnuz,torch.float16
8192,2226,28672,hipblaslt,77927,1.079268741607666,torch.float8_e4m3fnuz,torch.float16
57344,4184,8192,hipblaslt,77880,3.6858360290527346,torch.float8_e4m3fnuz,torch.float16
8192,407,8192,hipblaslt,76973,0.07930545210838318,torch.float8_e4m3fnuz,torch.float16
8192,5433,28672,hipblaslt,77396,2.534321975708008,torch.float8_e4m3fnuz,torch.float16
10240,1742,8192,hipblaslt,77828,0.29701595306396483,torch.float8_e4m3fnuz,torch.float16
8192,1869,8192,hipblaslt,77944,0.25776185989379885,torch.float8_e4m3fnuz,torch.float16
57344,4636,8192,hipblaslt,77925,4.20565185546875,torch.float8_e4m3fnuz,torch.float16
10240,5437,8192,hipblaslt,77890,0.8249680519104003,torch.float8_e4m3fnuz,torch.float16
10240,9,28672,hipblaslt,76896,0.08963879942893982,torch.float8_e4m3fnuz,torch.float16
8192,149,8192,hipblaslt,77476,0.05349324941635132,torch.float8_e4m3fnuz,torch.float16
8192,351,28672,hipblaslt,77123,0.23619990348815917,torch.float8_e4m3fnuz,torch.float16
10240,1810,8192,hipblaslt,77957,0.31510875225067136,torch.float8_e4m3fnuz,torch.float16
57344,1258,8192,hipblaslt,77950,1.1309351921081543,torch.float8_e4m3fnuz,torch.float16
10240,5678,8192,hipblaslt,77877,0.8542473793029786,torch.float8_e4m3fnuz,torch.float16
8192,1589,28672,hipblaslt,77877,0.7401153087615967,torch.float8_e4m3fnuz,torch.float16
8192,2651,8192,hipblaslt,77976,0.35826270580291747,torch.float8_e4m3fnuz,torch.float16
57344,3208,8192,hipblaslt,77935,2.929788017272949,torch.float8_e4m3fnuz,torch.float16
57344,126,8192,hipblaslt,77458,0.18773809671401978,torch.float8_e4m3fnuz,torch.float16
57344,5992,8192,hipblaslt,78012,5.136146121554905,torch.float8_e4m3fnuz,torch.float16
57344,4361,8192,hipblaslt,77952,3.90291748046875,torch.float8_e4m3fnuz,torch.float16
8192,5704,8192,hipblaslt,77981,0.7179074287414551,torch.float8_e4m3fnuz,torch.float16
8192,2493,28672,hipblaslt,77937,1.1955750465393067,torch.float8_e4m3fnuz,torch.float16
8192,2393,8192,hipblaslt,77912,0.3232628583908081,torch.float8_e4m3fnuz,torch.float16
8192,646,28672,hipblaslt,77186,0.39393150806427,torch.float8_e4m3fnuz,torch.float16
57344,4049,8192,hipblaslt,78012,3.5921356201171877,torch.float8_e4m3fnuz,torch.float16
8192,1384,28672,hipblaslt,77895,0.6703029632568359,torch.float8_e4m3fnuz,torch.float16
8192,441,8192,hipblaslt,77391,0.0871305525302887,torch.float8_e4m3fnuz,torch.float16
10240,2183,8192,hipblaslt,77885,0.361237096786499,torch.float8_e4m3fnuz,torch.float16
57344,1974,8192,hipblaslt,77939,1.810788345336914,torch.float8_e4m3fnuz,torch.float16
10240,5971,8192,hipblaslt,77921,0.9040391921997071,torch.float8_e4m3fnuz,torch.float16
8192,4881,8192,hipblaslt,77496,0.6105423927307129,torch.float8_e4m3fnuz,torch.float16
8192,3749,28672,hipblaslt,77922,1.7626489639282226,torch.float8_e4m3fnuz,torch.float16
8192,6758,8192,hipblaslt,77935,0.8327295303344726,torch.float8_e4m3fnuz,torch.float16
8192,3514,8192,hipblaslt,77901,0.4319798946380615,torch.float8_e4m3fnuz,torch.float16
8192,904,28672,hipblaslt,77870,0.503276014328003,torch.float8_e4m3fnuz,torch.float16
10240,4419,8192,hipblaslt,77924,0.6953360080718994,torch.float8_e4m3fnuz,torch.float16
8192,1149,8192,hipblaslt,77872,0.15843770503997803,torch.float8_e4m3fnuz,torch.float16
8192,65113,28672,hipblaslt,77924,27.710610961914064,torch.float8_e4m3fnuz,torch.float16
57344,7683,8192,hipblaslt,77925,6.97594233921596,torch.float8_e4m3fnuz,torch.float16
10240,708,8192,hipblaslt,77388,0.1425251007080078,torch.float8_e4m3fnuz,torch.float16
8192,5169,28672,hipblaslt,77903,2.2892711639404295,torch.float8_e4m3fnuz,torch.float16
10240,4305,8192,hipblaslt,77829,0.6875123977661133,torch.float8_e4m3fnuz,torch.float16
8192,1405,28672,hipblaslt,77976,0.664339542388916,torch.float8_e4m3fnuz,torch.float16
10240,547,8192,hipblaslt,77406,0.12090610265731812,torch.float8_e4m3fnuz,torch.float16
8192,292,8192,hipblaslt,76644,0.06690509915351868,torch.float8_e4m3fnuz,torch.float16
8192,2740,8192,hipblaslt,77976,0.3661203384399414,torch.float8_e4m3fnuz,torch.float16
8192,2009,8192,hipblaslt,77981,0.2594283103942871,torch.float8_e4m3fnuz,torch.float16
10240,1213,8192,hipblaslt,78018,0.21456985473632811,torch.float8_e4m3fnuz,torch.float16
8192,5927,8192,hipblaslt,77924,0.7181758403778076,torch.float8_e4m3fnuz,torch.float16
8192,3636,8192,hipblaslt,77973,0.4433267116546631,torch.float8_e4m3fnuz,torch.float16
8192,3211,8192,hipblaslt,78016,0.41312198638916015,torch.float8_e4m3fnuz,torch.float16
8192,1300,8192,hipblaslt,77446,0.19128135442733765,torch.float8_e4m3fnuz,torch.float16
57344,3436,8192,hipblaslt,77935,3.136013412475586,torch.float8_e4m3fnuz,torch.float16
8192,3312,28672,hipblaslt,77950,1.4760124206542968,torch.float8_e4m3fnuz,torch.float16
57344,4993,8192,hipblaslt,78012,4.480266952514649,torch.float8_e4m3fnuz,torch.float16
8192,5655,8192,hipblaslt,77924,0.7089802265167237,torch.float8_e4m3fnuz,torch.float16
10240,407,28672,hipblaslt,76842,0.3202083587646484,torch.float8_e4m3fnuz,torch.float16
8192,5825,8192,hipblaslt,77925,0.7224020957946777,torch.float8_e4m3fnuz,torch.float16
57344,848,8192,hipblaslt,77926,0.8086919784545898,torch.float8_e4m3fnuz,torch.float16
8192,4235,8192,hipblaslt,77923,0.4979576587677002,torch.float8_e4m3fnuz,torch.float16
10240,2994,8192,hipblaslt,77922,0.47208127975463865,torch.float8_e4m3fnuz,torch.float16
10240,3488,8192,hipblaslt,77960,0.5436452865600586,torch.float8_e4m3fnuz,torch.float16
10240,86,28672,hipblaslt,76945,0.11930824518203735,torch.float8_e4m3fnuz,torch.float16
10240,2929,8192,hipblaslt,77981,0.47246384620666504,torch.float8_e4m3fnuz,torch.float16
57344,3180,8192,hipblaslt,77952,2.900686836242676,torch.float8_e4m3fnuz,torch.float16
8192,1376,8192,hipblaslt,77505,0.18363205194473267,torch.float8_e4m3fnuz,torch.float16
8192,3715,28672,hipblaslt,77924,1.747779655456543,torch.float8_e4m3fnuz,torch.float16
57344,4541,8192,hipblaslt,78017,4.053704833984375,torch.float8_e4m3fnuz,torch.float16
10240,3080,8192,hipblaslt,77922,0.4767442226409912,torch.float8_e4m3fnuz,torch.float16
57344,2593,8192,hipblaslt,77925,2.382491111755371,torch.float8_e4m3fnuz,torch.float16
8192,1024,8192,hipblaslt,77593,0.14127575159072875,torch.float8_e4m3fnuz,torch.float16
10240,4262,8192,hipblaslt,77924,0.6937316417694092,torch.float8_e4m3fnuz,torch.float16
8192,256,28672,hipblaslt,77198,0.17402980327606202,torch.float8_e4m3fnuz,torch.float16
10240,698,8192,hipblaslt,77388,0.1466031551361084,torch.float8_e4m3fnuz,torch.float16
8192,195,8192,hipblaslt,77307,0.06114755272865295,torch.float8_e4m3fnuz,torch.float16
10240,271,8192,hipblaslt,76760,0.07514734864234925,torch.float8_e4m3fnuz,torch.float16
8192,2809,28672,hipblaslt,77424,1.3084442138671875,torch.float8_e4m3fnuz,torch.float16
8192,3186,28672,hipblaslt,77950,1.4664281845092773,torch.float8_e4m3fnuz,torch.float16
10240,1085,8192,hipblaslt,77917,0.1883930444717407,torch.float8_e4m3fnuz,torch.float16
10240,2657,8192,hipblaslt,78016,0.4159521579742432,torch.float8_e4m3fnuz,torch.float16
8192,472,8192,hipblaslt,42415,0.08400444984436035,torch.float8_e4m3fnuz,torch.float16
10240,6130,8192,hipblaslt,77981,0.9250622749328613,torch.float8_e4m3fnuz,torch.float16
10240,1854,8192,hipblaslt,77882,0.31622440814971925,torch.float8_e4m3fnuz,torch.float16
10240,312,8192,hipblaslt,77863,0.09249600172042846,torch.float8_e4m3fnuz,torch.float16
8192,2408,28672,hipblaslt,77418,1.186974334716797,torch.float8_e4m3fnuz,torch.float16
57344,1154,8192,hipblaslt,77939,1.1004401206970216,torch.float8_e4m3fnuz,torch.float16
10240,1822,8192,hipblaslt,77722,0.312737250328064,torch.float8_e4m3fnuz,torch.float16
10240,1042,8192,hipblaslt,77916,0.183035147190094,torch.float8_e4m3fnuz,torch.float16
10240,487,8192,hipblaslt,77049,0.11082415580749512,torch.float8_e4m3fnuz,torch.float16
57344,5600,8192,hipblaslt,77880,4.933223523591694,torch.float8_e4m3fnuz,torch.float16
8192,1140,8192,hipblaslt,77722,0.1633479952812195,torch.float8_e4m3fnuz,torch.float16
8192,1118,28672,hipblaslt,77936,0.5504673957824707,torch.float8_e4m3fnuz,torch.float16
10240,3175,8192,hipblaslt,77922,0.4898035526275635,torch.float8_e4m3fnuz,torch.float16
10240,2024,8192,hipblaslt,77723,0.35198938846588135,torch.float8_e4m3fnuz,torch.float16
10240,1482,8192,hipblaslt,77977,0.26079435348510743,torch.float8_e4m3fnuz,torch.float16
8192,3345,28672,hipblaslt,77901,1.513616180419922,torch.float8_e4m3fnuz,torch.float16
10240,1082,8192,hipblaslt,77941,0.19021575450897216,torch.float8_e4m3fnuz,torch.float16
57344,274,8192,hipblaslt,77839,0.31634860038757323,torch.float8_e4m3fnuz,torch.float16
8192,1911,8192,hipblaslt,77716,0.25659010410308836,torch.float8_e4m3fnuz,torch.float16
10240,5343,8192,hipblaslt,77890,0.8234037399291992,torch.float8_e4m3fnuz,torch.float16
8192,5542,28672,hipblaslt,77918,2.6041675567626954,torch.float8_e4m3fnuz,torch.float16
10240,602,8192,hipblaslt,77869,0.13366600275039672,torch.float8_e4m3fnuz,torch.float16
57344,4925,8192,hipblaslt,77880,4.389908981323242,torch.float8_e4m3fnuz,torch.float16
10240,2547,8192,hipblaslt,77496,0.409963321685791,torch.float8_e4m3fnuz,torch.float16
8192,3993,8192,hipblaslt,77924,0.48281121253967285,torch.float8_e4m3fnuz,torch.float16
8192,512,28672,hipblaslt,76973,0.3058950901031494,torch.float8_e4m3fnuz,torch.float16
8192,7233,28672,hipblaslt,77935,3.118393135070801,torch.float8_e4m3fnuz,torch.float16
8192,3761,8192,hipblaslt,77921,0.4734973907470703,torch.float8_e4m3fnuz,torch.float16
8192,22654,28672,hipblaslt,77924,9.757980346679688,torch.float8_e4m3fnuz,torch.float16
10240,1666,8192,hipblaslt,77956,0.2998101472854614,torch.float8_e4m3fnuz,torch.float16
57344,5491,8192,hipblaslt,77880,4.895780462967722,torch.float8_e4m3fnuz,torch.float16
57344,4234,8192,hipblaslt,77880,3.7316055297851562,torch.float8_e4m3fnuz,torch.float16
8192,3341,8192,hipblaslt,77973,0.4175685405731201,torch.float8_e4m3fnuz,torch.float16
8192,2327,28672,hipblaslt,77418,1.1785258293151855,torch.float8_e4m3fnuz,torch.float16
57344,7040,8192,hipblaslt,77913,6.3459523518880205,torch.float8_e4m3fnuz,torch.float16
8192,1967,8192,hipblaslt,77925,0.2589456081390381,torch.float8_e4m3fnuz,torch.float16
8192,56,28672,hipblaslt,76834,0.08641800284385681,torch.float8_e4m3fnuz,torch.float16
57344,4886,8192,hipblaslt,77880,4.373210144042969,torch.float8_e4m3fnuz,torch.float16
8192,2385,8192,hipblaslt,77722,0.31949124336242674,torch.float8_e4m3fnuz,torch.float16
10240,1938,8192,hipblaslt,77396,0.3292897939682007,torch.float8_e4m3fnuz,torch.float16
8192,1578,28672,hipblaslt,78016,0.7357283115386963,torch.float8_e4m3fnuz,torch.float16
57344,4653,8192,hipblaslt,77925,4.203554916381836,torch.float8_e4m3fnuz,torch.float16
10240,2564,8192,hipblaslt,77973,0.41574583053588865,torch.float8_e4m3fnuz,torch.float16
8192,3174,8192,hipblaslt,77973,0.4072573184967041,torch.float8_e4m3fnuz,torch.float16
10240,3836,8192,hipblaslt,77984,0.6085294723510742,torch.float8_e4m3fnuz,torch.float16
10240,104,8192,hipblaslt,76641,0.055008500814437866,torch.float8_e4m3fnuz,torch.float16
8192,555,28672,hipblaslt,76918,0.34340364933013917,torch.float8_e4m3fnuz,torch.float16
57344,1084,8192,hipblaslt,77895,1.0018099784851073,torch.float8_e4m3fnuz,torch.float16
10240,3946,8192,hipblaslt,78018,0.6260473728179932,torch.float8_e4m3fnuz,torch.float16
8192,1003,8192,hipblaslt,77871,0.15067520141601562,torch.float8_e4m3fnuz,torch.float16
8192,1779,8192,hipblaslt,77926,0.24206459522247314,torch.float8_e4m3fnuz,torch.float16
57344,2643,8192,hipblaslt,77925,2.39412841796875,torch.float8_e4m3fnuz,torch.float16
8192,3046,28672,hipblaslt,77895,1.3657811164855957,torch.float8_e4m3fnuz,torch.float16
57344,1823,8192,hipblaslt,77952,1.715773582458496,torch.float8_e4m3fnuz,torch.float16
8192,2369,8192,hipblaslt,77957,0.3183716058731079,torch.float8_e4m3fnuz,torch.float16
57344,724,8192,hipblaslt,77913,0.6954681873321533,torch.float8_e4m3fnuz,torch.float16
57344,1041,8192,hipblaslt,77895,0.9924562454223633,torch.float8_e4m3fnuz,torch.float16
57344,2464,8192,hipblaslt,77935,2.2081329345703127,torch.float8_e4m3fnuz,torch.float16
8192,4326,28672,hipblaslt,77696,1.9662466049194336,torch.float8_e4m3fnuz,torch.float16
10240,628,28672,hipblaslt,77419,0.4397498607635498,torch.float8_e4m3fnuz,torch.float16
8192,159,28672,hipblaslt,76888,0.12494704723358155,torch.float8_e4m3fnuz,torch.float16
57344,5164,8192,hipblaslt,77903,4.638517379760742,torch.float8_e4m3fnuz,torch.float16
8192,3325,28672,hipblaslt,77935,1.5081339836120606,torch.float8_e4m3fnuz,torch.float16
10240,3262,8192,hipblaslt,77924,0.49521560668945314,torch.float8_e4m3fnuz,torch.float16
8192,733,28672,hipblaslt,77846,0.41814346313476564,torch.float8_e4m3fnuz,torch.float16
8192,2506,8192,hipblaslt,77829,0.3333878517150879,torch.float8_e4m3fnuz,torch.float16
10240,3285,8192,hipblaslt,77897,0.5037001609802246,torch.float8_e4m3fnuz,torch.float16
10240,3552,8192,hipblaslt,77675,0.5768225193023682,torch.float8_e4m3fnuz,torch.float16
8192,2611,8192,hipblaslt,77960,0.3522838592529297,torch.float8_e4m3fnuz,torch.float16
10240,1885,8192,hipblaslt,77882,0.31853585243225097,torch.float8_e4m3fnuz,torch.float16
8192,4620,8192,hipblaslt,77928,0.5829875946044922,torch.float8_e4m3fnuz,torch.float16
8192,4505,28672,hipblaslt,77895,2.0542951583862306,torch.float8_e4m3fnuz,torch.float16
8192,1488,8192,hipblaslt,77720,0.2038639545440674,torch.float8_e4m3fnuz,torch.float16
8192,2706,8192,hipblaslt,77960,0.3579401969909668,torch.float8_e4m3fnuz,torch.float16
8192,5022,28672,hipblaslt,77935,2.2498428344726564,torch.float8_e4m3fnuz,torch.float16
8192,6138,28672,hipblaslt,77924,2.670603942871094,torch.float8_e4m3fnuz,torch.float16
57344,497,8192,hipblaslt,77939,0.4886338710784912,torch.float8_e4m3fnuz,torch.float16
8192,2558,28672,hipblaslt,77396,1.2198389053344727,torch.float8_e4m3fnuz,torch.float16
8192,112,28672,hipblaslt,77048,0.10901800394058228,torch.float8_e4m3fnuz,torch.float16
8192,1549,28672,hipblaslt,77895,0.6919590473175049,torch.float8_e4m3fnuz,torch.float16
10240,1765,8192,hipblaslt,77830,0.2972583532333374,torch.float8_e4m3fnuz,torch.float16
10240,5062,8192,hipblaslt,77890,0.7944367885589599,torch.float8_e4m3fnuz,torch.float16
8192,5166,28672,hipblaslt,77903,2.2851690292358398,torch.float8_e4m3fnuz,torch.float16
8192,2224,8192,hipblaslt,77828,0.30413050651550294,torch.float8_e4m3fnuz,torch.float16
10240,5893,8192,hipblaslt,77922,0.9045079231262207,torch.float8_e4m3fnuz,torch.float16
57344,1280,8192,hipblaslt,77939,1.1247281074523925,torch.float8_e4m3fnuz,torch.float16
8192,1900,8192,hipblaslt,77925,0.2584508419036865,torch.float8_e4m3fnuz,torch.float16
10240,3240,8192,hipblaslt,77921,0.49474492073059084,torch.float8_e4m3fnuz,torch.float16
10240,55,28672,hipblaslt,76802,0.10087494850158692,torch.float8_e4m3fnuz,torch.float16
57344,4032,8192,hipblaslt,78012,3.5193233489990234,torch.float8_e4m3fnuz,torch.float16
57344,583,8192,hipblaslt,77961,0.6105303764343262,torch.float8_e4m3fnuz,torch.float16
10240,1431,8192,hipblaslt,77900,0.25151255130767824,torch.float8_e4m3fnuz,torch.float16
8192,4435,8192,hipblaslt,77723,0.5542049407958984,torch.float8_e4m3fnuz,torch.float16
10240,3524,8192,hipblaslt,77696,0.5745170593261719,torch.float8_e4m3fnuz,torch.float16
8192,454,28672,hipblaslt,77188,0.29375314712524414,torch.float8_e4m3fnuz,torch.float16
10240,1228,8192,hipblaslt,77890,0.20928804874420165,torch.float8_e4m3fnuz,torch.float16
8192,6346,8192,hipblaslt,77888,0.803101634979248,torch.float8_e4m3fnuz,torch.float16
10240,1065,8192,hipblaslt,77976,0.1909388542175293,torch.float8_e4m3fnuz,torch.float16
8192,3682,8192,hipblaslt,77923,0.46502485275268557,torch.float8_e4m3fnuz,torch.float16
10240,6349,8192,hipblaslt,77981,0.9529115676879882,torch.float8_e4m3fnuz,torch.float16
57344,1315,8192,hipblaslt,77895,1.209373378753662,torch.float8_e4m3fnuz,torch.float16
10240,5162,8192,hipblaslt,78016,0.8035863876342774,torch.float8_e4m3fnuz,torch.float16
10240,65113,8192,hipblaslt,77926,9.571891021728515,torch.float8_e4m3fnuz,torch.float16
8192,5044,8192,hipblaslt,77984,0.6143801212310791,torch.float8_e4m3fnuz,torch.float16
8192,2790,28672,hipblaslt,77895,1.3183327674865724,torch.float8_e4m3fnuz,torch.float16
57344,1431,8192,hipblaslt,77950,1.3085503578186035,torch.float8_e4m3fnuz,torch.float16
57344,2592,8192,hipblaslt,77925,2.3670843124389647,torch.float8_e4m3fnuz,torch.float16
57344,4709,8192,hipblaslt,77880,4.306991958618164,torch.float8_e4m3fnuz,torch.float16
10240,64,8192,hipblaslt,42500,0.04003329873085022,torch.float8_e4m3fnuz,torch.float16
8192,5253,28672,hipblaslt,77719,2.272542381286621,torch.float8_e4m3fnuz,torch.float16
10240,3630,8192,hipblaslt,77877,0.5900761127471924,torch.float8_e4m3fnuz,torch.float16
10240,2675,8192,hipblaslt,77973,0.41288161277770996,torch.float8_e4m3fnuz,torch.float16
57344,4481,8192,hipblaslt,78017,3.9886425018310545,torch.float8_e4m3fnuz,torch.float16
8192,2858,28672,hipblaslt,77917,1.3260723114013673,torch.float8_e4m3fnuz,torch.float16
8192,1537,8192,hipblaslt,77942,0.20741724967956543,torch.float8_e4m3fnuz,torch.float16
10240,7010,8192,hipblaslt,77890,1.0503499031066894,torch.float8_e4m3fnuz,torch.float16
8192,2835,8192,hipblaslt,77916,0.366530442237854,torch.float8_e4m3fnuz,torch.float16
8192,1919,8192,hipblaslt,77880,0.25891153812408446,torch.float8_e4m3fnuz,torch.float16
10240,905,8192,hipblaslt,77689,0.17404780387878419,torch.float8_e4m3fnuz,torch.float16
8192,5589,28672,hipblaslt,77755,2.572224235534668,torch.float8_e4m3fnuz,torch.float16
8192,576,8192,hipblaslt,77599,0.10603710412979125,torch.float8_e4m3fnuz,torch.float16
8192,192,8192,hipblaslt,42504,0.05440210103988648,torch.float8_e4m3fnuz,torch.float16
8192,512,8192,hipblaslt,77592,0.09206839799880981,torch.float8_e4m3fnuz,torch.float16
8192,723,8192,hipblaslt,77867,0.11943939924240113,torch.float8_e4m3fnuz,torch.float16
8192,3287,8192,hipblaslt,77901,0.41541333198547364,torch.float8_e4m3fnuz,torch.float16
8192,4804,8192,hipblaslt,77984,0.6090261459350585,torch.float8_e4m3fnuz,torch.float16
57344,1283,8192,hipblaslt,77928,1.2180402755737305,torch.float8_e4m3fnuz,torch.float16
10240,1893,8192,hipblaslt,77912,0.31499059200286866,torch.float8_e4m3fnuz,torch.float16
10240,2527,8192,hipblaslt,77973,0.40994725227355955,torch.float8_e4m3fnuz,torch.float16
57344,1713,8192,hipblaslt,77952,1.5402376174926757,torch.float8_e4m3fnuz,torch.float16
8192,8199,28672,hipblaslt,77924,3.541878890991211,torch.float8_e4m3fnuz,torch.float16
8192,3128,28672,hipblaslt,77895,1.3786982536315917,torch.float8_e4m3fnuz,torch.float16
57344,4391,8192,hipblaslt,77935,3.87634391784668,torch.float8_e4m3fnuz,torch.float16
57344,2647,8192,hipblaslt,77923,2.4244251251220703,torch.float8_e4m3fnuz,torch.float16
8192,2804,8192,hipblaslt,77495,0.36198625564575193,torch.float8_e4m3fnuz,torch.float16
10240,2703,8192,hipblaslt,77720,0.4286349296569824,torch.float8_e4m3fnuz,torch.float16
8192,2730,8192,hipblaslt,77916,0.36334819793701173,torch.float8_e4m3fnuz,torch.float16
10240,5407,8192,hipblaslt,77877,0.8336689949035645,torch.float8_e4m3fnuz,torch.float16
8192,1985,28672,hipblaslt,77923,0.8842098236083984,torch.float8_e4m3fnuz,torch.float16
8192,1697,28672,hipblaslt,77942,0.7584434986114502,torch.float8_e4m3fnuz,torch.float16
8192,1849,8192,hipblaslt,77926,0.25099780559539797,torch.float8_e4m3fnuz,torch.float16
8192,781,8192,hipblaslt,77869,0.12840420007705688,torch.float8_e4m3fnuz,torch.float16
8192,1810,28672,hipblaslt,77923,0.8552087783813477,torch.float8_e4m3fnuz,torch.float16
8192,8131,28672,hipblaslt,77924,3.5385074615478516,torch.float8_e4m3fnuz,torch.float16
10240,2343,8192,hipblaslt,77960,0.38139095306396487,torch.float8_e4m3fnuz,torch.float16
8192,1504,28672,hipblaslt,77961,0.6826892375946045,torch.float8_e4m3fnuz,torch.float16
8192,2240,28672,hipblaslt,77927,1.078303337097168,torch.float8_e4m3fnuz,torch.float16
10240,2156,8192,hipblaslt,77960,0.36121311187744143,torch.float8_e4m3fnuz,torch.float16
10240,1407,8192,hipblaslt,42415,0.2549832582473755,torch.float8_e4m3fnuz,torch.float16
8192,5820,8192,hipblaslt,77925,0.711453914642334,torch.float8_e4m3fnuz,torch.float16
10240,6064,8192,hipblaslt,77924,0.9133810043334961,torch.float8_e4m3fnuz,torch.float16
8192,4664,8192,hipblaslt,77917,0.5861482620239258,torch.float8_e4m3fnuz,torch.float16
8192,881,28672,hipblaslt,77869,0.4697858810424805,torch.float8_e4m3fnuz,torch.float16
10240,2009,8192,hipblaslt,77829,0.3397132396697998,torch.float8_e4m3fnuz,torch.float16
8192,4639,8192,hipblaslt,77917,0.597196626663208,torch.float8_e4m3fnuz,torch.float16
57344,3790,8192,hipblaslt,77880,3.363384246826172,torch.float8_e4m3fnuz,torch.float16
57344,5010,8192,hipblaslt,77925,4.508949279785156,torch.float8_e4m3fnuz,torch.float16
57344,2945,8192,hipblaslt,78017,2.6902931213378904,torch.float8_e4m3fnuz,torch.float16
8192,2348,8192,hipblaslt,77836,0.31833155155181886,torch.float8_e4m3fnuz,torch.float16
8192,977,28672,hipblaslt,42477,0.5156318187713623,torch.float8_e4m3fnuz,torch.float16
8192,5426,28672,hipblaslt,77829,2.536050796508789,torch.float8_e4m3fnuz,torch.float16
10240,1901,8192,hipblaslt,77993,0.3196174383163452,torch.float8_e4m3fnuz,torch.float16
8192,22341,8192,hipblaslt,77922,2.6327280044555663,torch.float8_e4m3fnuz,torch.float16
8192,651,8192,hipblaslt,77866,0.11715755462646485,torch.float8_e4m3fnuz,torch.float16
8192,1865,8192,hipblaslt,77926,0.2580422401428223,torch.float8_e4m3fnuz,torch.float16
10240,2057,8192,hipblaslt,77886,0.35580904483795167,torch.float8_e4m3fnuz,torch.float16
8192,1281,28672,hipblaslt,77917,0.6345835208892823,torch.float8_e4m3fnuz,torch.float16
8192,2063,28672,hipblaslt,77956,1.027808952331543,torch.float8_e4m3fnuz,torch.float16
8192,3456,8192,hipblaslt,77720,0.42353339195251466,torch.float8_e4m3fnuz,torch.float16
10240,1178,8192,hipblaslt,77945,0.20436275005340576,torch.float8_e4m3fnuz,torch.float16
10240,1453,8192,hipblaslt,77944,0.2560237407684326,torch.float8_e4m3fnuz,torch.float16
8192,4564,8192,hipblaslt,77928,0.5777839183807373,torch.float8_e4m3fnuz,torch.float16
57344,2718,8192,hipblaslt,77950,2.522818946838379,torch.float8_e4m3fnuz,torch.float16
57344,2783,8192,hipblaslt,77950,2.5327056884765624,torch.float8_e4m3fnuz,torch.float16
10240,135,28672,hipblaslt,76902,0.14518860578536988,torch.float8_e4m3fnuz,torch.float16
57344,3703,8192,hipblaslt,77880,3.3464130401611327,torch.float8_e4m3fnuz,torch.float16
57344,5201,8192,hipblaslt,77719,4.669288635253906,torch.float8_e4m3fnuz,torch.float16
57344,119,8192,hipblaslt,77985,0.1883679986000061,torch.float8_e4m3fnuz,torch.float16
57344,3084,8192,hipblaslt,77880,2.8097801208496094,torch.float8_e4m3fnuz,torch.float16
8192,31539,8192,hipblaslt,77922,3.6588718414306642,torch.float8_e4m3fnuz,torch.float16
8192,468,8192,hipblaslt,77391,0.08679804801940919,torch.float8_e4m3fnuz,torch.float16
10240,6791,8192,hipblaslt,77890,1.0312255859375,torch.float8_e4m3fnuz,torch.float16
8192,432,8192,hipblaslt,76973,0.0891755998134613,torch.float8_e4m3fnuz,torch.float16
8192,3009,28672,hipblaslt,77895,1.3681446075439454,torch.float8_e4m3fnuz,torch.float16
8192,110,8192,hipblaslt,77301,0.04349195063114166,torch.float8_e4m3fnuz,torch.float16
10240,3206,8192,hipblaslt,77921,0.49491310119628906,torch.float8_e4m3fnuz,torch.float16
57344,3540,8192,hipblaslt,77925,3.162148284912109,torch.float8_e4m3fnuz,torch.float16
8192,5768,28672,hipblaslt,77925,2.664310646057129,torch.float8_e4m3fnuz,torch.float16
57344,2645,8192,hipblaslt,77925,2.3903568267822264,torch.float8_e4m3fnuz,torch.float16
8192,1251,8192,hipblaslt,77941,0.18466955423355103,torch.float8_e4m3fnuz,torch.float16
8192,3347,28672,hipblaslt,77903,1.5138364791870118,torch.float8_e4m3fnuz,torch.float16
10240,65446,8192,hipblaslt,77923,9.586949920654297,torch.float8_e4m3fnuz,torch.float16
57344,245,8192,hipblaslt,78012,0.2667330980300903,torch.float8_e4m3fnuz,torch.float16
10240,50038,8192,hipblaslt,77922,7.337749774639423,torch.float8_e4m3fnuz,torch.float16
8192,7442,8192,hipblaslt,77960,0.9071858406066895,torch.float8_e4m3fnuz,torch.float16
57344,2004,8192,hipblaslt,77880,1.8223333358764648,torch.float8_e4m3fnuz,torch.float16
8192,3030,28672,hipblaslt,77895,1.3736968994140626,torch.float8_e4m3fnuz,torch.float16
10240,947,8192,hipblaslt,77448,0.17842634916305541,torch.float8_e4m3fnuz,torch.float16
8192,1400,8192,hipblaslt,77916,0.19840190410614014,torch.float8_e4m3fnuz,torch.float16
8192,1583,28672,hipblaslt,77950,0.7336748123168946,torch.float8_e4m3fnuz,torch.float16
10240,3397,8192,hipblaslt,77886,0.5488450527191162,torch.float8_e4m3fnuz,torch.float16
8192,2143,8192,hipblaslt,77828,0.2979854106903076,torch.float8_e4m3fnuz,torch.float16
57344,2861,8192,hipblaslt,77935,2.603841209411621,torch.float8_e4m3fnuz,torch.float16
8192,1396,28672,hipblaslt,77961,0.6835640430450439,torch.float8_e4m3fnuz,torch.float16
8192,669,8192,hipblaslt,77867,0.11749005317687988,torch.float8_e4m3fnuz,torch.float16
57344,4235,8192,hipblaslt,77880,3.766896057128906,torch.float8_e4m3fnuz,torch.float16
8192,1857,28672,hipblaslt,77921,0.8787792205810547,torch.float8_e4m3fnuz,torch.float16
8192,645,28672,hipblaslt,77586,0.40508604049682617,torch.float8_e4m3fnuz,torch.float16
10240,686,8192,hipblaslt,77403,0.14395724534988402,torch.float8_e4m3fnuz,torch.float16
8192,188,8192,hipblaslt,42495,0.05717269778251648,torch.float8_e4m3fnuz,torch.float16
57344,2071,8192,hipblaslt,77952,1.91925106048584,torch.float8_e4m3fnuz,torch.float16
8192,283,28672,hipblaslt,77197,0.19448210000991822,torch.float8_e4m3fnuz,torch.float16
57344,439,8192,hipblaslt,77967,0.4452315330505371,torch.float8_e4m3fnuz,torch.float16
57344,2919,8192,hipblaslt,77920,2.676400566101074,torch.float8_e4m3fnuz,torch.float16
8192,3080,28672,hipblaslt,77928,1.4045805931091309,torch.float8_e4m3fnuz,torch.float16
10240,1501,8192,hipblaslt,77924,0.25379993915557864,torch.float8_e4m3fnuz,torch.float16
8192,6082,28672,hipblaslt,77924,2.662744331359863,torch.float8_e4m3fnuz,torch.float16
10240,1282,8192,hipblaslt,78018,0.21151134967803956,torch.float8_e4m3fnuz,torch.float16
8192,3726,28672,hipblaslt,77924,1.7583868026733398,torch.float8_e4m3fnuz,torch.float16
57344,6671,8192,hipblaslt,77880,5.8943328857421875,torch.float8_e4m3fnuz,torch.float16
8192,5482,8192,hipblaslt,77925,0.6894477844238281,torch.float8_e4m3fnuz,torch.float16
10240,475,8192,hipblaslt,77599,0.10993485450744629,torch.float8_e4m3fnuz,torch.float16
10240,6532,8192,hipblaslt,77981,0.9824733734130859,torch.float8_e4m3fnuz,torch.float16
10240,3715,8192,hipblaslt,77890,0.6095269203186036,torch.float8_e4m3fnuz,torch.float16
10240,4627,8192,hipblaslt,77922,0.7163772106170654,torch.float8_e4m3fnuz,torch.float16
57344,2508,8192,hipblaslt,77950,2.2873863220214843,torch.float8_e4m3fnuz,torch.float16
8192,6396,28672,hipblaslt,77935,2.9795095443725588,torch.float8_e4m3fnuz,torch.float16
10240,2133,8192,hipblaslt,77960,0.3603182554244995,torch.float8_e4m3fnuz,torch.float16
8192,251,28672,hipblaslt,76641,0.18044129610061646,torch.float8_e4m3fnuz,torch.float16
8192,5012,28672,hipblaslt,77903,2.2548681259155274,torch.float8_e4m3fnuz,torch.float16
57344,928,8192,hipblaslt,77952,0.8898921966552734,torch.float8_e4m3fnuz,torch.float16
10240,3912,8192,hipblaslt,77935,0.6205672264099121,torch.float8_e4m3fnuz,torch.float16
10240,1275,8192,hipblaslt,77890,0.20803215503692626,torch.float8_e4m3fnuz,torch.float16
8192,1918,8192,hipblaslt,77925,0.25372583866119386,torch.float8_e4m3fnuz,torch.float16
8192,3892,8192,hipblaslt,77922,0.47893342971801756,torch.float8_e4m3fnuz,torch.float16
8192,1013,8192,hipblaslt,77870,0.1533226490020752,torch.float8_e4m3fnuz,torch.float16
10240,803,8192,hipblaslt,77408,0.1567702054977417,torch.float8_e4m3fnuz,torch.float16
8192,1473,28672,hipblaslt,77961,0.6782627582550049,torch.float8_e4m3fnuz,torch.float16
8192,3017,28672,hipblaslt,77895,1.3658993721008301,torch.float8_e4m3fnuz,torch.float16
57344,2412,8192,hipblaslt,77935,2.2070913314819336,torch.float8_e4m3fnuz,torch.float16
10240,1551,8192,hipblaslt,77880,0.2602215051651001,torch.float8_e4m3fnuz,torch.float16
8192,7094,28672,hipblaslt,77888,3.106001091003418,torch.float8_e4m3fnuz,torch.float16
57344,4772,8192,hipblaslt,77935,4.328704452514648,torch.float8_e4m3fnuz,torch.float16
10240,766,8192,hipblaslt,77593,0.14668124914169312,torch.float8_e4m3fnuz,torch.float16
57344,2804,8192,hipblaslt,77950,2.533751106262207,torch.float8_e4m3fnuz,torch.float16
8192,1385,28672,hipblaslt,77961,0.6728727340698242,torch.float8_e4m3fnuz,torch.float16
8192,594,28672,hipblaslt,76890,0.3619932413101196,torch.float8_e4m3fnuz,torch.float16
8192,305,8192,hipblaslt,77374,0.06950899958610535,torch.float8_e4m3fnuz,torch.float16
10240,960,8192,hipblaslt,77689,0.17384350299835205,torch.float8_e4m3fnuz,torch.float16
8192,2300,28672,hipblaslt,77828,1.1141584396362305,torch.float8_e4m3fnuz,torch.float16
10240,3546,8192,hipblaslt,77895,0.575039291381836,torch.float8_e4m3fnuz,torch.float16
10240,98,28672,hipblaslt,77133,0.12921290397644042,torch.float8_e4m3fnuz,torch.float16
10240,2669,8192,hipblaslt,77720,0.41630067825317385,torch.float8_e4m3fnuz,torch.float16
10240,112,28672,hipblaslt,76877,0.13145769834518434,torch.float8_e4m3fnuz,torch.float16
8192,4646,8192,hipblaslt,77917,0.5817718029022216,torch.float8_e4m3fnuz,torch.float16
57344,867,8192,hipblaslt,77926,0.8126017570495605,torch.float8_e4m3fnuz,torch.float16
57344,5126,8192,hipblaslt,77925,4.532556533813477,torch.float8_e4m3fnuz,torch.float16
10240,2908,8192,hipblaslt,77922,0.46388516426086424,torch.float8_e4m3fnuz,torch.float16
8192,4000,28672,hipblaslt,77924,1.7814308166503907,torch.float8_e4m3fnuz,torch.float16
57344,2196,8192,hipblaslt,77952,2.036324310302734,torch.float8_e4m3fnuz,torch.float16
57344,2779,8192,hipblaslt,77950,2.579300880432129,torch.float8_e4m3fnuz,torch.float16
57344,4564,8192,hipblaslt,78017,4.01196517944336,torch.float8_e4m3fnuz,torch.float16
8192,3941,8192,hipblaslt,77921,0.4831977844238281,torch.float8_e4m3fnuz,torch.float16
8192,4642,8192,hipblaslt,77928,0.5872198581695557,torch.float8_e4m3fnuz,torch.float16
8192,2962,8192,hipblaslt,77976,0.3810344457626343,torch.float8_e4m3fnuz,torch.float16
8192,3576,28672,hipblaslt,77903,1.5634340286254882,torch.float8_e4m3fnuz,torch.float16
8192,163,8192,hipblaslt,77374,0.05584474802017212,torch.float8_e4m3fnuz,torch.float16
57344,1091,8192,hipblaslt,77928,1.0188551902770997,torch.float8_e4m3fnuz,torch.float16
8192,413,28672,hipblaslt,76973,0.2816211462020874,torch.float8_e4m3fnuz,torch.float16
8192,148,28672,hipblaslt,76913,0.12461860179901123,torch.float8_e4m3fnuz,torch.float16
10240,5373,8192,hipblaslt,78016,0.8221739768981934,torch.float8_e4m3fnuz,torch.float16
8192,2293,8192,hipblaslt,77828,0.30249810218811035,torch.float8_e4m3fnuz,torch.float16
57344,4527,8192,hipblaslt,78017,3.99451904296875,torch.float8_e4m3fnuz,torch.float16
8192,2916,8192,hipblaslt,77916,0.3738297462463379,torch.float8_e4m3fnuz,torch.float16
57344,3151,8192,hipblaslt,77952,2.9023874282836912,torch.float8_e4m3fnuz,torch.float16
8192,3285,8192,hipblaslt,78018,0.4190347194671631,torch.float8_e4m3fnuz,torch.float16
8192,3608,28672,hipblaslt,78018,1.5680487632751465,torch.float8_e4m3fnuz,torch.float16
10240,1436,8192,hipblaslt,77926,0.2504109382629395,torch.float8_e4m3fnuz,torch.float16
57344,3032,8192,hipblaslt,77719,2.711512565612793,torch.float8_e4m3fnuz,torch.float16
8192,3743,28672,hipblaslt,77924,1.7543317794799804,torch.float8_e4m3fnuz,torch.float16
8192,2078,28672,hipblaslt,77956,1.0318344116210938,torch.float8_e4m3fnuz,torch.float16
10240,2650,8192,hipblaslt,77496,0.41275944709777834,torch.float8_e4m3fnuz,torch.float16
10240,1793,8192,hipblaslt,77836,0.31399509906768797,torch.float8_e4m3fnuz,torch.float16
8192,2915,8192,hipblaslt,77495,0.3820178985595703,torch.float8_e4m3fnuz,torch.float16
8192,483,8192,hipblaslt,76973,0.09109495282173156,torch.float8_e4m3fnuz,torch.float16
8192,224,8192,hipblaslt,76783,0.06374639868736268,torch.float8_e4m3fnuz,torch.float16
10240,3680,8192,hipblaslt,77935,0.600851583480835,torch.float8_e4m3fnuz,torch.float16
8192,3234,28672,hipblaslt,77950,1.482091522216797,torch.float8_e4m3fnuz,torch.float16
10240,867,8192,hipblaslt,42423,0.1570436477661133,torch.float8_e4m3fnuz,torch.float16
8192,1353,8192,hipblaslt,77710,0.1909569025039673,torch.float8_e4m3fnuz,torch.float16
10240,2262,8192,hipblaslt,77424,0.3719369411468506,torch.float8_e4m3fnuz,torch.float16
8192,1238,28672,hipblaslt,77675,0.6308694362640381,torch.float8_e4m3fnuz,torch.float16
10240,5947,8192,hipblaslt,77924,0.9026069641113281,torch.float8_e4m3fnuz,torch.float16
8192,2507,8192,hipblaslt,77829,0.32855269908905027,torch.float8_e4m3fnuz,torch.float16
57344,145,28672,hipblaslt,77927,0.6905008316040039,torch.float8_e4m3fnuz,torch.float16
57344,6368,8192,hipblaslt,77776,5.832738988539752,torch.float8_e4m3fnuz,torch.float16
8192,2184,8192,hipblaslt,77927,0.30693864822387695,torch.float8_e4m3fnuz,torch.float16
8192,2997,28672,hipblaslt,77928,1.3734970092773438,torch.float8_e4m3fnuz,torch.float16
10240,1455,8192,hipblaslt,77977,0.2605008602142334,torch.float8_e4m3fnuz,torch.float16
57344,1302,8192,hipblaslt,77895,1.21287260055542,torch.float8_e4m3fnuz,torch.float16
10240,5742,8192,hipblaslt,77973,0.8551987648010254,torch.float8_e4m3fnuz,torch.float16
10240,3164,8192,hipblaslt,77921,0.4997683525085449,torch.float8_e4m3fnuz,torch.float16
8192,5933,28672,hipblaslt,77924,2.652801513671875,torch.float8_e4m3fnuz,torch.float16
8192,3076,28672,hipblaslt,77928,1.384422779083252,torch.float8_e4m3fnuz,torch.float16
57344,297,8192,hipblaslt,77927,0.3490150451660156,torch.float8_e4m3fnuz,torch.float16
8192,1562,28672,hipblaslt,77961,0.6894473075866699,torch.float8_e4m3fnuz,torch.float16
10240,1163,8192,hipblaslt,77890,0.2048274517059326,torch.float8_e4m3fnuz,torch.float16
8192,1934,8192,hipblaslt,77926,0.2562716007232666,torch.float8_e4m3fnuz,torch.float16
10240,1276,8192,hipblaslt,78018,0.20906970500946045,torch.float8_e4m3fnuz,torch.float16
8192,2304,8192,hipblaslt,77915,0.3149846076965332,torch.float8_e4m3fnuz,torch.float16
8192,2075,28672,hipblaslt,77956,1.0294469833374023,torch.float8_e4m3fnuz,torch.float16
8192,790,28672,hipblaslt,77614,0.4752339363098145,torch.float8_e4m3fnuz,torch.float16
8192,2796,8192,hipblaslt,77723,0.3677667617797852,torch.float8_e4m3fnuz,torch.float16
8192,899,8192,hipblaslt,77870,0.14455515146255493,torch.float8_e4m3fnuz,torch.float16
8192,815,28672,hipblaslt,77869,0.4589258670806885,torch.float8_e4m3fnuz,torch.float16
8192,3462,28672,hipblaslt,77942,1.535228157043457,torch.float8_e4m3fnuz,torch.float16
10240,2549,8192,hipblaslt,77984,0.41602225303649903,torch.float8_e4m3fnuz,torch.float16
57344,1057,8192,hipblaslt,77938,0.9992241859436035,torch.float8_e4m3fnuz,torch.float16
57344,1925,8192,hipblaslt,77950,1.7843711853027344,torch.float8_e4m3fnuz,torch.float16
8192,852,8192,hipblaslt,77399,0.13653625249862672,torch.float8_e4m3fnuz,torch.float16
57344,1822,8192,hipblaslt,77952,1.7056406021118165,torch.float8_e4m3fnuz,torch.float16
10240,662,8192,hipblaslt,77869,0.13136260509490966,torch.float8_e4m3fnuz,torch.float16
8192,4677,28672,hipblaslt,77895,2.0768304824829102,torch.float8_e4m3fnuz,torch.float16
10240,2290,8192,hipblaslt,77960,0.37482523918151855,torch.float8_e4m3fnuz,torch.float16
8192,7715,8192,hipblaslt,77923,0.9264043807983399,torch.float8_e4m3fnuz,torch.float16
8192,6936,28672,hipblaslt,78012,3.0273483276367186,torch.float8_e4m3fnuz,torch.float16
8192,1845,8192,hipblaslt,77975,0.2548895597457886,torch.float8_e4m3fnuz,torch.float16
57344,1917,8192,hipblaslt,77952,1.7284860610961914,torch.float8_e4m3fnuz,torch.float16
57344,1534,8192,hipblaslt,77952,1.3544504165649414,torch.float8_e4m3fnuz,torch.float16
57344,3402,8192,hipblaslt,77935,3.1228960037231444,torch.float8_e4m3fnuz,torch.float16
57344,393,8192,hipblaslt,77961,0.4253681182861328,torch.float8_e4m3fnuz,torch.float16
10240,1996,8192,hipblaslt,77851,0.348107647895813,torch.float8_e4m3fnuz,torch.float16
8192,6893,8192,hipblaslt,77984,0.8264362335205078,torch.float8_e4m3fnuz,torch.float16
57344,3738,8192,hipblaslt,77880,3.3392105102539062,torch.float8_e4m3fnuz,torch.float16
8192,5696,28672,hipblaslt,77755,2.6273820877075194,torch.float8_e4m3fnuz,torch.float16
57344,1740,8192,hipblaslt,77925,1.5739436149597168,torch.float8_e4m3fnuz,torch.float16
10240,8770,8192,hipblaslt,77922,1.3402894020080567,torch.float8_e4m3fnuz,torch.float16
8192,30,8192,hipblaslt,77250,0.028818199038505556,torch.float8_e4m3fnuz,torch.float16
57344,159,28672,hipblaslt,77818,0.7099075794219971,torch.float8_e4m3fnuz,torch.float16
10240,3741,8192,hipblaslt,77935,0.6038825511932373,torch.float8_e4m3fnuz,torch.float16
57344,545,8192,hipblaslt,77778,0.5789485931396484,torch.float8_e4m3fnuz,torch.float16
8192,7017,8192,hipblaslt,77888,0.8470908164978027,torch.float8_e4m3fnuz,torch.float16
10240,1878,8192,hipblaslt,77912,0.31839165687561033,torch.float8_e4m3fnuz,torch.float16
57344,6026,8192,hipblaslt,78012,5.286235136144302,torch.float8_e4m3fnuz,torch.float16
8192,1957,8192,hipblaslt,77897,0.2604017496109009,torch.float8_e4m3fnuz,torch.float16
10240,4112,8192,hipblaslt,77984,0.6414021492004395,torch.float8_e4m3fnuz,torch.float16
57344,727,8192,hipblaslt,77920,0.702054500579834,torch.float8_e4m3fnuz,torch.float16
8192,65223,8192,hipblaslt,77922,7.54872194925944,torch.float8_e4m3fnuz,torch.float16
8192,2982,8192,hipblaslt,77960,0.37915763854980467,torch.float8_e4m3fnuz,torch.float16
8192,1650,8192,hipblaslt,78018,0.21455984115600585,torch.float8_e4m3fnuz,torch.float16
57344,1029,8192,hipblaslt,77917,0.9980725288391114,torch.float8_e4m3fnuz,torch.float16
8192,1698,28672,hipblaslt,77942,0.7576969146728516,torch.float8_e4m3fnuz,torch.float16
8192,1799,28672,hipblaslt,77923,0.8501713752746582,torch.float8_e4m3fnuz,torch.float16
57344,5839,8192,hipblaslt,77920,5.25245836046007,torch.float8_e4m3fnuz,torch.float16
8192,4560,8192,hipblaslt,77967,0.5883615493774415,torch.float8_e4m3fnuz,torch.float16
8192,3232,28672,hipblaslt,77935,1.495327091217041,torch.float8_e4m3fnuz,torch.float16
10240,65365,8192,hipblaslt,77923,9.539561462402343,torch.float8_e4m3fnuz,torch.float16
10240,2304,8192,hipblaslt,77495,0.372443699836731,torch.float8_e4m3fnuz,torch.float16
57344,3878,8192,hipblaslt,78012,3.427643585205078,torch.float8_e4m3fnuz,torch.float16
8192,496,28672,hipblaslt,77188,0.2930981397628784,torch.float8_e4m3fnuz,torch.float16
57344,509,8192,hipblaslt,77939,0.4962350845336914,torch.float8_e4m3fnuz,torch.float16
57344,1464,8192,hipblaslt,77950,1.325385284423828,torch.float8_e4m3fnuz,torch.float16
10240,1113,8192,hipblaslt,77710,0.19374300241470338,torch.float8_e4m3fnuz,torch.float16
8192,4461,8192,hipblaslt,77916,0.5509221076965332,torch.float8_e4m3fnuz,torch.float16
8192,1064,28672,hipblaslt,77956,0.5320361614227295,torch.float8_e4m3fnuz,torch.float16
57344,459,8192,hipblaslt,77939,0.5067246437072754,torch.float8_e4m3fnuz,torch.float16
10240,45,8192,hipblaslt,42494,0.0391805499792099,torch.float8_e4m3fnuz,torch.float16
57344,3256,8192,hipblaslt,77935,2.9591955184936523,torch.float8_e4m3fnuz,torch.float16
10240,750,8192,hipblaslt,77491,0.14844590425491333,torch.float8_e4m3fnuz,torch.float16
10240,1444,8192,hipblaslt,77977,0.25804524421691893,torch.float8_e4m3fnuz,torch.float16
8192,3091,8192,hipblaslt,77895,0.40555672645568847,torch.float8_e4m3fnuz,torch.float16
8192,5941,28672,hipblaslt,77924,2.653586769104004,torch.float8_e4m3fnuz,torch.float16
8192,5118,8192,hipblaslt,77496,0.624062442779541,torch.float8_e4m3fnuz,torch.float16
8192,1683,28672,hipblaslt,77942,0.7627498626708984,torch.float8_e4m3fnuz,torch.float16
57344,8418,8192,hipblaslt,77880,7.226566608135517,torch.float8_e4m3fnuz,torch.float16
8192,4674,8192,hipblaslt,77928,0.5936363697052002,torch.float8_e4m3fnuz,torch.float16
8192,1138,8192,hipblaslt,77396,0.16143515110015869,torch.float8_e4m3fnuz,torch.float16
10240,2976,8192,hipblaslt,77924,0.48050580024719236,torch.float8_e4m3fnuz,torch.float16
8192,7334,28672,hipblaslt,77675,3.426437759399414,torch.float8_e4m3fnuz,torch.float16
57344,4411,8192,hipblaslt,77935,3.964506912231445,torch.float8_e4m3fnuz,torch.float16
57344,625,8192,hipblaslt,77873,0.6245972633361816,torch.float8_e4m3fnuz,torch.float16
10240,1877,8192,hipblaslt,77722,0.31546530723571775,torch.float8_e4m3fnuz,torch.float16
8192,4605,8192,hipblaslt,77917,0.5866570472717285,torch.float8_e4m3fnuz,torch.float16
10240,65227,8192,hipblaslt,77973,9.660044860839843,torch.float8_e4m3fnuz,torch.float16
8192,197,8192,hipblaslt,77301,0.062470048666000366,torch.float8_e4m3fnuz,torch.float16
8192,2605,28672,hipblaslt,77937,1.2593334197998047,torch.float8_e4m3fnuz,torch.float16
8192,4214,28672,hipblaslt,77922,1.7993234634399413,torch.float8_e4m3fnuz,torch.float16
57344,7036,8192,hipblaslt,77945,6.347504170735677,torch.float8_e4m3fnuz,torch.float16
8192,632,28672,hipblaslt,76890,0.36989645957946776,torch.float8_e4m3fnuz,torch.float16
8192,4038,8192,hipblaslt,77924,0.4922351360321045,torch.float8_e4m3fnuz,torch.float16
57344,1598,8192,hipblaslt,77939,1.509780502319336,torch.float8_e4m3fnuz,torch.float16
8192,750,28672,hipblaslt,77867,0.42069315910339355,torch.float8_e4m3fnuz,torch.float16
8192,4498,28672,hipblaslt,78013,2.047054481506348,torch.float8_e4m3fnuz,torch.float16
8192,3107,28672,hipblaslt,77895,1.3854342460632325,torch.float8_e4m3fnuz,torch.float16
8192,1386,8192,hipblaslt,77874,0.19139955043792725,torch.float8_e4m3fnuz,torch.float16
8192,1097,8192,hipblaslt,42423,0.16649065017700196,torch.float8_e4m3fnuz,torch.float16
8192,5864,28672,hipblaslt,77924,2.6464624404907227,torch.float8_e4m3fnuz,torch.float16
57344,155,28672,hipblaslt,77818,0.7017254829406738,torch.float8_e4m3fnuz,torch.float16
8192,2037,8192,hipblaslt,77771,0.2811023950576782,torch.float8_e4m3fnuz,torch.float16
8192,186,28672,hipblaslt,76925,0.1365488052368164,torch.float8_e4m3fnuz,torch.float16
8192,2268,28672,hipblaslt,42477,1.1012933731079102,torch.float8_e4m3fnuz,torch.float16
8192,4876,28672,hipblaslt,77935,2.241945266723633,torch.float8_e4m3fnuz,torch.float16
10240,4060,8192,hipblaslt,77877,0.6329516410827637,torch.float8_e4m3fnuz,torch.float16
8192,6664,28672,hipblaslt,77942,3.0255218505859376,torch.float8_e4m3fnuz,torch.float16
10240,6074,8192,hipblaslt,77885,0.9166818618774414,torch.float8_e4m3fnuz,torch.float16
8192,869,28672,hipblaslt,77399,0.47585883140563967,torch.float8_e4m3fnuz,torch.float16
10240,6594,8192,hipblaslt,77924,0.9711445808410645,torch.float8_e4m3fnuz,torch.float16
8192,5567,8192,hipblaslt,77924,0.6836056709289551,torch.float8_e4m3fnuz,torch.float16
8192,65354,28672,hipblaslt,77924,27.60367431640625,torch.float8_e4m3fnuz,torch.float16
8192,2015,8192,hipblaslt,77502,0.26309974193573,torch.float8_e4m3fnuz,torch.float16
57344,7094,8192,hipblaslt,77732,6.3822382609049475,torch.float8_e4m3fnuz,torch.float16
10240,15,8192,hipblaslt,76556,0.03264884948730469,torch.float8_e4m3fnuz,torch.float16
8192,1743,8192,hipblaslt,77922,0.2408287525177002,torch.float8_e4m3fnuz,torch.float16
57344,1035,8192,hipblaslt,77938,0.9981925964355469,torch.float8_e4m3fnuz,torch.float16
57344,1184,8192,hipblaslt,77939,1.122082233428955,torch.float8_e4m3fnuz,torch.float16
8192,6404,8192,hipblaslt,77903,0.8057355880737305,torch.float8_e4m3fnuz,torch.float16
57344,2951,8192,hipblaslt,78012,2.668803405761719,torch.float8_e4m3fnuz,torch.float16
57344,505,8192,hipblaslt,78012,0.5049018859863281,torch.float8_e4m3fnuz,torch.float16
8192,4385,8192,hipblaslt,77723,0.550922155380249,torch.float8_e4m3fnuz,torch.float16
57344,4861,8192,hipblaslt,77880,4.376382827758789,torch.float8_e4m3fnuz,torch.float16
8192,6685,28672,hipblaslt,77888,3.0169931411743165,torch.float8_e4m3fnuz,torch.float16
8192,2726,28672,hipblaslt,77918,1.2995950698852539,torch.float8_e4m3fnuz,torch.float16
57344,107,8192,hipblaslt,77602,0.19440100193023682,torch.float8_e4m3fnuz,torch.float16
8192,2342,28672,hipblaslt,77418,1.1774782180786132,torch.float8_e4m3fnuz,torch.float16
8192,4134,8192,hipblaslt,77966,0.49991455078125,torch.float8_e4m3fnuz,torch.float16
57344,2323,8192,hipblaslt,77952,2.150617790222168,torch.float8_e4m3fnuz,torch.float16
57344,2402,8192,hipblaslt,77952,2.194118118286133,torch.float8_e4m3fnuz,torch.float16
57344,4077,8192,hipblaslt,78012,3.498086166381836,torch.float8_e4m3fnuz,torch.float16
10240,6695,8192,hipblaslt,77922,0.9782892227172851,torch.float8_e4m3fnuz,torch.float16
8192,5440,28672,hipblaslt,77829,2.5386785507202148,torch.float8_e4m3fnuz,torch.float16
8192,4512,28672,hipblaslt,78013,2.0497583389282226,torch.float8_e4m3fnuz,torch.float16
8192,1015,28672,hipblaslt,77871,0.5115451812744141,torch.float8_e4m3fnuz,torch.float16
8192,563,28672,hipblaslt,76918,0.3404838085174561,torch.float8_e4m3fnuz,torch.float16
10240,6257,8192,hipblaslt,77922,0.9268630027770997,torch.float8_e4m3fnuz,torch.float16
8192,988,8192,hipblaslt,77388,0.13919219970703126,torch.float8_e4m3fnuz,torch.float16
10240,5423,8192,hipblaslt,77973,0.8343699455261231,torch.float8_e4m3fnuz,torch.float16
57344,584,8192,hipblaslt,77917,0.6185322284698487,torch.float8_e4m3fnuz,torch.float16
10240,2255,8192,hipblaslt,77960,0.36942124366760254,torch.float8_e4m3fnuz,torch.float16
10240,6145,8192,hipblaslt,77922,0.9291024208068848,torch.float8_e4m3fnuz,torch.float16
57344,3397,8192,hipblaslt,77696,3.109854888916016,torch.float8_e4m3fnuz,torch.float16
57344,3726,8192,hipblaslt,77880,3.3553585052490233,torch.float8_e4m3fnuz,torch.float16
57344,5295,8192,hipblaslt,77880,4.78718147277832,torch.float8_e4m3fnuz,torch.float16
57344,197,8192,hipblaslt,77990,0.2543788433074951,torch.float8_e4m3fnuz,torch.float16
10240,4493,8192,hipblaslt,77905,0.7265081882476807,torch.float8_e4m3fnuz,torch.float16
8192,4596,28672,hipblaslt,78013,2.065593719482422,torch.float8_e4m3fnuz,torch.float16
10240,5763,8192,hipblaslt,77924,0.8918311119079589,torch.float8_e4m3fnuz,torch.float16
8192,4754,8192,hipblaslt,77890,0.600475549697876,torch.float8_e4m3fnuz,torch.float16
57344,1651,8192,hipblaslt,77952,1.5227215766906739,torch.float8_e4m3fnuz,torch.float16
8192,71,8192,hipblaslt,77300,0.03895370066165924,torch.float8_e4m3fnuz,torch.float16
10240,4592,8192,hipblaslt,77981,0.7207015991210938,torch.float8_e4m3fnuz,torch.float16
8192,3370,28672,hipblaslt,77901,1.5070043563842774,torch.float8_e4m3fnuz,torch.float16
10240,5010,8192,hipblaslt,77877,0.7984888553619385,torch.float8_e4m3fnuz,torch.float16
10240,60455,8192,hipblaslt,77923,8.822783036665482,torch.float8_e4m3fnuz,torch.float16
8192,94,28672,hipblaslt,77052,0.1036455512046814,torch.float8_e4m3fnuz,torch.float16
8192,3523,28672,hipblaslt,77935,1.556050968170166,torch.float8_e4m3fnuz,torch.float16
57344,1242,8192,hipblaslt,77939,1.1348590850830078,torch.float8_e4m3fnuz,torch.float16
8192,576,28672,hipblaslt,76918,0.3453755617141724,torch.float8_e4m3fnuz,torch.float16
8192,2076,28672,hipblaslt,77956,1.032585620880127,torch.float8_e4m3fnuz,torch.float16
10240,4937,8192,hipblaslt,77984,0.7863128185272217,torch.float8_e4m3fnuz,torch.float16
57344,3624,8192,hipblaslt,77935,3.2370872497558594,torch.float8_e4m3fnuz,torch.float16
8192,2624,28672,hipblaslt,77688,1.2559404373168945,torch.float8_e4m3fnuz,torch.float16
8192,259,8192,hipblaslt,77303,0.06849499940872192,torch.float8_e4m3fnuz,torch.float16
57344,4690,8192,hipblaslt,77925,4.213445663452148,torch.float8_e4m3fnuz,torch.float16
10240,3512,8192,hipblaslt,77723,0.556856918334961,torch.float8_e4m3fnuz,torch.float16
8192,5457,8192,hipblaslt,77924,0.6905509471893311,torch.float8_e4m3fnuz,torch.float16
10240,65409,8192,hipblaslt,77923,9.581135559082032,torch.float8_e4m3fnuz,torch.float16
57344,2811,8192,hipblaslt,77950,2.5548063278198243,torch.float8_e4m3fnuz,torch.float16
8192,971,28672,hipblaslt,77871,0.5099628448486329,torch.float8_e4m3fnuz,torch.float16
8192,1895,8192,hipblaslt,77880,0.25705480575561523,torch.float8_e4m3fnuz,torch.float16
10240,5740,8192,hipblaslt,77877,0.850848388671875,torch.float8_e4m3fnuz,torch.float16
10240,115,8192,hipblaslt,77307,0.05400699973106384,torch.float8_e4m3fnuz,torch.float16
8192,6291,8192,hipblaslt,77935,0.7890168190002441,torch.float8_e4m3fnuz,torch.float16
57344,4305,8192,hipblaslt,77952,3.8608013153076173,torch.float8_e4m3fnuz,torch.float16
57344,2527,8192,hipblaslt,77950,2.2739423751831054,torch.float8_e4m3fnuz,torch.float16
8192,5282,28672,hipblaslt,77719,2.275865364074707,torch.float8_e4m3fnuz,torch.float16
8192,5301,28672,hipblaslt,77719,2.296281623840332,torch.float8_e4m3fnuz,torch.float16
8192,115,8192,hipblaslt,77377,0.045885950326919556,torch.float8_e4m3fnuz,torch.float16
10240,125,8192,hipblaslt,42518,0.056538748741149905,torch.float8_e4m3fnuz,torch.float16
57344,3065,8192,hipblaslt,78012,2.6968690872192385,torch.float8_e4m3fnuz,torch.float16
8192,2392,28672,hipblaslt,42464,1.1914830207824707,torch.float8_e4m3fnuz,torch.float16
8192,1088,8192,hipblaslt,77872,0.15793795585632325,torch.float8_e4m3fnuz,torch.float16
8192,2031,28672,hipblaslt,77881,0.9253127098083496,torch.float8_e4m3fnuz,torch.float16
10240,2889,8192,hipblaslt,77922,0.4693352699279785,torch.float8_e4m3fnuz,torch.float16
10240,3758,8192,hipblaslt,42477,0.6091604232788086,torch.float8_e4m3fnuz,torch.float16
57344,4275,8192,hipblaslt,77952,3.8742733001708984,torch.float8_e4m3fnuz,torch.float16
10240,2795,8192,hipblaslt,78016,0.4289194107055664,torch.float8_e4m3fnuz,torch.float16
57344,3403,8192,hipblaslt,77952,3.102676010131836,torch.float8_e4m3fnuz,torch.float16
8192,4620,28672,hipblaslt,77967,2.0993278503417967,torch.float8_e4m3fnuz,torch.float16
10240,186,8192,hipblaslt,76782,0.061564701795578006,torch.float8_e4m3fnuz,torch.float16
10240,173,8192,hipblaslt,76783,0.06167135238647461,torch.float8_e4m3fnuz,torch.float16
10240,1758,8192,hipblaslt,77828,0.3053102493286133,torch.float8_e4m3fnuz,torch.float16
57344,1124,8192,hipblaslt,77920,1.0820148468017579,torch.float8_e4m3fnuz,torch.float16
8192,2213,28672,hipblaslt,77927,1.0965642929077148,torch.float8_e4m3fnuz,torch.float16
8192,5201,28672,hipblaslt,77719,2.2668380737304688,torch.float8_e4m3fnuz,torch.float16
8192,6630,28672,hipblaslt,77935,2.999315071105957,torch.float8_e4m3fnuz,torch.float16
8192,4229,28672,hipblaslt,77924,1.8001306533813477,torch.float8_e4m3fnuz,torch.float16
8192,888,8192,hipblaslt,77869,0.13132050037384033,torch.float8_e4m3fnuz,torch.float16
10240,6158,8192,hipblaslt,77925,0.9512616157531738,torch.float8_e4m3fnuz,torch.float16
10240,165,8192,hipblaslt,77379,0.06389464735984803,torch.float8_e4m3fnuz,torch.float16
57344,1400,8192,hipblaslt,77939,1.326643180847168,torch.float8_e4m3fnuz,torch.float16
57344,684,8192,hipblaslt,77939,0.6776678562164307,torch.float8_e4m3fnuz,torch.float16
8192,1025,8192,hipblaslt,77870,0.14706984758377076,torch.float8_e4m3fnuz,torch.float16
8192,2119,28672,hipblaslt,77956,1.0740509986877442,torch.float8_e4m3fnuz,torch.float16
8192,6046,8192,hipblaslt,77925,0.7316057682037354,torch.float8_e4m3fnuz,torch.float16
8192,6506,8192,hipblaslt,77888,0.8087896347045899,torch.float8_e4m3fnuz,torch.float16
10240,233,8192,hipblaslt,77997,0.067381352186203,torch.float8_e4m3fnuz,torch.float16
8192,49435,28672,hipblaslt,77924,21.456739807128905,torch.float8_e4m3fnuz,torch.float16
10240,2867,8192,hipblaslt,77888,0.44017605781555175,torch.float8_e4m3fnuz,torch.float16
10240,5234,8192,hipblaslt,77496,0.8162872314453125,torch.float8_e4m3fnuz,torch.float16
10240,2420,8192,hipblaslt,77928,0.3972524404525757,torch.float8_e4m3fnuz,torch.float16
8192,4275,8192,hipblaslt,77495,0.5460008144378662,torch.float8_e4m3fnuz,torch.float16
8192,1544,8192,hipblaslt,77967,0.2024599552154541,torch.float8_e4m3fnuz,torch.float16
10240,2297,8192,hipblaslt,77960,0.3739920616149902,torch.float8_e4m3fnuz,torch.float16
57344,750,8192,hipblaslt,78018,0.7071595668792725,torch.float8_e4m3fnuz,torch.float16
57344,1158,8192,hipblaslt,77950,1.1289843559265136,torch.float8_e4m3fnuz,torch.float16
8192,15161,28672,hipblaslt,77901,6.839728219168527,torch.float8_e4m3fnuz,torch.float16
10240,2546,8192,hipblaslt,77890,0.4141815662384033,torch.float8_e4m3fnuz,torch.float16
8192,1218,8192,hipblaslt,77723,0.18380825519561766,torch.float8_e4m3fnuz,torch.float16
10240,88,8192,hipblaslt,77585,0.04717234969139099,torch.float8_e4m3fnuz,torch.float16
57344,1790,8192,hipblaslt,77939,1.5641570091247559,torch.float8_e4m3fnuz,torch.float16
10240,2436,8192,hipblaslt,77967,0.39799554347991944,torch.float8_e4m3fnuz,torch.float16
8192,1532,28672,hipblaslt,77895,0.6877988338470459,torch.float8_e4m3fnuz,torch.float16
8192,4949,8192,hipblaslt,77890,0.6106045722961426,torch.float8_e4m3fnuz,torch.float16
8192,2213,8192,hipblaslt,77828,0.29784719944000243,torch.float8_e4m3fnuz,torch.float16
8192,2538,28672,hipblaslt,77883,1.224860382080078,torch.float8_e4m3fnuz,torch.float16
57344,2568,8192,hipblaslt,77880,2.3601682662963865,torch.float8_e4m3fnuz,torch.float16
57344,640,8192,hipblaslt,77917,0.6266863346099854,torch.float8_e4m3fnuz,torch.float16
57344,995,8192,hipblaslt,77939,0.9318604469299316,torch.float8_e4m3fnuz,torch.float16
10240,2788,8192,hipblaslt,77496,0.42794189453125,torch.float8_e4m3fnuz,torch.float16
8192,4131,28672,hipblaslt,77924,1.7897371292114257,torch.float8_e4m3fnuz,torch.float16
10240,4709,8192,hipblaslt,77924,0.7261756896972656,torch.float8_e4m3fnuz,torch.float16
57344,952,8192,hipblaslt,78018,0.9109434127807617,torch.float8_e4m3fnuz,torch.float16
8192,65070,28672,hipblaslt,77924,27.761380004882813,torch.float8_e4m3fnuz,torch.float16
10240,4279,8192,hipblaslt,77924,0.6870687961578369,torch.float8_e4m3fnuz,torch.float16
8192,3104,8192,hipblaslt,77917,0.39890494346618655,torch.float8_e4m3fnuz,torch.float16
57344,1407,8192,hipblaslt,77939,1.3096400260925294,torch.float8_e4m3fnuz,torch.float16
8192,1740,28672,hipblaslt,77939,0.7864429950714111,torch.float8_e4m3fnuz,torch.float16
10240,603,8192,hipblaslt,77399,0.12991139888763428,torch.float8_e4m3fnuz,torch.float16
8192,2430,8192,hipblaslt,77957,0.3194091558456421,torch.float8_e4m3fnuz,torch.float16
57344,873,8192,hipblaslt,77926,0.8150113105773926,torch.float8_e4m3fnuz,torch.float16
57344,1461,8192,hipblaslt,77939,1.3293911933898925,torch.float8_e4m3fnuz,torch.float16
8192,885,28672,hipblaslt,77399,0.47044687271118163,torch.float8_e4m3fnuz,torch.float16
57344,1866,8192,hipblaslt,77952,1.7386455535888672,torch.float8_e4m3fnuz,torch.float16
57344,5528,8192,hipblaslt,77880,4.914986058285362,torch.float8_e4m3fnuz,torch.float16
8192,2646,8192,hipblaslt,77688,0.35185320377349855,torch.float8_e4m3fnuz,torch.float16
8192,6865,8192,hipblaslt,77984,0.836270809173584,torch.float8_e4m3fnuz,torch.float16
8192,6124,28672,hipblaslt,77721,2.695074462890625,torch.float8_e4m3fnuz,torch.float16
8192,65379,28672,hipblaslt,77924,27.645367431640626,torch.float8_e4m3fnuz,torch.float16
10240,5933,8192,hipblaslt,77922,0.9116644859313965,torch.float8_e4m3fnuz,torch.float16
8192,5398,28672,hipblaslt,77396,2.5398784637451173,torch.float8_e4m3fnuz,torch.float16
8192,772,28672,hipblaslt,77399,0.4578882694244385,torch.float8_e4m3fnuz,torch.float16
8192,3934,28672,hipblaslt,77924,1.7774250030517578,torch.float8_e4m3fnuz,torch.float16
8192,2650,8192,hipblaslt,77960,0.35373198986053467,torch.float8_e4m3fnuz,torch.float16
57344,3096,8192,hipblaslt,77880,2.8088848114013674,torch.float8_e4m3fnuz,torch.float16
8192,5076,28672,hipblaslt,78012,2.1913862228393555,torch.float8_e4m3fnuz,torch.float16
8192,5158,8192,hipblaslt,77890,0.6265201091766357,torch.float8_e4m3fnuz,torch.float16
57344,4921,8192,hipblaslt,77880,4.397322082519532,torch.float8_e4m3fnuz,torch.float16
8192,4130,28672,hipblaslt,77924,1.7860937118530273,torch.float8_e4m3fnuz,torch.float16
57344,2184,8192,hipblaslt,77950,1.9935209274291992,torch.float8_e4m3fnuz,torch.float16
8192,2420,8192,hipblaslt,77605,0.3202123403549194,torch.float8_e4m3fnuz,torch.float16
8192,1756,28672,hipblaslt,77939,0.7649291038513184,torch.float8_e4m3fnuz,torch.float16
8192,1001,28672,hipblaslt,77830,0.5235856533050537,torch.float8_e4m3fnuz,torch.float16
8192,5904,28672,hipblaslt,77971,2.6219959259033203,torch.float8_e4m3fnuz,torch.float16
10240,1875,8192,hipblaslt,77957,0.3183556079864502,torch.float8_e4m3fnuz,torch.float16
8192,4993,28672,hipblaslt,77901,2.2503896713256837,torch.float8_e4m3fnuz,torch.float16
10240,21013,8192,hipblaslt,77921,3.0741178512573244,torch.float8_e4m3fnuz,torch.float16
8192,2693,28672,hipblaslt,77895,1.3023311614990234,torch.float8_e4m3fnuz,torch.float16
8192,2176,28672,hipblaslt,77927,1.086186981201172,torch.float8_e4m3fnuz,torch.float16
10240,2874,8192,hipblaslt,77496,0.4362321853637695,torch.float8_e4m3fnuz,torch.float16
10240,5681,8192,hipblaslt,77890,0.8498869895935058,torch.float8_e4m3fnuz,torch.float16
10240,3516,8192,hipblaslt,77885,0.5438476085662842,torch.float8_e4m3fnuz,torch.float16
8192,1579,28672,hipblaslt,77942,0.7400551795959472,torch.float8_e4m3fnuz,torch.float16
8192,2673,8192,hipblaslt,77688,0.35930376052856444,torch.float8_e4m3fnuz,torch.float16
8192,3572,8192,hipblaslt,77720,0.4338266372680664,torch.float8_e4m3fnuz,torch.float16
8192,7637,28672,hipblaslt,77895,3.480948257446289,torch.float8_e4m3fnuz,torch.float16
10240,6506,8192,hipblaslt,77716,0.9752967834472657,torch.float8_e4m3fnuz,torch.float16
8192,3781,8192,hipblaslt,77925,0.4743306636810303,torch.float8_e4m3fnuz,torch.float16
57344,7264,8192,hipblaslt,77935,6.428168160574777,torch.float8_e4m3fnuz,torch.float16
10240,7006,8192,hipblaslt,77496,1.062153434753418,torch.float8_e4m3fnuz,torch.float16
10240,5496,8192,hipblaslt,78016,0.8346843719482422,torch.float8_e4m3fnuz,torch.float16
57344,2995,8192,hipblaslt,77952,2.7066774368286133,torch.float8_e4m3fnuz,torch.float16
57344,1614,8192,hipblaslt,77952,1.5103214263916016,torch.float8_e4m3fnuz,torch.float16
10240,3093,8192,hipblaslt,77922,0.48122286796569824,torch.float8_e4m3fnuz,torch.float16
57344,1257,8192,hipblaslt,77939,1.1274141311645507,torch.float8_e4m3fnuz,torch.float16
8192,2710,8192,hipblaslt,77941,0.3570769548416138,torch.float8_e4m3fnuz,torch.float16
8192,4864,28672,hipblaslt,77984,2.2282567977905274,torch.float8_e4m3fnuz,torch.float16
10240,5232,8192,hipblaslt,77984,0.817506980895996,torch.float8_e4m3fnuz,torch.float16
10240,3666,8192,hipblaslt,77935,0.6036161422729492,torch.float8_e4m3fnuz,torch.float16
57344,5543,8192,hipblaslt,77880,4.92539496170847,torch.float8_e4m3fnuz,torch.float16
8192,2797,28672,hipblaslt,77928,1.3179643630981446,torch.float8_e4m3fnuz,torch.float16
57344,118,8192,hipblaslt,77532,0.18808460235595703,torch.float8_e4m3fnuz,torch.float16
8192,973,28672,hipblaslt,42477,0.5103994846343994,torch.float8_e4m3fnuz,torch.float16
57344,484,8192,hipblaslt,78012,0.5011302947998046,torch.float8_e4m3fnuz,torch.float16
57344,5173,8192,hipblaslt,77945,4.650571060180664,torch.float8_e4m3fnuz,torch.float16
8192,4394,8192,hipblaslt,77941,0.5538644790649414,torch.float8_e4m3fnuz,torch.float16
10240,673,8192,hipblaslt,77871,0.14469834566116332,torch.float8_e4m3fnuz,torch.float16
8192,5257,28672,hipblaslt,77719,2.2659425735473633,torch.float8_e4m3fnuz,torch.float16
8192,2753,28672,hipblaslt,77928,1.3123900413513183,torch.float8_e4m3fnuz,torch.float16
8192,4474,28672,hipblaslt,77696,1.9893207550048828,torch.float8_e4m3fnuz,torch.float16
57344,4094,8192,hipblaslt,78012,3.619779586791992,torch.float8_e4m3fnuz,torch.float16
10240,324,8192,hipblaslt,76973,0.0814005970954895,torch.float8_e4m3fnuz,torch.float16
57344,201,8192,hipblaslt,77455,0.2542120933532715,torch.float8_e4m3fnuz,torch.float16
8192,1460,28672,hipblaslt,77928,0.6731751918792724,torch.float8_e4m3fnuz,torch.float16
8192,1838,28672,hipblaslt,77923,0.8699305534362793,torch.float8_e4m3fnuz,torch.float16
10240,4061,8192,hipblaslt,77496,0.6363626480102539,torch.float8_e4m3fnuz,torch.float16
57344,1120,8192,hipblaslt,77928,1.0141001701354981,torch.float8_e4m3fnuz,torch.float16
8192,7976,8192,hipblaslt,77924,0.937592887878418,torch.float8_e4m3fnuz,torch.float16
8192,6267,28672,hipblaslt,77924,2.6743915557861326,torch.float8_e4m3fnuz,torch.float16
10240,2354,8192,hipblaslt,77723,0.37134010791778566,torch.float8_e4m3fnuz,torch.float16
8192,1437,8192,hipblaslt,77976,0.1924991488456726,torch.float8_e4m3fnuz,torch.float16
10240,1465,8192,hipblaslt,77923,0.25597519874572755,torch.float8_e4m3fnuz,torch.float16
8192,4661,8192,hipblaslt,77593,0.6007919788360596,torch.float8_e4m3fnuz,torch.float16
57344,198,8192,hipblaslt,77455,0.24393634796142577,torch.float8_e4m3fnuz,torch.float16
8192,2455,8192,hipblaslt,77396,0.3223414897918701,torch.float8_e4m3fnuz,torch.float16
8192,5451,8192,hipblaslt,77396,0.6773834228515625,torch.float8_e4m3fnuz,torch.float16
8192,5290,8192,hipblaslt,77942,0.6330657482147217,torch.float8_e4m3fnuz,torch.float16
57344,99,28672,hipblaslt,77804,0.6102840423583984,torch.float8_e4m3fnuz,torch.float16
8192,6055,8192,hipblaslt,77916,0.7420712947845459,torch.float8_e4m3fnuz,torch.float16
8192,4267,28672,hipblaslt,77696,1.9920028686523437,torch.float8_e4m3fnuz,torch.float16
57344,4304,8192,hipblaslt,77952,3.870128631591797,torch.float8_e4m3fnuz,torch.float16
57344,1976,8192,hipblaslt,77939,1.803080940246582,torch.float8_e4m3fnuz,torch.float16
10240,3113,8192,hipblaslt,77924,0.477925968170166,torch.float8_e4m3fnuz,torch.float16
8192,2757,28672,hipblaslt,77895,1.3132933616638183,torch.float8_e4m3fnuz,torch.float16
10240,2424,8192,hipblaslt,77895,0.3951828956604004,torch.float8_e4m3fnuz,torch.float16
10240,2253,8192,hipblaslt,77723,0.3652811527252197,torch.float8_e4m3fnuz,torch.float16
8192,4757,28672,hipblaslt,77952,2.2237741470336916,torch.float8_e4m3fnuz,torch.float16
8192,3186,8192,hipblaslt,77984,0.4065803050994873,torch.float8_e4m3fnuz,torch.float16
10240,1419,8192,hipblaslt,77926,0.251103949546814,torch.float8_e4m3fnuz,torch.float16
8192,3662,8192,hipblaslt,77921,0.4652371883392334,torch.float8_e4m3fnuz,torch.float16
10240,4777,8192,hipblaslt,77924,0.7353232383728028,torch.float8_e4m3fnuz,torch.float16
10240,4315,8192,hipblaslt,77829,0.6846241474151611,torch.float8_e4m3fnuz,torch.float16
8192,1628,28672,hipblaslt,77950,0.7403467178344727,torch.float8_e4m3fnuz,torch.float16
8192,1931,8192,hipblaslt,77923,0.25207340717315674,torch.float8_e4m3fnuz,torch.float16
10240,2523,8192,hipblaslt,77496,0.4129617691040039,torch.float8_e4m3fnuz,torch.float16
8192,6729,28672,hipblaslt,77719,3.002615737915039,torch.float8_e4m3fnuz,torch.float16
57344,4160,8192,hipblaslt,77880,3.687778854370117,torch.float8_e4m3fnuz,torch.float16
8192,65309,8192,hipblaslt,77922,7.546952565511067,torch.float8_e4m3fnuz,torch.float16
10240,6894,8192,hipblaslt,77890,1.037557029724121,torch.float8_e4m3fnuz,torch.float16
8192,4014,28672,hipblaslt,77924,1.7810123443603516,torch.float8_e4m3fnuz,torch.float16
8192,3406,28672,hipblaslt,77942,1.5252874374389649,torch.float8_e4m3fnuz,torch.float16
10240,2533,8192,hipblaslt,77984,0.4130599021911621,torch.float8_e4m3fnuz,torch.float16
10240,1023,8192,hipblaslt,77428,0.188589346408844,torch.float8_e4m3fnuz,torch.float16
10240,247,8192,hipblaslt,76783,0.06971629858016967,torch.float8_e4m3fnuz,torch.float16
57344,5634,8192,hipblaslt,77935,5.1502332185444075,torch.float8_e4m3fnuz,torch.float16
8192,2878,8192,hipblaslt,77929,0.3665770530700684,torch.float8_e4m3fnuz,torch.float16
8192,2030,8192,hipblaslt,77768,0.2772456884384155,torch.float8_e4m3fnuz,torch.float16
8192,2605,8192,hipblaslt,77937,0.3457000970840454,torch.float8_e4m3fnuz,torch.float16
10240,2595,8192,hipblaslt,77984,0.41635475158691404,torch.float8_e4m3fnuz,torch.float16
8192,452,28672,hipblaslt,42415,0.2956079006195068,torch.float8_e4m3fnuz,torch.float16
8192,1849,28672,hipblaslt,77922,0.8760617256164551,torch.float8_e4m3fnuz,torch.float16
8192,5340,8192,hipblaslt,78016,0.6415463447570801,torch.float8_e4m3fnuz,torch.float16
8192,4914,8192,hipblaslt,77877,0.6148707866668701,torch.float8_e4m3fnuz,torch.float16
10240,6482,8192,hipblaslt,77924,0.9577507972717285,torch.float8_e4m3fnuz,torch.float16
10240,2426,8192,hipblaslt,77938,0.40099806785583497,torch.float8_e4m3fnuz,torch.float16
8192,4814,8192,hipblaslt,77496,0.6073256492614746,torch.float8_e4m3fnuz,torch.float16
8192,6411,28672,hipblaslt,77719,2.980705451965332,torch.float8_e4m3fnuz,torch.float16
8192,5215,8192,hipblaslt,77903,0.628695297241211,torch.float8_e4m3fnuz,torch.float16
8192,1020,8192,hipblaslt,77388,0.14380300045013428,torch.float8_e4m3fnuz,torch.float16
8192,3597,28672,hipblaslt,77903,1.5637084007263184,torch.float8_e4m3fnuz,torch.float16
10240,4116,8192,hipblaslt,77920,0.6452117443084717,torch.float8_e4m3fnuz,torch.float16
10240,3764,8192,hipblaslt,77935,0.6121387481689453,torch.float8_e4m3fnuz,torch.float16
10240,221,8192,hipblaslt,76783,0.06902425289154053,torch.float8_e4m3fnuz,torch.float16
8192,1778,28672,hipblaslt,77950,0.7646046638488769,torch.float8_e4m3fnuz,torch.float16
8192,5763,8192,hipblaslt,77924,0.7035361766815186,torch.float8_e4m3fnuz,torch.float16
8192,24992,8192,hipblaslt,77922,2.9062551498413085,torch.float8_e4m3fnuz,torch.float16
8192,6428,8192,hipblaslt,77984,0.8009324073791504,torch.float8_e4m3fnuz,torch.float16
8192,817,8192,hipblaslt,77404,0.13448524475097656,torch.float8_e4m3fnuz,torch.float16
57344,7069,8192,hipblaslt,77913,6.3219757080078125,torch.float8_e4m3fnuz,torch.float16
57344,402,8192,hipblaslt,77967,0.43386268615722656,torch.float8_e4m3fnuz,torch.float16
10240,406,8192,hipblaslt,77400,0.10583275556564331,torch.float8_e4m3fnuz,torch.float16
10240,71,8192,hipblaslt,77858,0.0454367995262146,torch.float8_e4m3fnuz,torch.float16
10240,584,8192,hipblaslt,77869,0.13137259483337402,torch.float8_e4m3fnuz,torch.float16
10240,4160,8192,hipblaslt,77984,0.6375604629516601,torch.float8_e4m3fnuz,torch.float16
8192,1750,8192,hipblaslt,77897,0.24541354179382324,torch.float8_e4m3fnuz,torch.float16
10240,3362,8192,hipblaslt,77885,0.5361762523651123,torch.float8_e4m3fnuz,torch.float16
10240,2219,8192,hipblaslt,77916,0.36419150829315183,torch.float8_e4m3fnuz,torch.float16
8192,1692,8192,hipblaslt,77913,0.21594789028167724,torch.float8_e4m3fnuz,torch.float16
8192,1766,28672,hipblaslt,77950,0.7675650119781494,torch.float8_e4m3fnuz,torch.float16
8192,4431,28672,hipblaslt,77696,1.9813589096069335,torch.float8_e4m3fnuz,torch.float16
10240,719,8192,hipblaslt,77871,0.14622459411621094,torch.float8_e4m3fnuz,torch.float16
8192,2454,28672,hipblaslt,77937,1.1974038124084472,torch.float8_e4m3fnuz,torch.float16
8192,858,28672,hipblaslt,77725,0.4759651184082031,torch.float8_e4m3fnuz,torch.float16
8192,2009,28672,hipblaslt,77892,0.9023768424987793,torch.float8_e4m3fnuz,torch.float16
10240,1327,8192,hipblaslt,78018,0.21268105506896973,torch.float8_e4m3fnuz,torch.float16
8192,5671,8192,hipblaslt,77925,0.7042352199554444,torch.float8_e4m3fnuz,torch.float16
8192,4292,8192,hipblaslt,77916,0.5382954120635987,torch.float8_e4m3fnuz,torch.float16
10240,1302,8192,hipblaslt,77973,0.21151530742645264,torch.float8_e4m3fnuz,torch.float16
8192,1257,28672,hipblaslt,77917,0.6293737411499023,torch.float8_e4m3fnuz,torch.float16
8192,2749,8192,hipblaslt,77929,0.36262519359588624,torch.float8_e4m3fnuz,torch.float16
10240,1241,8192,hipblaslt,77720,0.20480334758758545,torch.float8_e4m3fnuz,torch.float16
57344,4104,8192,hipblaslt,77880,3.740179443359375,torch.float8_e4m3fnuz,torch.float16
8192,5216,28672,hipblaslt,77719,2.2774835586547852,torch.float8_e4m3fnuz,torch.float16
8192,5968,28672,hipblaslt,77924,2.652032470703125,torch.float8_e4m3fnuz,torch.float16
10240,3514,8192,hipblaslt,77495,0.5589439868927002,torch.float8_e4m3fnuz,torch.float16
10240,3802,8192,hipblaslt,77984,0.6043171882629395,torch.float8_e4m3fnuz,torch.float16
57344,378,8192,hipblaslt,77459,0.4128716468811035,torch.float8_e4m3fnuz,torch.float16
57344,4143,8192,hipblaslt,77880,3.6927703857421874,torch.float8_e4m3fnuz,torch.float16
8192,4308,28672,hipblaslt,77696,1.9681636810302734,torch.float8_e4m3fnuz,torch.float16
10240,966,8192,hipblaslt,77424,0.17977230548858641,torch.float8_e4m3fnuz,torch.float16
57344,2479,8192,hipblaslt,77935,2.2291961669921876,torch.float8_e4m3fnuz,torch.float16
8192,214,28672,hipblaslt,76824,0.16163140535354614,torch.float8_e4m3fnuz,torch.float16
8192,58,8192,hipblaslt,42500,0.033151599764823916,torch.float8_e4m3fnuz,torch.float16
8192,59555,28672,hipblaslt,77924,25.014863586425783,torch.float8_e4m3fnuz,torch.float16
57344,1470,8192,hipblaslt,77939,1.3280351638793946,torch.float8_e4m3fnuz,torch.float16
57344,6667,8192,hipblaslt,77880,5.892163276672363,torch.float8_e4m3fnuz,torch.float16
10240,554,8192,hipblaslt,77866,0.12020405530929565,torch.float8_e4m3fnuz,torch.float16
8192,3312,8192,hipblaslt,77901,0.4178910732269287,torch.float8_e4m3fnuz,torch.float16
10240,4451,8192,hipblaslt,77924,0.6981942653656006,torch.float8_e4m3fnuz,torch.float16
57344,1045,8192,hipblaslt,77926,1.0394417762756347,torch.float8_e4m3fnuz,torch.float16
10240,2938,8192,hipblaslt,77924,0.46375393867492676,torch.float8_e4m3fnuz,torch.float16
8192,6714,8192,hipblaslt,77888,0.8247737884521484,torch.float8_e4m3fnuz,torch.float16
8192,5575,8192,hipblaslt,77924,0.6983284473419189,torch.float8_e4m3fnuz,torch.float16
8192,4985,8192,hipblaslt,77496,0.6176609516143798,torch.float8_e4m3fnuz,torch.float16
10240,1454,8192,hipblaslt,77981,0.2586651086807251,torch.float8_e4m3fnuz,torch.float16
8192,1386,28672,hipblaslt,77961,0.6693319320678711,torch.float8_e4m3fnuz,torch.float16
57344,5683,8192,hipblaslt,77880,5.152909529836554,torch.float8_e4m3fnuz,torch.float16
10240,1743,8192,hipblaslt,77388,0.2977891445159912,torch.float8_e4m3fnuz,torch.float16
57344,3647,8192,hipblaslt,77935,3.234838104248047,torch.float8_e4m3fnuz,torch.float16
8192,2390,8192,hipblaslt,77882,0.3191447496414185,torch.float8_e4m3fnuz,torch.float16
8192,20,8192,hipblaslt,42488,0.029531750082969665,torch.float8_e4m3fnuz,torch.float16
57344,2374,8192,hipblaslt,77952,2.1996744155883787,torch.float8_e4m3fnuz,torch.float16
57344,4202,8192,hipblaslt,77880,3.748731231689453,torch.float8_e4m3fnuz,torch.float16
8192,1238,8192,hipblaslt,77941,0.17929359674453735,torch.float8_e4m3fnuz,torch.float16
8192,103,8192,hipblaslt,76626,0.04407930076122284,torch.float8_e4m3fnuz,torch.float16
57344,784,8192,hipblaslt,77956,0.796055269241333,torch.float8_e4m3fnuz,torch.float16
8192,2383,8192,hipblaslt,77912,0.31775469779968263,torch.float8_e4m3fnuz,torch.float16
57344,4076,8192,hipblaslt,78012,3.5325416564941405,torch.float8_e4m3fnuz,torch.float16
8192,2765,8192,hipblaslt,77960,0.36194214820861814,torch.float8_e4m3fnuz,torch.float16
8192,979,8192,hipblaslt,77388,0.14504485130310057,torch.float8_e4m3fnuz,torch.float16
8192,716,8192,hipblaslt,77493,0.12356305122375488,torch.float8_e4m3fnuz,torch.float16
8192,3001,8192,hipblaslt,77976,0.37611315250396726,torch.float8_e4m3fnuz,torch.float16
57344,1002,8192,hipblaslt,77939,0.9322090148925781,torch.float8_e4m3fnuz,torch.float16
57344,49435,8192,hipblaslt,77880,42.49482116699219,torch.float8_e4m3fnuz,torch.float16
57344,1637,8192,hipblaslt,77939,1.5271422386169433,torch.float8_e4m3fnuz,torch.float16
10240,4702,8192,hipblaslt,77924,0.7181158065795898,torch.float8_e4m3fnuz,torch.float16
8192,2567,8192,hipblaslt,77829,0.3331054449081421,torch.float8_e4m3fnuz,torch.float16
57344,6661,8192,hipblaslt,77880,5.895461082458496,torch.float8_e4m3fnuz,torch.float16
8192,2583,8192,hipblaslt,77829,0.336143946647644,torch.float8_e4m3fnuz,torch.float16
8192,5971,8192,hipblaslt,77924,0.7188708305358886,torch.float8_e4m3fnuz,torch.float16
57344,6285,8192,hipblaslt,77945,5.699734856100643,torch.float8_e4m3fnuz,torch.float16
10240,2198,8192,hipblaslt,77916,0.3590919017791748,torch.float8_e4m3fnuz,torch.float16
10240,1768,8192,hipblaslt,77828,0.2971381902694702,torch.float8_e4m3fnuz,torch.float16
57344,4775,8192,hipblaslt,77903,4.335824966430664,torch.float8_e4m3fnuz,torch.float16
57344,1848,8192,hipblaslt,77913,1.7467016220092773,torch.float8_e4m3fnuz,torch.float16
8192,3889,28672,hipblaslt,77925,1.7781240463256835,torch.float8_e4m3fnuz,torch.float16
57344,4673,8192,hipblaslt,77925,4.2060707092285154,torch.float8_e4m3fnuz,torch.float16
8192,2545,28672,hipblaslt,77769,1.2214213371276856,torch.float8_e4m3fnuz,torch.float16
10240,1094,8192,hipblaslt,77505,0.1930279016494751,torch.float8_e4m3fnuz,torch.float16
57344,1254,8192,hipblaslt,77939,1.138540554046631,torch.float8_e4m3fnuz,torch.float16
10240,316,8192,hipblaslt,76973,0.0835342526435852,torch.float8_e4m3fnuz,torch.float16
10240,21,8192,hipblaslt,76556,0.03395980000495911,torch.float8_e4m3fnuz,torch.float16
57344,4412,8192,hipblaslt,77920,3.927301788330078,torch.float8_e4m3fnuz,torch.float16
8192,992,28672,hipblaslt,77830,0.5234814643859863,torch.float8_e4m3fnuz,torch.float16
57344,1539,8192,hipblaslt,77917,1.4364057540893556,torch.float8_e4m3fnuz,torch.float16
8192,1226,8192,hipblaslt,77873,0.17844229936599731,torch.float8_e4m3fnuz,torch.float16
57344,764,8192,hipblaslt,77903,0.7067169189453125,torch.float8_e4m3fnuz,torch.float16
8192,4879,8192,hipblaslt,77496,0.6103621482849121,torch.float8_e4m3fnuz,torch.float16
8192,5664,28672,hipblaslt,77924,2.6266483306884765,torch.float8_e4m3fnuz,torch.float16
8192,3097,28672,hipblaslt,77928,1.3900250434875487,torch.float8_e4m3fnuz,torch.float16
8192,2475,8192,hipblaslt,77829,0.32674849033355713,torch.float8_e4m3fnuz,torch.float16
8192,1923,8192,hipblaslt,77926,0.2533613443374634,torch.float8_e4m3fnuz,torch.float16
8192,670,28672,hipblaslt,77866,0.40811657905578613,torch.float8_e4m3fnuz,torch.float16
10240,4194,8192,hipblaslt,77935,0.6429123878479004,torch.float8_e4m3fnuz,torch.float16
8192,3180,8192,hipblaslt,77901,0.4051341533660889,torch.float8_e4m3fnuz,torch.float16
10240,7519,8192,hipblaslt,77924,1.1446876525878906,torch.float8_e4m3fnuz,torch.float16
10240,3910,8192,hipblaslt,77984,0.6210460186004638,torch.float8_e4m3fnuz,torch.float16
8192,1217,28672,hipblaslt,77917,0.6171141147613526,torch.float8_e4m3fnuz,torch.float16
8192,4616,8192,hipblaslt,77984,0.5991575717926025,torch.float8_e4m3fnuz,torch.float16
10240,556,8192,hipblaslt,77393,0.11966325044631958,torch.float8_e4m3fnuz,torch.float16
8192,221,8192,hipblaslt,77374,0.06326375007629395,torch.float8_e4m3fnuz,torch.float16
10240,4031,8192,hipblaslt,77888,0.6258130550384522,torch.float8_e4m3fnuz,torch.float16
8192,1030,28672,hipblaslt,77396,0.5591001987457276,torch.float8_e4m3fnuz,torch.float16
57344,1565,8192,hipblaslt,77938,1.4064393997192384,torch.float8_e4m3fnuz,torch.float16
57344,2328,8192,hipblaslt,77935,2.201811599731445,torch.float8_e4m3fnuz,torch.float16
8192,766,28672,hipblaslt,78005,0.4272789478302002,torch.float8_e4m3fnuz,torch.float16
8192,4204,8192,hipblaslt,77922,0.49685001373291016,torch.float8_e4m3fnuz,torch.float16
8192,3050,8192,hipblaslt,77895,0.3912075042724609,torch.float8_e4m3fnuz,torch.float16
57344,5893,8192,hipblaslt,78012,5.121070861816406,torch.float8_e4m3fnuz,torch.float16
10240,1271,8192,hipblaslt,77913,0.21352429389953614,torch.float8_e4m3fnuz,torch.float16
8192,6592,8192,hipblaslt,77903,0.8319804191589355,torch.float8_e4m3fnuz,torch.float16
10240,383,8192,hipblaslt,77391,0.09101085066795349,torch.float8_e4m3fnuz,torch.float16
8192,5257,8192,hipblaslt,77877,0.6403025150299072,torch.float8_e4m3fnuz,torch.float16
8192,53,28672,hipblaslt,76897,0.08350170254707337,torch.float8_e4m3fnuz,torch.float16
8192,8115,8192,hipblaslt,77924,0.9570978164672852,torch.float8_e4m3fnuz,torch.float16
8192,4052,8192,hipblaslt,77926,0.4943542957305908,torch.float8_e4m3fnuz,torch.float16
10240,2941,8192,hipblaslt,77924,0.47162666320800783,torch.float8_e4m3fnuz,torch.float16
57344,3480,8192,hipblaslt,77880,3.1485000610351563,torch.float8_e4m3fnuz,torch.float16
8192,901,8192,hipblaslt,77388,0.14513700008392333,torch.float8_e4m3fnuz,torch.float16
8192,4141,28672,hipblaslt,77924,1.7923751831054688,torch.float8_e4m3fnuz,torch.float16
57344,4157,8192,hipblaslt,77880,3.6668121337890627,torch.float8_e4m3fnuz,torch.float16
8192,4,8192,hipblaslt,77191,0.026994499564170837,torch.float8_e4m3fnuz,torch.float16
8192,985,8192,hipblaslt,77871,0.14661519527435302,torch.float8_e4m3fnuz,torch.float16
10240,108,8192,hipblaslt,77580,0.049407199025154114,torch.float8_e4m3fnuz,torch.float16
57344,6803,8192,hipblaslt,77880,6.022939682006836,torch.float8_e4m3fnuz,torch.float16
8192,2638,28672,hipblaslt,77688,1.252363109588623,torch.float8_e4m3fnuz,torch.float16
10240,1725,8192,hipblaslt,77828,0.2964871883392334,torch.float8_e4m3fnuz,torch.float16
8192,50712,28672,hipblaslt,77924,21.47064666748047,torch.float8_e4m3fnuz,torch.float16
8192,2747,28672,hipblaslt,77424,1.312083625793457,torch.float8_e4m3fnuz,torch.float16
10240,779,8192,hipblaslt,77396,0.15131814479827882,torch.float8_e4m3fnuz,torch.float16
8192,89,8192,hipblaslt,42510,0.039061900973320005,torch.float8_e4m3fnuz,torch.float16
10240,3996,8192,hipblaslt,77984,0.6248937129974366,torch.float8_e4m3fnuz,torch.float16
10240,4410,8192,hipblaslt,77924,0.698855209350586,torch.float8_e4m3fnuz,torch.float16
8192,2493,8192,hipblaslt,77396,0.3342010498046875,torch.float8_e4m3fnuz,torch.float16
8192,6876,28672,hipblaslt,77719,3.047977256774902,torch.float8_e4m3fnuz,torch.float16
10240,5616,8192,hipblaslt,77877,0.8490237236022949,torch.float8_e4m3fnuz,torch.float16
8192,1248,8192,hipblaslt,77723,0.1843951463699341,torch.float8_e4m3fnuz,torch.float16
8192,4212,28672,hipblaslt,77924,1.798642349243164,torch.float8_e4m3fnuz,torch.float16
10240,1802,8192,hipblaslt,77957,0.3174602508544922,torch.float8_e4m3fnuz,torch.float16
10240,7708,8192,hipblaslt,77921,1.1595457077026368,torch.float8_e4m3fnuz,torch.float16
8192,2999,28672,hipblaslt,77917,1.371291446685791,torch.float8_e4m3fnuz,torch.float16
57344,2685,8192,hipblaslt,77925,2.407830810546875,torch.float8_e4m3fnuz,torch.float16
8192,2846,28672,hipblaslt,77895,1.3208505630493164,torch.float8_e4m3fnuz,torch.float16
8192,5660,28672,hipblaslt,77924,2.629605293273926,torch.float8_e4m3fnuz,torch.float16
8192,613,8192,hipblaslt,77392,0.11137700080871582,torch.float8_e4m3fnuz,torch.float16
8192,6442,8192,hipblaslt,77984,0.8064386367797851,torch.float8_e4m3fnuz,torch.float16
8192,1317,28672,hipblaslt,77961,0.6272651672363281,torch.float8_e4m3fnuz,torch.float16
10240,4399,8192,hipblaslt,77981,0.7105936527252197,torch.float8_e4m3fnuz,torch.float16
57344,3163,8192,hipblaslt,77952,2.894365692138672,torch.float8_e4m3fnuz,torch.float16
8192,1173,28672,hipblaslt,77967,0.608230447769165,torch.float8_e4m3fnuz,torch.float16
8192,2460,28672,hipblaslt,77937,1.194996166229248,torch.float8_e4m3fnuz,torch.float16
8192,1837,28672,hipblaslt,77923,0.8729710578918457,torch.float8_e4m3fnuz,torch.float16
10240,1238,8192,hipblaslt,77890,0.20821244716644288,torch.float8_e4m3fnuz,torch.float16
57344,6521,8192,hipblaslt,77903,5.904937267303467,torch.float8_e4m3fnuz,torch.float16
57344,2777,8192,hipblaslt,77950,2.5435697555541994,torch.float8_e4m3fnuz,torch.float16
10240,3928,8192,hipblaslt,77935,0.6192052364349365,torch.float8_e4m3fnuz,torch.float16
57344,7139,8192,hipblaslt,77719,6.396237691243489,torch.float8_e4m3fnuz,torch.float16
10240,6394,8192,hipblaslt,77922,0.9515456199645996,torch.float8_e4m3fnuz,torch.float16
8192,1684,8192,hipblaslt,77913,0.21390485763549805,torch.float8_e4m3fnuz,torch.float16
57344,5807,8192,hipblaslt,77880,5.197504143965872,torch.float8_e4m3fnuz,torch.float16
57344,3158,8192,hipblaslt,77935,2.914046859741211,torch.float8_e4m3fnuz,torch.float16
8192,7520,8192,hipblaslt,77495,0.9103184700012207,torch.float8_e4m3fnuz,torch.float16
8192,1868,28672,hipblaslt,77921,0.886100959777832,torch.float8_e4m3fnuz,torch.float16
8192,975,8192,hipblaslt,77388,0.1513342022895813,torch.float8_e4m3fnuz,torch.float16
8192,992,8192,hipblaslt,77593,0.14556565284729003,torch.float8_e4m3fnuz,torch.float16
8192,6331,28672,hipblaslt,78018,2.9575952529907226,torch.float8_e4m3fnuz,torch.float16
57344,2351,8192,hipblaslt,77952,2.199726676940918,torch.float8_e4m3fnuz,torch.float16
8192,6158,8192,hipblaslt,77924,0.7455724716186524,torch.float8_e4m3fnuz,torch.float16
10240,2442,8192,hipblaslt,77984,0.4000185489654541,torch.float8_e4m3fnuz,torch.float16
10240,3589,8192,hipblaslt,77984,0.5859499931335449,torch.float8_e4m3fnuz,torch.float16
8192,3102,28672,hipblaslt,77967,1.378499984741211,torch.float8_e4m3fnuz,torch.float16
8192,2037,28672,hipblaslt,77881,0.9213128089904785,torch.float8_e4m3fnuz,torch.float16
8192,1572,8192,hipblaslt,77935,0.21166155338287354,torch.float8_e4m3fnuz,torch.float16
57344,1860,8192,hipblaslt,77913,1.774358367919922,torch.float8_e4m3fnuz,torch.float16
10240,1221,8192,hipblaslt,77890,0.20642530918121338,torch.float8_e4m3fnuz,torch.float16
8192,6242,28672,hipblaslt,77924,2.677824783325195,torch.float8_e4m3fnuz,torch.float16
8192,3585,28672,hipblaslt,77903,1.567043399810791,torch.float8_e4m3fnuz,torch.float16
8192,930,28672,hipblaslt,77830,0.5110270500183105,torch.float8_e4m3fnuz,torch.float16
57344,6896,8192,hipblaslt,77880,6.048755391438802,torch.float8_e4m3fnuz,torch.float16
57344,142,8192,hipblaslt,77870,0.2024940013885498,torch.float8_e4m3fnuz,torch.float16
8192,2490,8192,hipblaslt,77829,0.32639350891113283,torch.float8_e4m3fnuz,torch.float16
57344,3896,8192,hipblaslt,78012,3.485995864868164,torch.float8_e4m3fnuz,torch.float16
10240,4378,8192,hipblaslt,77924,0.6976214408874511,torch.float8_e4m3fnuz,torch.float16
57344,4116,8192,hipblaslt,77880,3.659032440185547,torch.float8_e4m3fnuz,torch.float16
8192,747,28672,hipblaslt,77866,0.41045551300048827,torch.float8_e4m3fnuz,torch.float16
8192,65112,8192,hipblaslt,77924,7.5102189381917315,torch.float8_e4m3fnuz,torch.float16
8192,2745,28672,hipblaslt,77928,1.3146574020385742,torch.float8_e4m3fnuz,torch.float16
10240,858,8192,hipblaslt,77836,0.16088629961013795,torch.float8_e4m3fnuz,torch.float16
57344,366,8192,hipblaslt,77937,0.40497989654541017,torch.float8_e4m3fnuz,torch.float16
57344,2800,8192,hipblaslt,77950,2.533194351196289,torch.float8_e4m3fnuz,torch.float16
57344,2468,8192,hipblaslt,77920,2.2156702041625977,torch.float8_e4m3fnuz,torch.float16
57344,5743,8192,hipblaslt,77935,5.136237250434028,torch.float8_e4m3fnuz,torch.float16
8192,5295,28672,hipblaslt,77719,2.2823429107666016,torch.float8_e4m3fnuz,torch.float16
10240,3813,8192,hipblaslt,77888,0.6073917388916016,torch.float8_e4m3fnuz,torch.float16
8192,1833,28672,hipblaslt,77921,0.8630789756774903,torch.float8_e4m3fnuz,torch.float16
10240,2456,8192,hipblaslt,77967,0.3992434024810791,torch.float8_e4m3fnuz,torch.float16
10240,2200,8192,hipblaslt,77886,0.36148149967193605,torch.float8_e4m3fnuz,torch.float16
8192,2351,8192,hipblaslt,77915,0.31733510494232176,torch.float8_e4m3fnuz,torch.float16
10240,3462,8192,hipblaslt,77495,0.5495120525360108,torch.float8_e4m3fnuz,torch.float16
57344,5286,8192,hipblaslt,77880,4.742176818847656,torch.float8_e4m3fnuz,torch.float16
8192,5678,28672,hipblaslt,77924,2.6307931900024415,torch.float8_e4m3fnuz,torch.float16
8192,3529,28672,hipblaslt,77935,1.5564016342163085,torch.float8_e4m3fnuz,torch.float16
57344,843,8192,hipblaslt,77926,0.8117364883422852,torch.float8_e4m3fnuz,torch.float16
10240,1771,8192,hipblaslt,77593,0.2946885585784912,torch.float8_e4m3fnuz,torch.float16
57344,331,8192,hipblaslt,77937,0.3950251579284668,torch.float8_e4m3fnuz,torch.float16
57344,1149,8192,hipblaslt,77935,1.0814020156860351,torch.float8_e4m3fnuz,torch.float16
57344,5292,8192,hipblaslt,77719,4.70667839050293,torch.float8_e4m3fnuz,torch.float16
10240,3785,8192,hipblaslt,77935,0.6059356212615967,torch.float8_e4m3fnuz,torch.float16
10240,103,8192,hipblaslt,77377,0.052347499132156375,torch.float8_e4m3fnuz,torch.float16
8192,6287,28672,hipblaslt,77952,2.9390596389770507,torch.float8_e4m3fnuz,torch.float16
57344,2629,8192,hipblaslt,77925,2.3866094589233398,torch.float8_e4m3fnuz,torch.float16
8192,236,28672,hipblaslt,77198,0.1676243543624878,torch.float8_e4m3fnuz,torch.float16
57344,345,8192,hipblaslt,77991,0.4041446685791016,torch.float8_e4m3fnuz,torch.float16
57344,5003,8192,hipblaslt,77925,4.487962341308593,torch.float8_e4m3fnuz,torch.float16
8192,5237,8192,hipblaslt,77942,0.634387731552124,torch.float8_e4m3fnuz,torch.float16
8192,3709,8192,hipblaslt,77922,0.470338773727417,torch.float8_e4m3fnuz,torch.float16
8192,650,28672,hipblaslt,77186,0.40154685974121096,torch.float8_e4m3fnuz,torch.float16
8192,847,8192,hipblaslt,77399,0.13899190425872804,torch.float8_e4m3fnuz,torch.float16
8192,5386,8192,hipblaslt,77829,0.6735257625579834,torch.float8_e4m3fnuz,torch.float16
8192,3640,8192,hipblaslt,77984,0.4339989185333252,torch.float8_e4m3fnuz,torch.float16
57344,95,8192,hipblaslt,77989,0.16798335313796997,torch.float8_e4m3fnuz,torch.float16
57344,5860,8192,hipblaslt,77920,5.258002387152778,torch.float8_e4m3fnuz,torch.float16
8192,814,28672,hipblaslt,77399,0.46169195175170896,torch.float8_e4m3fnuz,torch.float16
10240,652,8192,hipblaslt,77869,0.13038614988327027,torch.float8_e4m3fnuz,torch.float16
8192,2346,8192,hipblaslt,77882,0.31332414150238036,torch.float8_e4m3fnuz,torch.float16
8192,1971,8192,hipblaslt,77925,0.2605940103530884,torch.float8_e4m3fnuz,torch.float16
57344,3149,8192,hipblaslt,77952,2.9308355331420897,torch.float8_e4m3fnuz,torch.float16
8192,3841,8192,hipblaslt,77921,0.48032755851745607,torch.float8_e4m3fnuz,torch.float16
57344,3506,8192,hipblaslt,77925,3.143410491943359,torch.float8_e4m3fnuz,torch.float16
8192,4787,8192,hipblaslt,77890,0.6052205562591553,torch.float8_e4m3fnuz,torch.float16
8192,4256,28672,hipblaslt,77924,1.7971242904663085,torch.float8_e4m3fnuz,torch.float16
8192,3204,8192,hipblaslt,77720,0.4110709190368652,torch.float8_e4m3fnuz,torch.float16
8192,60101,8192,hipblaslt,77924,6.930915287562779,torch.float8_e4m3fnuz,torch.float16
8192,1342,8192,hipblaslt,77694,0.19191629886627198,torch.float8_e4m3fnuz,torch.float16
10240,3146,8192,hipblaslt,77981,0.5015289306640625,torch.float8_e4m3fnuz,torch.float16
57344,63512,8192,hipblaslt,77880,55.139990234375,torch.float8_e4m3fnuz,torch.float16
10240,1169,8192,hipblaslt,77720,0.2038559913635254,torch.float8_e4m3fnuz,torch.float16
10240,1848,8192,hipblaslt,77912,0.3162484407424927,torch.float8_e4m3fnuz,torch.float16
8192,2917,28672,hipblaslt,77895,1.3345128059387208,torch.float8_e4m3fnuz,torch.float16
8192,4955,8192,hipblaslt,77903,0.6118123054504394,torch.float8_e4m3fnuz,torch.float16
8192,1701,28672,hipblaslt,77877,0.750007438659668,torch.float8_e4m3fnuz,torch.float16
57344,606,8192,hipblaslt,77938,0.621510648727417,torch.float8_e4m3fnuz,torch.float16
8192,2820,28672,hipblaslt,77895,1.3176097869873047,torch.float8_e4m3fnuz,torch.float16
10240,2678,8192,hipblaslt,77496,0.4164769649505615,torch.float8_e4m3fnuz,torch.float16
8192,4192,28672,hipblaslt,77924,1.7897911071777344,torch.float8_e4m3fnuz,torch.float16
8192,2477,8192,hipblaslt,77829,0.3219259023666382,torch.float8_e4m3fnuz,torch.float16
10240,1966,8192,hipblaslt,77829,0.3341229438781738,torch.float8_e4m3fnuz,torch.float16
8192,7298,8192,hipblaslt,77885,0.8975315093994141,torch.float8_e4m3fnuz,torch.float16
8192,2480,8192,hipblaslt,77829,0.3267500400543213,torch.float8_e4m3fnuz,torch.float16
57344,31,8192,hipblaslt,77996,0.13899284601211548,torch.float8_e4m3fnuz,torch.float16
8192,2706,28672,hipblaslt,77895,1.2952906608581543,torch.float8_e4m3fnuz,torch.float16
8192,715,8192,hipblaslt,77393,0.12133574485778809,torch.float8_e4m3fnuz,torch.float16
8192,4924,8192,hipblaslt,77973,0.6112534999847412,torch.float8_e4m3fnuz,torch.float16
57344,1262,8192,hipblaslt,77939,1.1228233337402345,torch.float8_e4m3fnuz,torch.float16
8192,2147,28672,hipblaslt,77927,1.070079231262207,torch.float8_e4m3fnuz,torch.float16
8192,1450,8192,hipblaslt,77917,0.19550559520721436,torch.float8_e4m3fnuz,torch.float16
8192,1502,28672,hipblaslt,77895,0.6867433071136475,torch.float8_e4m3fnuz,torch.float16
57344,1897,8192,hipblaslt,77952,1.7305295944213868,torch.float8_e4m3fnuz,torch.float16
10240,4371,8192,hipblaslt,77925,0.6969509601593018,torch.float8_e4m3fnuz,torch.float16
10240,637,8192,hipblaslt,77603,0.13390434980392457,torch.float8_e4m3fnuz,torch.float16
10240,6549,8192,hipblaslt,77922,0.957680606842041,torch.float8_e4m3fnuz,torch.float16
57344,3147,8192,hipblaslt,77920,2.9480869293212892,torch.float8_e4m3fnuz,torch.float16
57344,4256,8192,hipblaslt,77880,3.7753326416015627,torch.float8_e4m3fnuz,torch.float16
10240,62355,8192,hipblaslt,77923,9.210870361328125,torch.float8_e4m3fnuz,torch.float16
57344,2291,8192,hipblaslt,77950,2.077397346496582,torch.float8_e4m3fnuz,torch.float16
57344,1810,8192,hipblaslt,77952,1.7602113723754882,torch.float8_e4m3fnuz,torch.float16
57344,63675,8192,hipblaslt,77880,56.309912109375,torch.float8_e4m3fnuz,torch.float16
8192,1486,28672,hipblaslt,77961,0.6955802917480469,torch.float8_e4m3fnuz,torch.float16
8192,4718,28672,hipblaslt,77903,2.2526128768920897,torch.float8_e4m3fnuz,torch.float16
10240,3896,8192,hipblaslt,77935,0.6328794956207275,torch.float8_e4m3fnuz,torch.float16
8192,3412,28672,hipblaslt,77942,1.5423748016357421,torch.float8_e4m3fnuz,torch.float16
57344,1725,8192,hipblaslt,77925,1.5756780624389648,torch.float8_e4m3fnuz,torch.float16
10240,6593,8192,hipblaslt,77921,0.979428768157959,torch.float8_e4m3fnuz,torch.float16
8192,4886,28672,hipblaslt,77935,2.2776420593261717,torch.float8_e4m3fnuz,torch.float16
8192,4021,28672,hipblaslt,77924,1.7869190216064452,torch.float8_e4m3fnuz,torch.float16
10240,336,8192,hipblaslt,42514,0.09014754891395568,torch.float8_e4m3fnuz,torch.float16
8192,70,28672,hipblaslt,76801,0.09178594946861267,torch.float8_e4m3fnuz,torch.float16
8192,532,28672,hipblaslt,76918,0.34060800075531006,torch.float8_e4m3fnuz,torch.float16
57344,2254,8192,hipblaslt,77950,2.0879610061645506,torch.float8_e4m3fnuz,torch.float16
8192,2475,28672,hipblaslt,77937,1.2124039649963378,torch.float8_e4m3fnuz,torch.float16
8192,2373,28672,hipblaslt,77937,1.2029780387878417,torch.float8_e4m3fnuz,torch.float16
8192,5600,28672,hipblaslt,77755,2.615167999267578,torch.float8_e4m3fnuz,torch.float16
57344,1700,8192,hipblaslt,77952,1.5804471969604492,torch.float8_e4m3fnuz,torch.float16
8192,2431,8192,hipblaslt,77882,0.3301891088485718,torch.float8_e4m3fnuz,torch.float16
8192,2659,8192,hipblaslt,77586,0.3587094068527222,torch.float8_e4m3fnuz,torch.float16
57344,1734,8192,hipblaslt,77925,1.5833233833312987,torch.float8_e4m3fnuz,torch.float16
57344,1858,8192,hipblaslt,77945,1.7791093826293944,torch.float8_e4m3fnuz,torch.float16
10240,48,8192,hipblaslt,76622,0.039184048771858215,torch.float8_e4m3fnuz,torch.float16
57344,824,8192,hipblaslt,77926,0.8187168121337891,torch.float8_e4m3fnuz,torch.float16
10240,6268,8192,hipblaslt,77922,0.949120044708252,torch.float8_e4m3fnuz,torch.float16
8192,4762,28672,hipblaslt,77935,2.246135139465332,torch.float8_e4m3fnuz,torch.float16
57344,3949,8192,hipblaslt,78012,3.5392967224121095,torch.float8_e4m3fnuz,torch.float16
8192,3771,28672,hipblaslt,77924,1.7746097564697265,torch.float8_e4m3fnuz,torch.float16
57344,2189,8192,hipblaslt,77952,2.055901527404785,torch.float8_e4m3fnuz,torch.float16
10240,998,8192,hipblaslt,77743,0.19192030429840087,torch.float8_e4m3fnuz,torch.float16
10240,3533,8192,hipblaslt,77967,0.588677978515625,torch.float8_e4m3fnuz,torch.float16
57344,865,8192,hipblaslt,77926,0.8248939514160156,torch.float8_e4m3fnuz,torch.float16
8192,1625,8192,hipblaslt,78018,0.22096335887908936,torch.float8_e4m3fnuz,torch.float16
57344,1036,8192,hipblaslt,77938,1.019678497314453,torch.float8_e4m3fnuz,torch.float16
8192,663,8192,hipblaslt,77867,0.11879194974899292,torch.float8_e4m3fnuz,torch.float16
10240,2171,8192,hipblaslt,77960,0.3679510593414307,torch.float8_e4m3fnuz,torch.float16
57344,4201,8192,hipblaslt,77880,3.798745346069336,torch.float8_e4m3fnuz,torch.float16
10240,4945,8192,hipblaslt,77890,0.8138375282287598,torch.float8_e4m3fnuz,torch.float16
10240,2468,8192,hipblaslt,77877,0.4116838455200195,torch.float8_e4m3fnuz,torch.float16
8192,2183,8192,hipblaslt,77828,0.3048234939575195,torch.float8_e4m3fnuz,torch.float16
8192,547,8192,hipblaslt,77392,0.10932589769363403,torch.float8_e4m3fnuz,torch.float16
8192,2993,28672,hipblaslt,77895,1.3972698211669923,torch.float8_e4m3fnuz,torch.float16
57344,7792,8192,hipblaslt,77926,7.095208388108474,torch.float8_e4m3fnuz,torch.float16
10240,3083,8192,hipblaslt,77981,0.49107346534729,torch.float8_e4m3fnuz,torch.float16
8192,423,8192,hipblaslt,77592,0.08425279855728149,torch.float8_e4m3fnuz,torch.float16
8192,365,8192,hipblaslt,77376,0.07644875049591064,torch.float8_e4m3fnuz,torch.float16
10240,3097,8192,hipblaslt,77981,0.49353508949279784,torch.float8_e4m3fnuz,torch.float16
8192,4763,28672,hipblaslt,77952,2.248311424255371,torch.float8_e4m3fnuz,torch.float16
8192,1969,28672,hipblaslt,77922,0.8989295959472656,torch.float8_e4m3fnuz,torch.float16
8192,20,28672,hipblaslt,77184,0.07346680164337158,torch.float8_e4m3fnuz,torch.float16
10240,5941,8192,hipblaslt,77924,0.9209081649780273,torch.float8_e4m3fnuz,torch.float16
10240,2235,8192,hipblaslt,77976,0.37370359897613525,torch.float8_e4m3fnuz,torch.float16
8192,3665,28672,hipblaslt,77924,1.76256103515625,torch.float8_e4m3fnuz,torch.float16
8192,1327,8192,hipblaslt,77455,0.19784510135650635,torch.float8_e4m3fnuz,torch.float16
8192,3136,8192,hipblaslt,77967,0.40006060600280763,torch.float8_e4m3fnuz,torch.float16
8192,842,8192,hipblaslt,77869,0.138827645778656,torch.float8_e4m3fnuz,torch.float16
57344,1322,8192,hipblaslt,77938,1.236563777923584,torch.float8_e4m3fnuz,torch.float16
10240,234,28672,hipblaslt,77178,0.20674026012420654,torch.float8_e4m3fnuz,torch.float16
8192,638,28672,hipblaslt,76890,0.3693972110748291,torch.float8_e4m3fnuz,torch.float16
10240,5418,8192,hipblaslt,77890,0.845115852355957,torch.float8_e4m3fnuz,torch.float16
10240,4986,8192,hipblaslt,77888,0.8075101852416993,torch.float8_e4m3fnuz,torch.float16
8192,5037,28672,hipblaslt,78012,2.250932312011719,torch.float8_e4m3fnuz,torch.float16
8192,3367,8192,hipblaslt,77903,0.4305858612060547,torch.float8_e4m3fnuz,torch.float16
10240,2306,8192,hipblaslt,77960,0.38150315284729003,torch.float8_e4m3fnuz,torch.float16
8192,1233,28672,hipblaslt,77917,0.6387822151184082,torch.float8_e4m3fnuz,torch.float16
10240,1394,8192,hipblaslt,77944,0.2572801113128662,torch.float8_e4m3fnuz,torch.float16
57344,3406,8192,hipblaslt,77952,3.1621402740478515,torch.float8_e4m3fnuz,torch.float16
57344,1151,8192,hipblaslt,77935,1.1132010459899901,torch.float8_e4m3fnuz,torch.float16
57344,4877,8192,hipblaslt,77880,4.417073059082031,torch.float8_e4m3fnuz,torch.float16
8192,7795,28672,hipblaslt,77925,3.5710758209228515,torch.float8_e4m3fnuz,torch.float16
8192,1558,28672,hipblaslt,77895,0.7180296421051026,torch.float8_e4m3fnuz,torch.float16
10240,1364,8192,hipblaslt,77978,0.2588028907775879,torch.float8_e4m3fnuz,torch.float16
8192,4807,8192,hipblaslt,77973,0.6190629482269288,torch.float8_e4m3fnuz,torch.float16
8192,6352,28672,hipblaslt,77935,3.006035041809082,torch.float8_e4m3fnuz,torch.float16
10240,6746,8192,hipblaslt,77903,1.052679443359375,torch.float8_e4m3fnuz,torch.float16
57344,1986,8192,hipblaslt,77880,1.847614860534668,torch.float8_e4m3fnuz,torch.float16
8192,838,8192,hipblaslt,77404,0.1382027506828308,torch.float8_e4m3fnuz,torch.float16
57344,1201,8192,hipblaslt,77950,1.1501136779785157,torch.float8_e4m3fnuz,torch.float16
10240,768,8192,hipblaslt,77359,0.14985400438308716,torch.float8_e4m3fnuz,torch.float16
8192,3747,8192,hipblaslt,77921,0.47765355110168456,torch.float8_e4m3fnuz,torch.float16
57344,1312,8192,hipblaslt,77895,1.2273039817810059,torch.float8_e4m3fnuz,torch.float16
10240,6261,8192,hipblaslt,77922,0.9516336441040039,torch.float8_e4m3fnuz,torch.float16
8192,65037,8192,hipblaslt,77922,7.648977915445964,torch.float8_e4m3fnuz,torch.float16
10240,4727,8192,hipblaslt,77924,0.7440762042999267,torch.float8_e4m3fnuz,torch.float16
8192,4127,8192,hipblaslt,77922,0.5050762176513672,torch.float8_e4m3fnuz,torch.float16
57344,5077,8192,hipblaslt,78012,4.578450393676758,torch.float8_e4m3fnuz,torch.float16
10240,1026,8192,hipblaslt,77723,0.19127130508422852,torch.float8_e4m3fnuz,torch.float16
10240,6140,8192,hipblaslt,77921,0.948789405822754,torch.float8_e4m3fnuz,torch.float16
57344,714,8192,hipblaslt,77901,0.7124233722686768,torch.float8_e4m3fnuz,torch.float16
8192,1221,28672,hipblaslt,77917,0.6310738086700439,torch.float8_e4m3fnuz,torch.float16
8192,3454,28672,hipblaslt,77903,1.5496915817260741,torch.float8_e4m3fnuz,torch.float16
8192,3854,28672,hipblaslt,77971,1.7768339157104491,torch.float8_e4m3fnuz,torch.float16
8192,3270,28672,hipblaslt,77950,1.5109222412109375,torch.float8_e4m3fnuz,torch.float16
8192,2864,28672,hipblaslt,77895,1.3466988563537599,torch.float8_e4m3fnuz,torch.float16
10240,416,8192,hipblaslt,77392,0.10541014671325684,torch.float8_e4m3fnuz,torch.float16
8192,796,8192,hipblaslt,77869,0.13401050567626954,torch.float8_e4m3fnuz,torch.float16
57344,3025,8192,hipblaslt,78017,2.746442413330078,torch.float8_e4m3fnuz,torch.float16
8192,248,8192,hipblaslt,77301,0.06252059936523438,torch.float8_e4m3fnuz,torch.float16
8192,6214,8192,hipblaslt,77924,0.7530274868011475,torch.float8_e4m3fnuz,torch.float16
10240,127,28672,hipblaslt,76877,0.13200055360794066,torch.float8_e4m3fnuz,torch.float16
57344,4424,8192,hipblaslt,78017,4.009036636352539,torch.float8_e4m3fnuz,torch.float16
8192,572,8192,hipblaslt,77406,0.10963239669799804,torch.float8_e4m3fnuz,torch.float16
10240,1056,8192,hipblaslt,77941,0.19549160003662108,torch.float8_e4m3fnuz,torch.float16
10240,4913,8192,hipblaslt,77922,0.7501451969146729,torch.float8_e4m3fnuz,torch.float16
8192,4671,8192,hipblaslt,77888,0.6126996040344238,torch.float8_e4m3fnuz,torch.float16
8192,580,8192,hipblaslt,77049,0.11128884553909302,torch.float8_e4m3fnuz,torch.float16
10240,65502,8192,hipblaslt,77926,9.82211685180664,torch.float8_e4m3fnuz,torch.float16
8192,6170,8192,hipblaslt,77924,0.7609471797943115,torch.float8_e4m3fnuz,torch.float16
8192,3534,28672,hipblaslt,77942,1.5791511535644531,torch.float8_e4m3fnuz,torch.float16
8192,3716,8192,hipblaslt,77897,0.4806981086730957,torch.float8_e4m3fnuz,torch.float16
10240,65262,8192,hipblaslt,77923,9.778511810302735,torch.float8_e4m3fnuz,torch.float16
8192,6666,28672,hipblaslt,77935,3.068037223815918,torch.float8_e4m3fnuz,torch.float16
8192,3404,8192,hipblaslt,77496,0.42881121635437014,torch.float8_e4m3fnuz,torch.float16
8192,2514,8192,hipblaslt,77829,0.34095909595489504,torch.float8_e4m3fnuz,torch.float16
10240,1754,8192,hipblaslt,77828,0.3024179935455322,torch.float8_e4m3fnuz,torch.float16
8192,518,8192,hipblaslt,77392,0.09978880286216736,torch.float8_e4m3fnuz,torch.float16
8192,4846,28672,hipblaslt,77888,2.2795787811279298,torch.float8_e4m3fnuz,torch.float16
57344,2160,8192,hipblaslt,77950,2.038906288146973,torch.float8_e4m3fnuz,torch.float16
10240,140,28672,hipblaslt,76878,0.1441219449043274,torch.float8_e4m3fnuz,torch.float16
10240,2494,8192,hipblaslt,77890,0.4095646858215332,torch.float8_e4m3fnuz,torch.float16
8192,1350,28672,hipblaslt,77961,0.6654317378997803,torch.float8_e4m3fnuz,torch.float16
57344,1568,8192,hipblaslt,77938,1.439101791381836,torch.float8_e4m3fnuz,torch.float16
8192,2418,8192,hipblaslt,77915,0.3247750997543335,torch.float8_e4m3fnuz,torch.float16
8192,4919,8192,hipblaslt,77496,0.6205071449279785,torch.float8_e4m3fnuz,torch.float16
10240,4833,8192,hipblaslt,77924,0.7481582641601563,torch.float8_e4m3fnuz,torch.float16
10240,1887,8192,hipblaslt,77722,0.3235212564468384,torch.float8_e4m3fnuz,torch.float16
8192,3509,8192,hipblaslt,78016,0.4394289493560791,torch.float8_e4m3fnuz,torch.float16
8192,4019,8192,hipblaslt,77922,0.4927078723907471,torch.float8_e4m3fnuz,torch.float16
10240,2293,8192,hipblaslt,77960,0.3763915538787842,torch.float8_e4m3fnuz,torch.float16
10240,2629,8192,hipblaslt,77984,0.4245889663696289,torch.float8_e4m3fnuz,torch.float16
8192,3150,28672,hipblaslt,77935,1.5067460060119628,torch.float8_e4m3fnuz,torch.float16
57344,811,8192,hipblaslt,77926,0.8146647453308106,torch.float8_e4m3fnuz,torch.float16
10240,2071,8192,hipblaslt,77937,0.35660223960876464,torch.float8_e4m3fnuz,torch.float16
8192,6238,28672,hipblaslt,77924,2.696602439880371,torch.float8_e4m3fnuz,torch.float16
8192,1829,28672,hipblaslt,77926,0.8870139122009277,torch.float8_e4m3fnuz,torch.float16
10240,2366,8192,hipblaslt,77723,0.38413500785827637,torch.float8_e4m3fnuz,torch.float16
10240,4000,8192,hipblaslt,77984,0.6369935989379882,torch.float8_e4m3fnuz,torch.float16
57344,897,8192,hipblaslt,77935,0.8997367858886719,torch.float8_e4m3fnuz,torch.float16
57344,7566,8192,hipblaslt,77719,6.8779127938406805,torch.float8_e4m3fnuz,torch.float16
10240,4461,8192,hipblaslt,77924,0.7107929229736328,torch.float8_e4m3fnuz,torch.float16
8192,1075,28672,hipblaslt,77936,0.551793384552002,torch.float8_e4m3fnuz,torch.float16
57344,1888,8192,hipblaslt,77952,1.7864461898803712,torch.float8_e4m3fnuz,torch.float16
8192,5807,8192,hipblaslt,77924,0.7193896293640136,torch.float8_e4m3fnuz,torch.float16
10240,175,8192,hipblaslt,77374,0.06407489776611328,torch.float8_e4m3fnuz,torch.float16
57344,8,8192,hipblaslt,77996,0.13291280269622802,torch.float8_e4m3fnuz,torch.float16
8192,474,8192,hipblaslt,76973,0.08465390205383301,torch.float8_e4m3fnuz,torch.float16
10240,5415,8192,hipblaslt,77496,0.8465339660644531,torch.float8_e4m3fnuz,torch.float16
8192,78,28672,hipblaslt,76803,0.09378340244293212,torch.float8_e4m3fnuz,torch.float16
57344,177,8192,hipblaslt,78018,0.24575600624084473,torch.float8_e4m3fnuz,torch.float16
10240,1715,8192,hipblaslt,77677,0.30668230056762696,torch.float8_e4m3fnuz,torch.float16
10240,6755,8192,hipblaslt,77973,1.0494806289672851,torch.float8_e4m3fnuz,torch.float16
8192,3921,8192,hipblaslt,77921,0.4908891677856445,torch.float8_e4m3fnuz,torch.float16
8192,39,28672,hipblaslt,77168,0.08272554874420165,torch.float8_e4m3fnuz,torch.float16
57344,4023,8192,hipblaslt,78012,3.5589679718017577,torch.float8_e4m3fnuz,torch.float16
57344,1664,8192,hipblaslt,77952,1.5628510475158692,torch.float8_e4m3fnuz,torch.float16
8192,340,28672,hipblaslt,76783,0.23570516109466552,torch.float8_e4m3fnuz,torch.float16
8192,131,28672,hipblaslt,76806,0.1214719533920288,torch.float8_e4m3fnuz,torch.float16
57344,7442,8192,hipblaslt,77942,6.807784489222935,torch.float8_e4m3fnuz,torch.float16
10240,2088,8192,hipblaslt,77937,0.3618299961090088,torch.float8_e4m3fnuz,torch.float16
10240,6827,8192,hipblaslt,77901,1.0540634155273438,torch.float8_e4m3fnuz,torch.float16
10240,1188,8192,hipblaslt,78016,0.2178267002105713,torch.float8_e4m3fnuz,torch.float16
57344,2123,8192,hipblaslt,77952,2.0263696670532227,torch.float8_e4m3fnuz,torch.float16
8192,2635,28672,hipblaslt,77937,1.2786459922790527,torch.float8_e4m3fnuz,torch.float16
57344,1622,8192,hipblaslt,77925,1.5612266540527344,torch.float8_e4m3fnuz,torch.float16
57344,5460,8192,hipblaslt,77880,4.945403651187294,torch.float8_e4m3fnuz,torch.float16
8192,6984,28672,hipblaslt,78012,3.094614028930664,torch.float8_e4m3fnuz,torch.float16
8192,975,28672,hipblaslt,42477,0.5305053234100342,torch.float8_e4m3fnuz,torch.float16
8192,5007,28672,hipblaslt,78012,2.262311553955078,torch.float8_e4m3fnuz,torch.float16
10240,1535,8192,hipblaslt,77924,0.25982890129089353,torch.float8_e4m3fnuz,torch.float16
57344,3680,8192,hipblaslt,77945,3.4594165802001955,torch.float8_e4m3fnuz,torch.float16
57344,4680,8192,hipblaslt,77880,4.290509414672852,torch.float8_e4m3fnuz,torch.float16
10240,8289,8192,hipblaslt,77923,1.249639129638672,torch.float8_e4m3fnuz,torch.float16
10240,272,8192,hipblaslt,77376,0.07513329982757569,torch.float8_e4m3fnuz,torch.float16
10240,3609,8192,hipblaslt,77942,0.6058474540710449,torch.float8_e4m3fnuz,torch.float16
57344,3220,8192,hipblaslt,77952,2.9682147979736326,torch.float8_e4m3fnuz,torch.float16
8192,4291,28672,hipblaslt,77696,1.9978673934936524,torch.float8_e4m3fnuz,torch.float16
8192,6181,28672,hipblaslt,77924,2.6867177963256834,torch.float8_e4m3fnuz,torch.float16
57344,317,8192,hipblaslt,77936,0.36294164657592776,torch.float8_e4m3fnuz,torch.float16
8192,65532,8192,hipblaslt,77921,7.699382146199544,torch.float8_e4m3fnuz,torch.float16
10240,65039,8192,hipblaslt,77923,9.726002502441407,torch.float8_e4m3fnuz,torch.float16
10240,1226,8192,hipblaslt,78016,0.21683719158172607,torch.float8_e4m3fnuz,torch.float16
8192,4603,8192,hipblaslt,77917,0.6140370845794678,torch.float8_e4m3fnuz,torch.float16
57344,4037,8192,hipblaslt,78012,3.586088180541992,torch.float8_e4m3fnuz,torch.float16
8192,2516,28672,hipblaslt,77769,1.2365216255187987,torch.float8_e4m3fnuz,torch.float16
57344,2807,8192,hipblaslt,77950,2.6254329681396484,torch.float8_e4m3fnuz,torch.float16
8192,7442,28672,hipblaslt,77895,3.4949630737304687,torch.float8_e4m3fnuz,torch.float16
8192,2849,28672,hipblaslt,77895,1.3504464149475097,torch.float8_e4m3fnuz,torch.float16
57344,700,8192,hipblaslt,78018,0.7041430473327637,torch.float8_e4m3fnuz,torch.float16
10240,1036,8192,hipblaslt,77723,0.18966494798660277,torch.float8_e4m3fnuz,torch.float16
8192,1220,8192,hipblaslt,77495,0.18249235153198243,torch.float8_e4m3fnuz,torch.float16
57344,4407,8192,hipblaslt,77920,4.009028625488281,torch.float8_e4m3fnuz,torch.float16
10240,3137,8192,hipblaslt,77924,0.5048813819885254,torch.float8_e4m3fnuz,torch.float16
57344,4484,8192,hipblaslt,78017,4.052937698364258,torch.float8_e4m3fnuz,torch.float16
8192,1617,28672,hipblaslt,77950,0.7599837779998779,torch.float8_e4m3fnuz,torch.float16
10240,1317,8192,hipblaslt,78018,0.21840949058532716,torch.float8_e4m3fnuz,torch.float16
8192,2673,28672,hipblaslt,77937,1.2785098075866699,torch.float8_e4m3fnuz,torch.float16
8192,7273,8192,hipblaslt,77903,0.8720817565917969,torch.float8_e4m3fnuz,torch.float16
57344,4516,8192,hipblaslt,78017,4.0557861328125,torch.float8_e4m3fnuz,torch.float16
57344,1337,8192,hipblaslt,77938,1.2360850334167481,torch.float8_e4m3fnuz,torch.float16
10240,2227,8192,hipblaslt,77916,0.3696495532989502,torch.float8_e4m3fnuz,torch.float16
57344,3569,8192,hipblaslt,77925,3.218417739868164,torch.float8_e4m3fnuz,torch.float16
8192,6883,8192,hipblaslt,77942,0.8521081924438476,torch.float8_e4m3fnuz,torch.float16
8192,4524,8192,hipblaslt,77917,0.6056011199951172,torch.float8_e4m3fnuz,torch.float16
8192,5647,28672,hipblaslt,77924,2.642782783508301,torch.float8_e4m3fnuz,torch.float16
8192,1872,8192,hipblaslt,77925,0.2568985462188721,torch.float8_e4m3fnuz,torch.float16
57344,3761,8192,hipblaslt,77925,3.482767105102539,torch.float8_e4m3fnuz,torch.float16
57344,3810,8192,hipblaslt,77913,3.5007675170898436,torch.float8_e4m3fnuz,torch.float16
8192,4049,28672,hipblaslt,77924,1.800917625427246,torch.float8_e4m3fnuz,torch.float16
8192,3495,8192,hipblaslt,77496,0.44100127220153806,torch.float8_e4m3fnuz,torch.float16
8192,1056,8192,hipblaslt,77396,0.16355429887771605,torch.float8_e4m3fnuz,torch.float16
10240,1369,8192,hipblaslt,77926,0.2511379957199097,torch.float8_e4m3fnuz,torch.float16
57344,2331,8192,hipblaslt,77952,2.251745414733887,torch.float8_e4m3fnuz,torch.float16
10240,2695,8192,hipblaslt,77496,0.4331756591796875,torch.float8_e4m3fnuz,torch.float16
10240,1441,8192,hipblaslt,77897,0.2605839967727661,torch.float8_e4m3fnuz,torch.float16
10240,494,8192,hipblaslt,42417,0.11854360103607178,torch.float8_e4m3fnuz,torch.float16
8192,2025,8192,hipblaslt,77768,0.28086204528808595,torch.float8_e4m3fnuz,torch.float16
8192,2236,28672,hipblaslt,77927,1.1010809898376466,torch.float8_e4m3fnuz,torch.float16
8192,3069,8192,hipblaslt,77895,0.40585718154907224,torch.float8_e4m3fnuz,torch.float16
8192,100,28672,hipblaslt,76736,0.10700850486755371,torch.float8_e4m3fnuz,torch.float16
57344,92,8192,hipblaslt,77989,0.17892500162124633,torch.float8_e4m3fnuz,torch.float16
8192,3103,28672,hipblaslt,77895,1.3989944458007812,torch.float8_e4m3fnuz,torch.float16
8192,983,8192,hipblaslt,77388,0.14549950361251832,torch.float8_e4m3fnuz,torch.float16
8192,2133,28672,hipblaslt,77927,1.095198154449463,torch.float8_e4m3fnuz,torch.float16
8192,1350,8192,hipblaslt,77916,0.1908666968345642,torch.float8_e4m3fnuz,torch.float16
10240,1789,8192,hipblaslt,77830,0.30415055751800535,torch.float8_e4m3fnuz,torch.float16
57344,5357,8192,hipblaslt,77719,4.808567047119141,torch.float8_e4m3fnuz,torch.float16
57344,910,8192,hipblaslt,77903,0.9056896209716797,torch.float8_e4m3fnuz,torch.float16
8192,4159,28672,hipblaslt,77924,1.8109283447265625,torch.float8_e4m3fnuz,torch.float16
8192,3705,8192,hipblaslt,77924,0.47541823387146,torch.float8_e4m3fnuz,torch.float16
8192,270,8192,hipblaslt,77303,0.0701328992843628,torch.float8_e4m3fnuz,torch.float16
10240,11,8192,hipblaslt,77249,0.032507649064064024,torch.float8_e4m3fnuz,torch.float16
10240,4511,8192,hipblaslt,77924,0.7234196662902832,torch.float8_e4m3fnuz,torch.float16
10240,4535,8192,hipblaslt,77924,0.7198378086090088,torch.float8_e4m3fnuz,torch.float16
10240,2457,8192,hipblaslt,77917,0.40706501007080076,torch.float8_e4m3fnuz,torch.float16
8192,1771,28672,hipblaslt,77950,0.7958178043365478,torch.float8_e4m3fnuz,torch.float16
57344,544,8192,hipblaslt,77937,0.5843716144561768,torch.float8_e4m3fnuz,torch.float16
8192,3175,28672,hipblaslt,77950,1.4914974212646483,torch.float8_e4m3fnuz,torch.float16
8192,2001,28672,hipblaslt,77923,0.8939686775207519,torch.float8_e4m3fnuz,torch.float16
57344,1825,8192,hipblaslt,77952,1.750398826599121,torch.float8_e4m3fnuz,torch.float16
57344,2867,8192,hipblaslt,77925,2.638382148742676,torch.float8_e4m3fnuz,torch.float16
10240,7794,8192,hipblaslt,77921,1.1862112045288087,torch.float8_e4m3fnuz,torch.float16
8192,868,8192,hipblaslt,77399,0.14134340286254882,torch.float8_e4m3fnuz,torch.float16
8192,4627,28672,hipblaslt,77895,2.123599624633789,torch.float8_e4m3fnuz,torch.float16
10240,2276,8192,hipblaslt,77424,0.3828831434249878,torch.float8_e4m3fnuz,torch.float16
8192,3078,8192,hipblaslt,77895,0.40176916122436523,torch.float8_e4m3fnuz,torch.float16
8192,2651,28672,hipblaslt,77937,1.266231632232666,torch.float8_e4m3fnuz,torch.float16
8192,1358,8192,hipblaslt,77916,0.19158024787902833,torch.float8_e4m3fnuz,torch.float16
10240,5237,8192,hipblaslt,77877,0.8370198249816895,torch.float8_e4m3fnuz,torch.float16
8192,2214,28672,hipblaslt,77927,1.1109155654907226,torch.float8_e4m3fnuz,torch.float16
10240,5599,8192,hipblaslt,77984,0.8596975326538085,torch.float8_e4m3fnuz,torch.float16
57344,5308,8192,hipblaslt,77719,4.783670043945312,torch.float8_e4m3fnuz,torch.float16
57344,601,8192,hipblaslt,77961,0.6284989356994629,torch.float8_e4m3fnuz,torch.float16
8192,64882,8192,hipblaslt,77924,7.653127230130709,torch.float8_e4m3fnuz,torch.float16
8192,2857,8192,hipblaslt,77929,0.37673006057739256,torch.float8_e4m3fnuz,torch.float16
57344,2096,8192,hipblaslt,77952,1.998392105102539,torch.float8_e4m3fnuz,torch.float16
10240,166,8192,hipblaslt,76782,0.05610514879226684,torch.float8_e4m3fnuz,torch.float16
8192,562,8192,hipblaslt,77392,0.10491640567779541,torch.float8_e4m3fnuz,torch.float16
57344,3876,8192,hipblaslt,78012,3.5467861175537108,torch.float8_e4m3fnuz,torch.float16
10240,2497,8192,hipblaslt,77720,0.41957550048828124,torch.float8_e4m3fnuz,torch.float16
8192,65379,8192,hipblaslt,77921,7.6907094319661455,torch.float8_e4m3fnuz,torch.float16
57344,326,8192,hipblaslt,77937,0.40011072158813477,torch.float8_e4m3fnuz,torch.float16
8192,5665,28672,hipblaslt,77755,2.6632831573486326,torch.float8_e4m3fnuz,torch.float16
8192,6128,28672,hipblaslt,77924,2.693800354003906,torch.float8_e4m3fnuz,torch.float16
8192,2196,28672,hipblaslt,77956,1.0992202758789062,torch.float8_e4m3fnuz,torch.float16
8192,406,8192,hipblaslt,42415,0.08204355239868164,torch.float8_e4m3fnuz,torch.float16
8192,1828,8192,hipblaslt,77926,0.256822395324707,torch.float8_e4m3fnuz,torch.float16
57344,3822,8192,hipblaslt,77952,3.488575744628906,torch.float8_e4m3fnuz,torch.float16
8192,1448,8192,hipblaslt,77917,0.20172479152679443,torch.float8_e4m3fnuz,torch.float16
57344,1046,8192,hipblaslt,77938,1.030400276184082,torch.float8_e4m3fnuz,torch.float16
10240,3889,8192,hipblaslt,77901,0.6298930644989014,torch.float8_e4m3fnuz,torch.float16
10240,65412,8192,hipblaslt,77923,9.77879163953993,torch.float8_e4m3fnuz,torch.float16
10240,4862,8192,hipblaslt,77977,0.7646185874938964,torch.float8_e4m3fnuz,torch.float16
8192,3836,28672,hipblaslt,77924,1.775898551940918,torch.float8_e4m3fnuz,torch.float16
10240,6660,8192,hipblaslt,77922,0.9957950592041016,torch.float8_e4m3fnuz,torch.float16
8192,3929,28672,hipblaslt,77925,1.797096061706543,torch.float8_e4m3fnuz,torch.float16
8192,1641,8192,hipblaslt,77720,0.22294225692749023,torch.float8_e4m3fnuz,torch.float16
10240,4976,8192,hipblaslt,78016,0.8124695777893066,torch.float8_e4m3fnuz,torch.float16
57344,5104,8192,hipblaslt,78012,4.613203430175782,torch.float8_e4m3fnuz,torch.float16
8192,2108,28672,hipblaslt,77956,1.084388256072998,torch.float8_e4m3fnuz,torch.float16
10240,931,8192,hipblaslt,77723,0.17528159618377687,torch.float8_e4m3fnuz,torch.float16
57344,5586,8192,hipblaslt,77880,4.987957201505962,torch.float8_e4m3fnuz,torch.float16
8192,828,8192,hipblaslt,77869,0.1371772050857544,torch.float8_e4m3fnuz,torch.float16
57344,2386,8192,hipblaslt,77952,2.2407852172851563,torch.float8_e4m3fnuz,torch.float16
8192,7418,28672,hipblaslt,77918,3.455322265625,torch.float8_e4m3fnuz,torch.float16
8192,5292,28672,hipblaslt,78017,2.3420551300048826,torch.float8_e4m3fnuz,torch.float16
8192,123,8192,hipblaslt,42518,0.04588994979858398,torch.float8_e4m3fnuz,torch.float16
57344,3290,8192,hipblaslt,77925,3.0591314315795897,torch.float8_e4m3fnuz,torch.float16
57344,3516,8192,hipblaslt,77925,3.198734474182129,torch.float8_e4m3fnuz,torch.float16
10240,1523,8192,hipblaslt,77925,0.26118290424346924,torch.float8_e4m3fnuz,torch.float16
10240,211,8192,hipblaslt,76783,0.06970524787902832,torch.float8_e4m3fnuz,torch.float16
57344,3514,8192,hipblaslt,77925,3.1936607360839844,torch.float8_e4m3fnuz,torch.float16
8192,5843,28672,hipblaslt,77924,2.6579311370849608,torch.float8_e4m3fnuz,torch.float16
8192,3605,8192,hipblaslt,77890,0.4424093723297119,torch.float8_e4m3fnuz,torch.float16
8192,935,8192,hipblaslt,77593,0.15292855501174926,torch.float8_e4m3fnuz,torch.float16
8192,4279,8192,hipblaslt,77495,0.5506376266479492,torch.float8_e4m3fnuz,torch.float16
57344,5998,8192,hipblaslt,78012,5.318580627441406,torch.float8_e4m3fnuz,torch.float16
8192,3731,28672,hipblaslt,77924,1.770222282409668,torch.float8_e4m3fnuz,torch.float16
10240,97,8192,hipblaslt,77857,0.04867910146713257,torch.float8_e4m3fnuz,torch.float16
8192,1306,8192,hipblaslt,77455,0.19750654697418213,torch.float8_e4m3fnuz,torch.float16
10240,405,8192,hipblaslt,77400,0.10994484424591064,torch.float8_e4m3fnuz,torch.float16
8192,2501,8192,hipblaslt,77829,0.3330253601074219,torch.float8_e4m3fnuz,torch.float16
8192,962,28672,hipblaslt,42477,0.5194854736328125,torch.float8_e4m3fnuz,torch.float16
8192,2255,28672,hipblaslt,42477,1.1208342552185058,torch.float8_e4m3fnuz,torch.float16
57344,5028,8192,hipblaslt,78012,4.56158332824707,torch.float8_e4m3fnuz,torch.float16
57344,2457,8192,hipblaslt,77952,2.274551200866699,torch.float8_e4m3fnuz,torch.float16
8192,1035,8192,hipblaslt,42423,0.16418524980545043,torch.float8_e4m3fnuz,torch.float16
8192,1696,8192,hipblaslt,77984,0.22154109477996825,torch.float8_e4m3fnuz,torch.float16
8192,2788,28672,hipblaslt,77928,1.339033603668213,torch.float8_e4m3fnuz,torch.float16
8192,1510,28672,hipblaslt,77961,0.6948873043060303,torch.float8_e4m3fnuz,torch.float16
8192,1714,8192,hipblaslt,77720,0.2227278470993042,torch.float8_e4m3fnuz,torch.float16
57344,874,8192,hipblaslt,77926,0.8295828819274902,torch.float8_e4m3fnuz,torch.float16
57344,7858,8192,hipblaslt,77903,7.264440683218149,torch.float8_e4m3fnuz,torch.float16
57344,6349,8192,hipblaslt,77925,5.875342845916748,torch.float8_e4m3fnuz,torch.float16
8192,2564,8192,hipblaslt,77829,0.34072868824005126,torch.float8_e4m3fnuz,torch.float16
57344,168,8192,hipblaslt,77498,0.24692180156707763,torch.float8_e4m3fnuz,torch.float16
8192,4951,8192,hipblaslt,77890,0.6245731830596923,torch.float8_e4m3fnuz,torch.float16
8192,2686,28672,hipblaslt,77937,1.280078125,torch.float8_e4m3fnuz,torch.float16
10240,3899,8192,hipblaslt,77984,0.6317577838897706,torch.float8_e4m3fnuz,torch.float16
8192,2209,8192,hipblaslt,77593,0.30554258823394775,torch.float8_e4m3fnuz,torch.float16
8192,47,8192,hipblaslt,77290,0.03409050107002258,torch.float8_e4m3fnuz,torch.float16
8192,569,28672,hipblaslt,76918,0.3340708494186401,torch.float8_e4m3fnuz,torch.float16
10240,245,8192,hipblaslt,76645,0.07277179956436157,torch.float8_e4m3fnuz,torch.float16
8192,892,8192,hipblaslt,77399,0.14335235357284545,torch.float8_e4m3fnuz,torch.float16
8192,4616,28672,hipblaslt,77967,2.1236438751220703,torch.float8_e4m3fnuz,torch.float16
8192,2532,8192,hipblaslt,77960,0.35006859302520754,torch.float8_e4m3fnuz,torch.float16
57344,1005,8192,hipblaslt,77950,0.9472110748291016,torch.float8_e4m3fnuz,torch.float16
8192,2291,28672,hipblaslt,77388,1.1297114372253418,torch.float8_e4m3fnuz,torch.float16
8192,3785,28672,hipblaslt,77924,1.77430419921875,torch.float8_e4m3fnuz,torch.float16
10240,596,8192,hipblaslt,77613,0.13556485176086425,torch.float8_e4m3fnuz,torch.float16
57344,3993,8192,hipblaslt,78012,3.579438400268555,torch.float8_e4m3fnuz,torch.float16
8192,874,8192,hipblaslt,77869,0.13772549629211425,torch.float8_e4m3fnuz,torch.float16
8192,4754,28672,hipblaslt,77903,2.2529592514038086,torch.float8_e4m3fnuz,torch.float16
8192,3861,28672,hipblaslt,77924,1.7795719146728515,torch.float8_e4m3fnuz,torch.float16
8192,4031,8192,hipblaslt,77924,0.4926137447357178,torch.float8_e4m3fnuz,torch.float16
10240,3594,8192,hipblaslt,77984,0.5986507892608642,torch.float8_e4m3fnuz,torch.float16
8192,3495,28672,hipblaslt,78018,1.5729180335998536,torch.float8_e4m3fnuz,torch.float16
8192,91,28672,hipblaslt,76887,0.10473514795303344,torch.float8_e4m3fnuz,torch.float16
10240,536,8192,hipblaslt,77393,0.12496910095214844,torch.float8_e4m3fnuz,torch.float16
10240,577,8192,hipblaslt,77869,0.13379014730453492,torch.float8_e4m3fnuz,torch.float16
10240,6971,8192,hipblaslt,78016,1.0696443557739257,torch.float8_e4m3fnuz,torch.float16
57344,1891,8192,hipblaslt,77913,1.7896169662475585,torch.float8_e4m3fnuz,torch.float16
57344,1013,8192,hipblaslt,77939,0.9366935729980469,torch.float8_e4m3fnuz,torch.float16
10240,6343,8192,hipblaslt,77922,0.9632669448852539,torch.float8_e4m3fnuz,torch.float16
10240,1801,8192,hipblaslt,77912,0.31664304733276366,torch.float8_e4m3fnuz,torch.float16
8192,4274,8192,hipblaslt,77916,0.5531033039093017,torch.float8_e4m3fnuz,torch.float16
10240,386,8192,hipblaslt,77400,0.10501954555511475,torch.float8_e4m3fnuz,torch.float16
8192,3322,28672,hipblaslt,77950,1.5186196327209474,torch.float8_e4m3fnuz,torch.float16
57344,5483,8192,hipblaslt,77880,4.9901877955386515,torch.float8_e4m3fnuz,torch.float16
8192,954,28672,hipblaslt,77593,0.5284848690032959,torch.float8_e4m3fnuz,torch.float16
57344,1828,8192,hipblaslt,77952,1.7534774780273437,torch.float8_e4m3fnuz,torch.float16
8192,1255,8192,hipblaslt,77424,0.1875738501548767,torch.float8_e4m3fnuz,torch.float16
8192,856,28672,hipblaslt,77399,0.4805778980255127,torch.float8_e4m3fnuz,torch.float16
10240,5335,8192,hipblaslt,77973,0.8374945640563964,torch.float8_e4m3fnuz,torch.float16
10240,3461,8192,hipblaslt,77976,0.5611813068389893,torch.float8_e4m3fnuz,torch.float16
10240,3695,8192,hipblaslt,77973,0.6137251377105712,torch.float8_e4m3fnuz,torch.float16
10240,156,8192,hipblaslt,77374,0.061240702867507935,torch.float8_e4m3fnuz,torch.float16
8192,2452,28672,hipblaslt,77937,1.2148555755615233,torch.float8_e4m3fnuz,torch.float16
10240,3132,8192,hipblaslt,77922,0.49126567840576174,torch.float8_e4m3fnuz,torch.float16
8192,127,8192,hipblaslt,76626,0.04677324891090393,torch.float8_e4m3fnuz,torch.float16
8192,967,8192,hipblaslt,77388,0.1504488468170166,torch.float8_e4m3fnuz,torch.float16
8192,687,28672,hipblaslt,77419,0.44191460609436034,torch.float8_e4m3fnuz,torch.float16
57344,3005,8192,hipblaslt,78017,2.734762954711914,torch.float8_e4m3fnuz,torch.float16
8192,808,8192,hipblaslt,77869,0.1351602554321289,torch.float8_e4m3fnuz,torch.float16
57344,1617,8192,hipblaslt,77952,1.5607899665832519,torch.float8_e4m3fnuz,torch.float16
10240,1800,8192,hipblaslt,77957,0.32051475048065187,torch.float8_e4m3fnuz,torch.float16
57344,677,8192,hipblaslt,77945,0.7028271198272705,torch.float8_e4m3fnuz,torch.float16
8192,1197,28672,hipblaslt,77424,0.6393670558929443,torch.float8_e4m3fnuz,torch.float16
8192,816,28672,hipblaslt,77399,0.4745288848876953,torch.float8_e4m3fnuz,torch.float16
8192,950,28672,hipblaslt,77870,0.5141905784606934,torch.float8_e4m3fnuz,torch.float16
8192,2379,8192,hipblaslt,77957,0.31723389625549314,torch.float8_e4m3fnuz,torch.float16
8192,1882,8192,hipblaslt,77926,0.2559601545333862,torch.float8_e4m3fnuz,torch.float16
57344,5118,8192,hipblaslt,78012,4.605217742919922,torch.float8_e4m3fnuz,torch.float16
8192,1189,8192,hipblaslt,77495,0.18455740213394164,torch.float8_e4m3fnuz,torch.float16
57344,3809,8192,hipblaslt,77942,3.495383453369141,torch.float8_e4m3fnuz,torch.float16
10240,4206,8192,hipblaslt,77890,0.6560017585754394,torch.float8_e4m3fnuz,torch.float16
10240,4236,8192,hipblaslt,77924,0.6916124820709229,torch.float8_e4m3fnuz,torch.float16
57344,1820,8192,hipblaslt,77952,1.7514123916625977,torch.float8_e4m3fnuz,torch.float16
8192,2827,8192,hipblaslt,77495,0.37553629875183103,torch.float8_e4m3fnuz,torch.float16
8192,65437,8192,hipblaslt,77922,7.681535085042317,torch.float8_e4m3fnuz,torch.float16
57344,987,8192,hipblaslt,77939,0.9443387985229492,torch.float8_e4m3fnuz,torch.float16
8192,1719,28672,hipblaslt,77950,0.7713145732879638,torch.float8_e4m3fnuz,torch.float16
8192,461,28672,hipblaslt,77188,0.29406108856201174,torch.float8_e4m3fnuz,torch.float16
8192,4561,8192,hipblaslt,77917,0.5886740684509277,torch.float8_e4m3fnuz,torch.float16
57344,2959,8192,hipblaslt,78017,2.7175134658813476,torch.float8_e4m3fnuz,torch.float16
8192,310,8192,hipblaslt,76644,0.06791765093803406,torch.float8_e4m3fnuz,torch.float16
8192,2970,28672,hipblaslt,77917,1.3875353813171387,torch.float8_e4m3fnuz,torch.float16
8192,65510,8192,hipblaslt,77924,7.681875864664714,torch.float8_e4m3fnuz,torch.float16
57344,4988,8192,hipblaslt,77925,4.5724632263183596,torch.float8_e4m3fnuz,torch.float16
57344,1595,8192,hipblaslt,77952,1.5450225830078126,torch.float8_e4m3fnuz,torch.float16
10240,4543,8192,hipblaslt,77897,0.7318701267242431,torch.float8_e4m3fnuz,torch.float16
57344,2515,8192,hipblaslt,77950,2.319143295288086,torch.float8_e4m3fnuz,torch.float16
8192,6371,28672,hipblaslt,77719,3.018815803527832,torch.float8_e4m3fnuz,torch.float16
8192,6664,8192,hipblaslt,77942,0.8413082122802734,torch.float8_e4m3fnuz,torch.float16
8192,1006,8192,hipblaslt,77388,0.15141575336456298,torch.float8_e4m3fnuz,torch.float16
8192,3516,8192,hipblaslt,77903,0.43739995956420896,torch.float8_e4m3fnuz,torch.float16
57344,2225,8192,hipblaslt,77952,2.0591922760009767,torch.float8_e4m3fnuz,torch.float16
57344,23648,8192,hipblaslt,77880,21.136767578125,torch.float8_e4m3fnuz,torch.float16
57344,3264,8192,hipblaslt,77952,3.0239194869995116,torch.float8_e4m3fnuz,torch.float16
10240,64958,8192,hipblaslt,77923,9.717578887939453,torch.float8_e4m3fnuz,torch.float16
10240,927,8192,hipblaslt,77873,0.18723535537719727,torch.float8_e4m3fnuz,torch.float16
8192,1233,8192,hipblaslt,77424,0.18486385345458983,torch.float8_e4m3fnuz,torch.float16
8192,1701,8192,hipblaslt,77945,0.2222752571105957,torch.float8_e4m3fnuz,torch.float16
57344,1882,8192,hipblaslt,77952,1.8034173965454101,torch.float8_e4m3fnuz,torch.float16
57344,1141,8192,hipblaslt,77935,1.1000354766845704,torch.float8_e4m3fnuz,torch.float16
57344,1212,8192,hipblaslt,77950,1.1653922080993653,torch.float8_e4m3fnuz,torch.float16
57344,800,8192,hipblaslt,77956,0.8116602897644043,torch.float8_e4m3fnuz,torch.float16
57344,6064,8192,hipblaslt,78012,5.404127681956572,torch.float8_e4m3fnuz,torch.float16
57344,2256,8192,hipblaslt,77952,2.080680084228516,torch.float8_e4m3fnuz,torch.float16
8192,4001,8192,hipblaslt,77921,0.4900379180908203,torch.float8_e4m3fnuz,torch.float16
8192,4001,28672,hipblaslt,77924,1.7850341796875,torch.float8_e4m3fnuz,torch.float16
8192,3641,8192,hipblaslt,77973,0.4439977169036865,torch.float8_e4m3fnuz,torch.float16
8192,1818,28672,hipblaslt,77921,0.8749019622802734,torch.float8_e4m3fnuz,torch.float16
10240,1643,8192,hipblaslt,77614,0.30381805896759034,torch.float8_e4m3fnuz,torch.float16
8192,4057,28672,hipblaslt,77924,1.7993274688720704,torch.float8_e4m3fnuz,torch.float16
8192,3057,8192,hipblaslt,77967,0.39728550910949706,torch.float8_e4m3fnuz,torch.float16
8192,1749,28672,hipblaslt,77950,0.7774015426635742,torch.float8_e4m3fnuz,torch.float16
10240,4584,8192,hipblaslt,77924,0.7297609806060791,torch.float8_e4m3fnuz,torch.float16
57344,6049,8192,hipblaslt,78012,5.443051656087239,torch.float8_e4m3fnuz,torch.float16
8192,416,8192,hipblaslt,42415,0.08074960112571716,torch.float8_e4m3fnuz,torch.float16
8192,4449,28672,hipblaslt,77696,2.022978591918945,torch.float8_e4m3fnuz,torch.float16
8192,4550,8192,hipblaslt,77928,0.6005516052246094,torch.float8_e4m3fnuz,torch.float16
57344,2005,8192,hipblaslt,77880,1.8657215118408204,torch.float8_e4m3fnuz,torch.float16
57344,1824,8192,hipblaslt,77945,1.776515579223633,torch.float8_e4m3fnuz,torch.float16
10240,65301,8192,hipblaslt,77923,9.774949645996093,torch.float8_e4m3fnuz,torch.float16
10240,2975,8192,hipblaslt,77921,0.486474609375,torch.float8_e4m3fnuz,torch.float16
8192,5481,28672,hipblaslt,77755,2.538117599487305,torch.float8_e4m3fnuz,torch.float16
10240,437,8192,hipblaslt,77400,0.10831849575042725,torch.float8_e4m3fnuz,torch.float16
57344,2849,8192,hipblaslt,77925,2.6362449645996096,torch.float8_e4m3fnuz,torch.float16
8192,2536,28672,hipblaslt,77769,1.2427047729492187,torch.float8_e4m3fnuz,torch.float16
8192,1498,28672,hipblaslt,77961,0.7097733974456787,torch.float8_e4m3fnuz,torch.float16
57344,1786,8192,hipblaslt,77925,1.608095932006836,torch.float8_e4m3fnuz,torch.float16
57344,908,28672,hipblaslt,77939,3.066708564758301,torch.float8_e4m3fnuz,torch.float16
8192,2010,28672,hipblaslt,77924,0.9020482063293457,torch.float8_e4m3fnuz,torch.float16
8192,2637,28672,hipblaslt,77937,1.2930933952331543,torch.float8_e4m3fnuz,torch.float16
10240,2345,8192,hipblaslt,77710,0.3876502513885498,torch.float8_e4m3fnuz,torch.float16
8192,2814,28672,hipblaslt,77424,1.3436623573303224,torch.float8_e4m3fnuz,torch.float16
8192,3816,8192,hipblaslt,77921,0.4847400665283203,torch.float8_e4m3fnuz,torch.float16
8192,3790,28672,hipblaslt,77924,1.7746747970581054,torch.float8_e4m3fnuz,torch.float16
10240,5644,8192,hipblaslt,78016,0.8675350189208985,torch.float8_e4m3fnuz,torch.float16
8192,1393,28672,hipblaslt,77976,0.6783267498016358,torch.float8_e4m3fnuz,torch.float16
8192,3578,28672,hipblaslt,77903,1.5836398124694824,torch.float8_e4m3fnuz,torch.float16
57344,6838,8192,hipblaslt,77880,6.111087036132813,torch.float8_e4m3fnuz,torch.float16
